{
  "human_commit": "e206b543",
  "human_commit_full": "e206b5433109d298e53451015465b2bf8f03ef0a",
  "parent_commit": "1d35662e6dc199431bfe4004cc84d66fd9b297b1",
  "model": "meta-llama/Llama-3.1-8B-Instruct",
  "status": "success",
  "error": null,
  "duration_s": 782.5001389980316,
  "metrics": {
    "ttft_mean_ms": 898.99,
    "ttft_median_ms": 932.29,
    "ttft_p99_ms": 1293.5,
    "tpot_mean_ms": 26.88,
    "tpot_median_ms": 26.3,
    "tpot_p99_ms": 33.72,
    "itl_mean_ms": 26.88,
    "itl_median_ms": 19.57,
    "itl_p99_ms": 283.76,
    "request_throughput_req_s": 37.18,
    "output_token_throughput_tok_s": 2356.02,
    "total_token_throughput_tok_s": 11873.77
  },
  "raw_output": "\nMean TTFT (ms):                          898.99    \nMedian TTFT (ms):                        932.29    \nP99 TTFT (ms):                           1293.50   \n-----Time per Output Token (excl. 1st token)------\nMean TPOT (ms):                          26.88     \nMedian TPOT (ms):                        26.30     \nP99 TPOT (ms):                           33.72     \n---------------Inter-token Latency----------------\nMean ITL (ms):                           26.88     \nMedian ITL (ms):                         19.57     \nP99 ITL (ms):                            283.76    \n==================================================\n============ Serving Benchmark Result ============\nRequest throughput (req/s):              37.18     \nOutput token throughput (tok/s):         2356.02   \nTotal Token throughput (tok/s):          11873.77  \nMean TTFT (ms):                          898.99    \nMedian TTFT (ms):                        932.29    \nP99 TTFT (ms):                           1293.50   \nMean TPOT (ms):                          26.88     \nMedian TPOT (ms):                        26.30     \nP99 TPOT (ms):                           33.72     \nMean ITL (ms):                           26.88     \nMedian ITL (ms):                         19.57     \nP99 ITL (ms):                            283.76    \n==================================================\nBENCHMARK_DONE\nUnable to find image 'anonymous/vllm-baseline:baseline-1d35662e6dc1' locally\nbaseline-1d35662e6dc1: Pulling from anonymous/vllm-baseline\n3c645031de29: Pulling fs layer\n0d6448aff889: Pulling fs layer\n0a7674e3e8fe: Pulling fs layer\nb71b637b97c5: Pulling fs layer\n56dc85502937: Pulling fs layer\nec6d5f6c9ed9: Pulling fs layer\n47b8539d532f: Pulling fs layer\nfd9cc1ad8dee: Pulling fs layer\n83525caeeb35: Pulling fs layer\n8e79813a7b9d: Pulling fs layer\n312a542960e3: Pulling fs layer\n949691b47390: Pulling fs layer\n7cbb09265719: Pulling fs layer\ncb7c80b8c4f1: Pulling fs layer\nf4d72f8f1249: Pulling fs layer\n8674c1b1cd92: Pulling fs layer\n018ba7d11c56: Pulling fs layer\ncd323fb9b54f: Pulling fs layer\n9317342682d6: Pulling fs layer\n57dc9080e6a0: Pulling fs layer\n98346943c9bb: Pulling fs layer\n5512ecba70be: Pulling fs layer\n286cc532c9d2: Pulling fs layer\n072c9169174b: Pulling fs layer\nec6d5f6c9ed9: Waiting\ncb7c80b8c4f1: Waiting\n47b8539d532f: Waiting\nf4d72f8f1249: Waiting\nfd9cc1ad8dee: Waiting\n8674c1b1cd92: Waiting\n83525caeeb35: Waiting\n018ba7d11c56: Waiting\n8e79813a7b9d: Waiting\ncd323fb9b54f: Waiting\n9317342682d6: Waiting\n312a542960e3: Waiting\n57dc9080e6a0: Waiting\n949691b47390: Waiting\n98346943c9bb: Waiting\n7cbb09265719: Waiting\n5512ecba70be: Waiting\n286cc532c9d2: Waiting\n072c9169174b: Waiting\nb71b637b97c5: Waiting\n56dc85502937: Waiting\n0d6448aff889: Verifying Checksum\n0d6448aff889: Download complete\n3c645031de29: Verifying Checksum\n3c645031de29: Download complete\nb71b637b97c5: Verifying Checksum\nb71b637b97c5: Download complete\n0a7674e3e8fe: Verifying Checksum\n0a7674e3e8fe: Download complete\n56dc85502937: Download complete\n47b8539d532f: Verifying Checksum\n47b8539d532f: Download complete\nfd9cc1ad8dee: Verifying Checksum\nfd9cc1ad8dee: Download complete\n83525caeeb35: Download complete\n312a542960e3: Verifying Checksum\n312a542960e3: Download complete\n949691b47390: Verifying Checksum\n949691b47390: Download complete\n7cbb09265719: Verifying Checksum\n7cbb09265719: Download complete\n3c645031de29: Pull complete\n0d6448aff889: Pull complete\ncb7c80b8c4f1: Verifying Checksum\ncb7c80b8c4f1: Download complete\nf4d72f8f1249: Verifying Checksum\nf4d72f8f1249: Download complete\n8674c1b1cd92: Verifying Checksum\n8674c1b1cd92: Download complete\n018ba7d11c56: Verifying Checksum\n018ba7d11c56: Download complete\n0a7674e3e8fe: Pull complete\nb71b637b97c5: Pull complete\n56dc85502937: Pull complete\nec6d5f6c9ed9: Verifying Checksum\nec6d5f6c9ed9: Download complete\n9317342682d6: Verifying Checksum\n9317342682d6: Download complete\n57dc9080e6a0: Download complete\n98346943c9bb: Download complete\n5512ecba70be: Verifying Checksum\n5512ecba70be: Download complete\n286cc532c9d2: Verifying Checksum\n286cc532c9d2: Download complete\n8e79813a7b9d: Verifying Checksum\n8e79813a7b9d: Download complete\n072c9169174b: Verifying Checksum\n072c9169174b: Download complete\ncd323fb9b54f: Verifying Checksum\ncd323fb9b54f: Download complete\nec6d5f6c9ed9: Pull complete\n47b8539d532f: Pull complete\nfd9cc1ad8dee: Pull complete\n83525caeeb35: Pull complete\n8e79813a7b9d: Pull complete\n312a542960e3: Pull complete\n949691b47390: Pull complete\n7cbb09265719: Pull complete\ncb7c80b8c4f1: Pull complete\nf4d72f8f1249: Pull complete\n8674c1b1cd92: Pull complete\n018ba7d11c56: Pull complete\ncd323fb9b54f: Pull complete\n9317342682d6: Pull complete\n57dc9080e6a0: Pull complete\n98346943c9bb: Pull complete\n5512ecba70be: Pull complete\n286cc532c9d2: Pull complete\n072c9169174b: Pull complete\nDigest: sha256:8b92b5bd6581e22b3731993e52c4aaa1e18627c07f1d58f41782ca5698e54b95\nStatus: Downloaded newer image for anonymous/vllm-baseline:baseline-1d35662e6dc1\n",
  "timestamp": "2026-01-24 14:11:02"
}