{
  "human_commit": "fc7b8d1e",
  "human_commit_full": "fc7b8d1eefcbe837a56b7c080509417fe5167e6c",
  "parent_commit": "67abdbb42fdbb59c274130368981c0d0ac3539e3",
  "model": "meta-llama/Llama-3.1-8B-Instruct",
  "status": "success",
  "error": null,
  "duration_s": 764.1216578483582,
  "metrics": {
    "ttft_mean_ms": 1073.91,
    "ttft_median_ms": 1059.76,
    "ttft_p99_ms": 1663.03,
    "tpot_mean_ms": 60.71,
    "tpot_median_ms": 59.45,
    "tpot_p99_ms": 76.99,
    "itl_mean_ms": 75.99,
    "itl_median_ms": 52.06,
    "itl_p99_ms": 1059.7,
    "request_throughput_req_s": 20.64,
    "output_token_throughput_tok_s": 1294.01
  },
  "raw_output": "T (ms):                           76.99     \n---------------Inter-token Latency----------------\nMean ITL (ms):                           75.99     \nMedian ITL (ms):                         52.06     \nP99 ITL (ms):                            1059.70   \n==================================================\n============ Serving Benchmark Result ============\nRequest throughput (req/s):              20.64     \nInput token throughput (tok/s):          5285.04   \nOutput token throughput (tok/s):         1294.01   \nMean TTFT (ms):                          1073.91   \nMedian TTFT (ms):                        1059.76   \nP99 TTFT (ms):                           1663.03   \nMean TPOT (ms):                          60.71     \nMedian TPOT (ms):                        59.45     \nP99 TPOT (ms):                           76.99     \nMean ITL (ms):                           75.99     \nMedian ITL (ms):                         52.06     \nP99 ITL (ms):                            1059.70   \n==================================================\nBENCHMARK_DONE\nUnable to find image 'anonymous/vllm-baseline:baseline-67abdbb42fdb' locally\nbaseline-67abdbb42fdb: Pulling from anonymous/vllm-baseline\n43cfb69dbb46: Pulling fs layer\nfbcd35dc5bc3: Pulling fs layer\nc7232af9ae05: Pulling fs layer\ndb6cdef1932a: Pulling fs layer\n56dc85502937: Pulling fs layer\nfaeb796bb7e6: Pulling fs layer\n01eb6572c8f1: Pulling fs layer\n27ea311cab37: Pulling fs layer\n993556ea2050: Pulling fs layer\n4f4fb700ef54: Pulling fs layer\naa22693e6cf8: Pulling fs layer\n3335f8ad6e31: Pulling fs layer\n470569396afc: Pulling fs layer\ndc71de2840c4: Pulling fs layer\n41418f1cc823: Pulling fs layer\nbc006d0e392c: Pulling fs layer\n26aa1c42ac5c: Pulling fs layer\n2e83a63633d7: Pulling fs layer\n110666506734: Pulling fs layer\na099b62366ca: Pulling fs layer\n34ba713c4086: Pulling fs layer\nf57876c61a43: Pulling fs layer\ndfe6a29828d6: Pulling fs layer\n644857b98e38: Pulling fs layer\nfaeb796bb7e6: Waiting\n01eb6572c8f1: Waiting\n27ea311cab37: Waiting\n993556ea2050: Waiting\n4f4fb700ef54: Waiting\n110666506734: Waiting\na099b62366ca: Waiting\n34ba713c4086: Waiting\nf57876c61a43: Waiting\naa22693e6cf8: Waiting\ndfe6a29828d6: Waiting\n3335f8ad6e31: Waiting\n644857b98e38: Waiting\nbc006d0e392c: Waiting\n26aa1c42ac5c: Waiting\ndc71de2840c4: Waiting\n470569396afc: Waiting\n2e83a63633d7: Waiting\n41418f1cc823: Waiting\ndb6cdef1932a: Waiting\n56dc85502937: Waiting\nfbcd35dc5bc3: Verifying Checksum\nfbcd35dc5bc3: Download complete\ndb6cdef1932a: Verifying Checksum\ndb6cdef1932a: Download complete\n43cfb69dbb46: Download complete\nc7232af9ae05: Verifying Checksum\nc7232af9ae05: Download complete\n56dc85502937: Download complete\nfaeb796bb7e6: Download complete\n993556ea2050: Verifying Checksum\n993556ea2050: Download complete\n4f4fb700ef54: Verifying Checksum\n4f4fb700ef54: Download complete\naa22693e6cf8: Verifying Checksum\naa22693e6cf8: Download complete\n01eb6572c8f1: Verifying Checksum\n01eb6572c8f1: Download complete\n27ea311cab37: Verifying Checksum\n27ea311cab37: Download complete\n43cfb69dbb46: Pull complete\nfbcd35dc5bc3: Pull complete\n470569396afc: Verifying Checksum\n470569396afc: Download complete\n41418f1cc823: Verifying Checksum\n41418f1cc823: Download complete\nc7232af9ae05: Pull complete\ndb6cdef1932a: Pull complete\n56dc85502937: Pull complete\nfaeb796bb7e6: Pull complete\ndc71de2840c4: Verifying Checksum\ndc71de2840c4: Download complete\n26aa1c42ac5c: Verifying Checksum\n26aa1c42ac5c: Download complete\n2e83a63633d7: Verifying Checksum\n2e83a63633d7: Download complete\n110666506734: Verifying Checksum\n110666506734: Download complete\na099b62366ca: Download complete\n34ba713c4086: Verifying Checksum\n34ba713c4086: Download complete\nf57876c61a43: Download complete\ndfe6a29828d6: Verifying Checksum\ndfe6a29828d6: Download complete\n644857b98e38: Verifying Checksum\n644857b98e38: Download complete\n01eb6572c8f1: Pull complete\n3335f8ad6e31: Verifying Checksum\n3335f8ad6e31: Download complete\n27ea311cab37: Pull complete\n993556ea2050: Pull complete\n4f4fb700ef54: Pull complete\naa22693e6cf8: Pull complete\nbc006d0e392c: Verifying Checksum\nbc006d0e392c: Download complete\n3335f8ad6e31: Pull complete\n470569396afc: Pull complete\ndc71de2840c4: Pull complete\n41418f1cc823: Pull complete\nbc006d0e392c: Pull complete\n26aa1c42ac5c: Pull complete\n2e83a63633d7: Pull complete\n110666506734: Pull complete\na099b62366ca: Pull complete\n34ba713c4086: Pull complete\nf57876c61a43: Pull complete\ndfe6a29828d6: Pull complete\n644857b98e38: Pull complete\nDigest: sha256:f7994230ac6905bc4b9001ae0e6f236a45840ceb2ccc5595c0109a727f18e3b4\nStatus: Downloaded newer image for anonymous/vllm-baseline:baseline-67abdbb42fdb\n/usr/local/lib/python3.10/dist-packages/pyairports/airports.py:1: UserWarning: pkg_resources is deprecated as an API. See https://setuptools.pypa.io/en/latest/pkg_resources.html. The pkg_resources package is slated for removal as early as 2025-11-30. Refrain from using this package or pin to Setuptools<81.\n  from pkg_resources import resource_string\n",
  "timestamp": "2026-01-24 15:11:13"
}