{
  "human_commit": "22d33bac",
  "human_commit_full": "22d33baca2c0c639cfd45c48e99803e56c3efa74",
  "parent_commit": "b0e96aaebbfbe8e70478e4192a5a13864ffdefa6",
  "model": "meta-llama/Llama-3.1-8B-Instruct",
  "status": "success",
  "error": null,
  "duration_s": 894.8740158081055,
  "metrics": {
    "ttft_mean_ms": 792.85,
    "ttft_median_ms": 743.85,
    "ttft_p99_ms": 1217.61,
    "tpot_mean_ms": 33.11,
    "tpot_median_ms": 27.29,
    "tpot_p99_ms": 211.48,
    "itl_mean_ms": 26.64,
    "itl_median_ms": 18.84,
    "itl_p99_ms": 400.59,
    "request_throughput_req_s": 39.61,
    "output_token_throughput_tok_s": 2453.25,
    "total_token_throughput_tok_s": 12592.61
  },
  "raw_output": "me to First Token----------------\nMean TTFT (ms):                          792.85    \nMedian TTFT (ms):                        743.85    \nP99 TTFT (ms):                           1217.61   \n-----Time per Output Token (excl. 1st token)------\nMean TPOT (ms):                          33.11     \nMedian TPOT (ms):                        27.29     \nP99 TPOT (ms):                           211.48    \n---------------Inter-token Latency----------------\nMean ITL (ms):                           26.64     \nMedian ITL (ms):                         18.84     \nP99 ITL (ms):                            400.59    \n==================================================\n============ Serving Benchmark Result ============\nRequest throughput (req/s):              39.61     \nOutput token throughput (tok/s):         2453.25   \nTotal Token throughput (tok/s):          12592.61  \nMean TTFT (ms):                          792.85    \nMedian TTFT (ms):                        743.85    \nP99 TTFT (ms):                           1217.61   \nMean TPOT (ms):                          33.11     \nMedian TPOT (ms):                        27.29     \nP99 TPOT (ms):                           211.48    \nMean ITL (ms):                           26.64     \nMedian ITL (ms):                         18.84     \nP99 ITL (ms):                            400.59    \n==================================================\nBENCHMARK_DONE\nUnable to find image 'anonymous/vllm-baseline:baseline-b0e96aaebbfb' locally\nbaseline-b0e96aaebbfb: Pulling from anonymous/vllm-baseline\n3c645031de29: Pulling fs layer\n0d6448aff889: Pulling fs layer\n0a7674e3e8fe: Pulling fs layer\nb71b637b97c5: Pulling fs layer\n56dc85502937: Pulling fs layer\nec6d5f6c9ed9: Pulling fs layer\n47b8539d532f: Pulling fs layer\nfd9cc1ad8dee: Pulling fs layer\n83525caeeb35: Pulling fs layer\n8e79813a7b9d: Pulling fs layer\n312a542960e3: Pulling fs layer\n949691b47390: Pulling fs layer\n7cbb09265719: Pulling fs layer\nb71b637b97c5: Waiting\nc1418d32082b: Pulling fs layer\n56dc85502937: Waiting\n7b190e861cd3: Pulling fs layer\na2174ed770d5: Pulling fs layer\nec6d5f6c9ed9: Waiting\n4f4fb700ef54: Pulling fs layer\n47b8539d532f: Waiting\n01e0f551949b: Pulling fs layer\nfd9cc1ad8dee: Waiting\n83525caeeb35: Waiting\n8e79813a7b9d: Waiting\nc37de3041c01: Pulling fs layer\n9f9963002a47: Pulling fs layer\n9137d3bfc582: Pulling fs layer\n955a4eae3855: Pulling fs layer\n477046108da7: Pulling fs layer\n04e4d872ff9e: Pulling fs layer\n312a542960e3: Waiting\n949691b47390: Waiting\n7cbb09265719: Waiting\nc1418d32082b: Waiting\n7b190e861cd3: Waiting\na2174ed770d5: Waiting\n4f4fb700ef54: Waiting\n01e0f551949b: Waiting\nc37de3041c01: Waiting\n9f9963002a47: Waiting\n9137d3bfc582: Waiting\n955a4eae3855: Waiting\n477046108da7: Waiting\n04e4d872ff9e: Waiting\n0d6448aff889: Verifying Checksum\n0d6448aff889: Download complete\n3c645031de29: Verifying Checksum\n3c645031de29: Download complete\nb71b637b97c5: Verifying Checksum\nb71b637b97c5: Download complete\n0a7674e3e8fe: Verifying Checksum\n0a7674e3e8fe: Download complete\n56dc85502937: Verifying Checksum\n56dc85502937: Download complete\n47b8539d532f: Verifying Checksum\n47b8539d532f: Download complete\nfd9cc1ad8dee: Verifying Checksum\nfd9cc1ad8dee: Download complete\n83525caeeb35: Verifying Checksum\n83525caeeb35: Download complete\n312a542960e3: Verifying Checksum\n312a542960e3: Download complete\n949691b47390: Verifying Checksum\n949691b47390: Download complete\n7cbb09265719: Download complete\n3c645031de29: Pull complete\n0d6448aff889: Pull complete\nc1418d32082b: Verifying Checksum\nc1418d32082b: Download complete\n0a7674e3e8fe: Pull complete\n7b190e861cd3: Verifying Checksum\n7b190e861cd3: Download complete\nb71b637b97c5: Pull complete\na2174ed770d5: Download complete\n4f4fb700ef54: Verifying Checksum\n4f4fb700ef54: Download complete\n56dc85502937: Pull complete\nec6d5f6c9ed9: Download complete\nc37de3041c01: Verifying Checksum\nc37de3041c01: Download complete\n9f9963002a47: Verifying Checksum\n9f9963002a47: Download complete\n9137d3bfc582: Download complete\n955a4eae3855: Verifying Checksum\n955a4eae3855: Download complete\n477046108da7: Verifying Checksum\n477046108da7: Download complete\n8e79813a7b9d: Verifying Checksum\n8e79813a7b9d: Download complete\nec6d5f6c9ed9: Pull complete\n47b8539d532f: Pull complete\nfd9cc1ad8dee: Pull complete\n83525caeeb35: Pull complete\n04e4d872ff9e: Download complete\n01e0f551949b: Verifying Checksum\n01e0f551949b: Download complete\n8e79813a7b9d: Pull complete\n312a542960e3: Pull complete\n949691b47390: Pull complete\n7cbb09265719: Pull complete\nc1418d32082b: Pull complete\n7b190e861cd3: Pull complete\na2174ed770d5: Pull complete\n4f4fb700ef54: Pull complete\n01e0f551949b: Pull complete\nc37de3041c01: Pull complete\n9f9963002a47: Pull complete\n9137d3bfc582: Pull complete\n955a4eae3855: Pull complete\n477046108da7: Pull complete\n04e4d872ff9e: Pull complete\nDigest: sha256:82a3b3e40fd566ed0fb3e3451f86c96c7b0ccac95d7cfe3a44d644cce95df621\nStatus: Downloaded newer image for anonymous/vllm-baseline:baseline-b0e96aaebbfb\n",
  "timestamp": "2026-01-21 10:45:07"
}