{
  "human_commit": "296f927f",
  "human_commit_full": "296f927f2493908984707354e3cc5d7b2e41650b",
  "parent_commit": "0032903a5bb7c7c655f52f4efdfcc221947e9ca8",
  "model": "ibm-ai-platform/Bamba-9B",
  "status": "success",
  "error": null,
  "duration_s": 730.7182958126068,
  "metrics": {
    "ttft_mean_ms": 1800.48,
    "ttft_median_ms": 1906.22,
    "ttft_p99_ms": 2367.85,
    "tpot_mean_ms": 38.8,
    "tpot_median_ms": 37.11,
    "tpot_p99_ms": 50.86,
    "itl_mean_ms": 38.8,
    "itl_median_ms": 28.67,
    "itl_p99_ms": 242.41,
    "request_throughput_req_s": 23.25,
    "output_token_throughput_tok_s": 1488.03,
    "total_token_throughput_tok_s": 7440.17
  },
  "raw_output": "t (tok/s):         1488.03   \nTotal Token throughput (tok/s):          7440.17   \n---------------Time to First Token----------------\nMean TTFT (ms):                          1800.48   \nMedian TTFT (ms):                        1906.22   \nP99 TTFT (ms):                           2367.85   \n-----Time per Output Token (excl. 1st token)------\nMean TPOT (ms):                          38.80     \nMedian TPOT (ms):                        37.11     \nP99 TPOT (ms):                           50.86     \n---------------Inter-token Latency----------------\nMean ITL (ms):                           38.80     \nMedian ITL (ms):                         28.67     \nP99 ITL (ms):                            242.41    \n==================================================\n============ Serving Benchmark Result ============\nRequest throughput (req/s):              23.25     \nOutput token throughput (tok/s):         1488.03   \nTotal Token throughput (tok/s):          7440.17   \nMean TTFT (ms):                          1800.48   \nMedian TTFT (ms):                        1906.22   \nP99 TTFT (ms):                           2367.85   \nMean TPOT (ms):                          38.80     \nMedian TPOT (ms):                        37.11     \nP99 TPOT (ms):                           50.86     \nMean ITL (ms):                           38.80     \nMedian ITL (ms):                         28.67     \nP99 ITL (ms):                            242.41    \n==================================================\nBENCHMARK_DONE\nUnable to find image 'anonymous/vllm-baseline:baseline-0032903a5bb7' locally\nbaseline-0032903a5bb7: Pulling from anonymous/vllm-baseline\n3c645031de29: Pulling fs layer\n0d6448aff889: Pulling fs layer\n0a7674e3e8fe: Pulling fs layer\nb71b637b97c5: Pulling fs layer\n56dc85502937: Pulling fs layer\nec6d5f6c9ed9: Pulling fs layer\n47b8539d532f: Pulling fs layer\nfd9cc1ad8dee: Pulling fs layer\n83525caeeb35: Pulling fs layer\n8e79813a7b9d: Pulling fs layer\n312a542960e3: Pulling fs layer\n479ef8d53ea8: Pulling fs layer\n1a983e62f512: Pulling fs layer\nf632d9eacc9c: Pulling fs layer\n94039385962c: Pulling fs layer\n472a1e963f29: Pulling fs layer\n4f4fb700ef54: Pulling fs layer\nec6d5f6c9ed9: Waiting\nbcfa4fced7d9: Pulling fs layer\n47b8539d532f: Waiting\n446becf9bcc9: Pulling fs layer\nfd9cc1ad8dee: Waiting\n2580bee5fd89: Pulling fs layer\n83525caeeb35: Waiting\nb4a93503518a: Pulling fs layer\nb2a06af60cfa: Pulling fs layer\ne37bcf03d882: Pulling fs layer\nb71b637b97c5: Waiting\n6947d1643484: Pulling fs layer\n8e79813a7b9d: Waiting\n56dc85502937: Waiting\n446becf9bcc9: Waiting\n2580bee5fd89: Waiting\ne37bcf03d882: Waiting\n6947d1643484: Waiting\nb4a93503518a: Waiting\nbcfa4fced7d9: Waiting\nb2a06af60cfa: Waiting\n312a542960e3: Waiting\n94039385962c: Waiting\nf632d9eacc9c: Waiting\n479ef8d53ea8: Waiting\n472a1e963f29: Waiting\n1a983e62f512: Waiting\n4f4fb700ef54: Waiting\n0d6448aff889: Verifying Checksum\n0d6448aff889: Download complete\n3c645031de29: Verifying Checksum\n3c645031de29: Download complete\nb71b637b97c5: Download complete\n0a7674e3e8fe: Verifying Checksum\n0a7674e3e8fe: Download complete\n56dc85502937: Download complete\n47b8539d532f: Verifying Checksum\n47b8539d532f: Download complete\nfd9cc1ad8dee: Verifying Checksum\nfd9cc1ad8dee: Download complete\n83525caeeb35: Download complete\n312a542960e3: Verifying Checksum\n312a542960e3: Download complete\n479ef8d53ea8: Download complete\n3c645031de29: Pull complete\n1a983e62f512: Download complete\n0d6448aff889: Pull complete\n0a7674e3e8fe: Pull complete\nf632d9eacc9c: Verifying Checksum\nf632d9eacc9c: Download complete\nb71b637b97c5: Pull complete\n56dc85502937: Pull complete\n94039385962c: Verifying Checksum\n94039385962c: Download complete\n472a1e963f29: Verifying Checksum\n472a1e963f29: Download complete\n4f4fb700ef54: Verifying Checksum\n4f4fb700ef54: Download complete\nec6d5f6c9ed9: Download complete\n446becf9bcc9: Verifying Checksum\n446becf9bcc9: Download complete\n2580bee5fd89: Download complete\nb4a93503518a: Download complete\nb2a06af60cfa: Verifying Checksum\nb2a06af60cfa: Download complete\ne37bcf03d882: Verifying Checksum\ne37bcf03d882: Download complete\n8e79813a7b9d: Verifying Checksum\n8e79813a7b9d: Download complete\nec6d5f6c9ed9: Pull complete\n47b8539d532f: Pull complete\nfd9cc1ad8dee: Pull complete\n83525caeeb35: Pull complete\n6947d1643484: Verifying Checksum\n6947d1643484: Download complete\nbcfa4fced7d9: Verifying Checksum\nbcfa4fced7d9: Download complete\n8e79813a7b9d: Pull complete\n312a542960e3: Pull complete\n479ef8d53ea8: Pull complete\n1a983e62f512: Pull complete\nf632d9eacc9c: Pull complete\n94039385962c: Pull complete\n472a1e963f29: Pull complete\n4f4fb700ef54: Pull complete\nbcfa4fced7d9: Pull complete\n446becf9bcc9: Pull complete\n2580bee5fd89: Pull complete\nb4a93503518a: Pull complete\nb2a06af60cfa: Pull complete\ne37bcf03d882: Pull complete\n6947d1643484: Pull complete\nDigest: sha256:ad790193222e961a555b82bd5f9a313d3d57d17dd656b87dba9c6a1f8cb0c8a9\nStatus: Downloaded newer image for anonymous/vllm-baseline:baseline-0032903a5bb7\n",
  "timestamp": "2026-01-21 19:39:44"
}