{
  "human_commit": "30172b49",
  "human_commit_full": "30172b4947c52890b808c6da3a6c7580f55cbb74",
  "parent_commit": "a4d577b37944cbfa1bc62e4869667d1e2739d62a",
  "model": "meta-llama/Llama-3.1-8B-Instruct",
  "status": "success",
  "error": null,
  "duration_s": 587.170672416687,
  "metrics": {
    "ttft_mean_ms": 799.11,
    "ttft_median_ms": 827.23,
    "ttft_p99_ms": 1219.18,
    "tpot_mean_ms": 31.22,
    "tpot_median_ms": 23.69,
    "tpot_p99_ms": 236.44,
    "itl_mean_ms": 24.46,
    "itl_median_ms": 17.01,
    "itl_p99_ms": 318.83,
    "request_throughput_req_s": 41.71,
    "output_token_throughput_tok_s": 2583.81,
    "total_token_throughput_tok_s": 13262.77
  },
  "raw_output": " 13262.77  \n---------------Time to First Token----------------\nMean TTFT (ms):                          799.11    \nMedian TTFT (ms):                        827.23    \nP99 TTFT (ms):                           1219.18   \n-----Time per Output Token (excl. 1st token)------\nMean TPOT (ms):                          31.22     \nMedian TPOT (ms):                        23.69     \nP99 TPOT (ms):                           236.44    \n---------------Inter-token Latency----------------\nMean ITL (ms):                           24.46     \nMedian ITL (ms):                         17.01     \nP99 ITL (ms):                            318.83    \n==================================================\n============ Serving Benchmark Result ============\nRequest throughput (req/s):              41.71     \nOutput token throughput (tok/s):         2583.81   \nTotal Token throughput (tok/s):          13262.77  \nMean TTFT (ms):                          799.11    \nMedian TTFT (ms):                        827.23    \nP99 TTFT (ms):                           1219.18   \nMean TPOT (ms):                          31.22     \nMedian TPOT (ms):                        23.69     \nP99 TPOT (ms):                           236.44    \nMean ITL (ms):                           24.46     \nMedian ITL (ms):                         17.01     \nP99 ITL (ms):                            318.83    \n==================================================\nBENCHMARK_DONE\nUnable to find image 'anonymous/vllm-baseline:baseline-a4d577b37944' locally\nbaseline-a4d577b37944: Pulling from anonymous/vllm-baseline\n3c645031de29: Pulling fs layer\n0d6448aff889: Pulling fs layer\n0a7674e3e8fe: Pulling fs layer\nb71b637b97c5: Pulling fs layer\n56dc85502937: Pulling fs layer\nec6d5f6c9ed9: Pulling fs layer\n47b8539d532f: Pulling fs layer\nfd9cc1ad8dee: Pulling fs layer\n83525caeeb35: Pulling fs layer\n8e79813a7b9d: Pulling fs layer\n312a542960e3: Pulling fs layer\n949691b47390: Pulling fs layer\n7cbb09265719: Pulling fs layer\ncb7c80b8c4f1: Pulling fs layer\nf76ed838a043: Pulling fs layer\nb71b637b97c5: Waiting\n4f4fb700ef54: Pulling fs layer\n56dc85502937: Waiting\n814191fdafc4: Pulling fs layer\nec6d5f6c9ed9: Waiting\ne8368ef9ded7: Pulling fs layer\nd259f92f4cd7: Pulling fs layer\n08a6744ba5be: Pulling fs layer\nb2872f419a65: Pulling fs layer\nc29b29f9e3b1: Pulling fs layer\nd23682ef61ee: Pulling fs layer\n47b8539d532f: Waiting\nfd9cc1ad8dee: Waiting\n83525caeeb35: Waiting\n8e79813a7b9d: Waiting\n312a542960e3: Waiting\n949691b47390: Waiting\n7cbb09265719: Waiting\ncb7c80b8c4f1: Waiting\nf76ed838a043: Waiting\n4f4fb700ef54: Waiting\n814191fdafc4: Waiting\ne8368ef9ded7: Waiting\nd259f92f4cd7: Waiting\n08a6744ba5be: Waiting\nb2872f419a65: Waiting\nc29b29f9e3b1: Waiting\nd23682ef61ee: Waiting\n0d6448aff889: Verifying Checksum\n0d6448aff889: Download complete\nb71b637b97c5: Download complete\n0a7674e3e8fe: Verifying Checksum\n0a7674e3e8fe: Download complete\n3c645031de29: Verifying Checksum\n3c645031de29: Download complete\n56dc85502937: Verifying Checksum\n56dc85502937: Download complete\n47b8539d532f: Verifying Checksum\n47b8539d532f: Download complete\nfd9cc1ad8dee: Download complete\n83525caeeb35: Verifying Checksum\n83525caeeb35: Download complete\n312a542960e3: Verifying Checksum\n312a542960e3: Download complete\n949691b47390: Verifying Checksum\n949691b47390: Download complete\n7cbb09265719: Download complete\n3c645031de29: Pull complete\n0d6448aff889: Pull complete\ncb7c80b8c4f1: Verifying Checksum\ncb7c80b8c4f1: Download complete\nf76ed838a043: Download complete\n4f4fb700ef54: Download complete\n0a7674e3e8fe: Pull complete\nb71b637b97c5: Pull complete\n56dc85502937: Pull complete\nec6d5f6c9ed9: Verifying Checksum\nec6d5f6c9ed9: Download complete\ne8368ef9ded7: Download complete\nd259f92f4cd7: Verifying Checksum\nd259f92f4cd7: Download complete\n08a6744ba5be: Verifying Checksum\n08a6744ba5be: Download complete\nb2872f419a65: Verifying Checksum\nb2872f419a65: Download complete\nc29b29f9e3b1: Verifying Checksum\nc29b29f9e3b1: Download complete\n8e79813a7b9d: Verifying Checksum\n8e79813a7b9d: Download complete\nd23682ef61ee: Download complete\nec6d5f6c9ed9: Pull complete\n47b8539d532f: Pull complete\nfd9cc1ad8dee: Pull complete\n83525caeeb35: Pull complete\n814191fdafc4: Verifying Checksum\n814191fdafc4: Download complete\n8e79813a7b9d: Pull complete\n312a542960e3: Pull complete\n949691b47390: Pull complete\n7cbb09265719: Pull complete\ncb7c80b8c4f1: Pull complete\nf76ed838a043: Pull complete\n4f4fb700ef54: Pull complete\n814191fdafc4: Pull complete\ne8368ef9ded7: Pull complete\nd259f92f4cd7: Pull complete\n08a6744ba5be: Pull complete\nb2872f419a65: Pull complete\nc29b29f9e3b1: Pull complete\nd23682ef61ee: Pull complete\nDigest: sha256:cebff548afbf8769fc9e46f63f84bb9307f3c2ec4ce0d83335bc605230402952\nStatus: Downloaded newer image for anonymous/vllm-baseline:baseline-a4d577b37944\n/opt/vllm_baseline/vllm/__init__.py:5: RuntimeWarning: Failed to read commit hash:\nNo module named 'vllm._version'\n  from .version import __version__, __version_tuple__  # isort:skip\n",
  "timestamp": "2026-01-21 20:51:13"
}