{
  "human_commit": "660470e5",
  "human_commit_full": "660470e5a36b8e52083615ad7c85e9b4fd4c72ce",
  "parent_commit": "8d59dbb00044a588cab96bcdc028006ed922eb06",
  "model": "meta-llama/Llama-3.1-8B-Instruct",
  "status": "success",
  "error": null,
  "duration_s": 820.4247694015503,
  "metrics": {
    "ttft_mean_ms": 1017.28,
    "ttft_median_ms": 1096.21,
    "ttft_p99_ms": 1550.32,
    "tpot_mean_ms": 68.63,
    "tpot_median_ms": 65.34,
    "tpot_p99_ms": 130.76,
    "itl_mean_ms": 96.1,
    "itl_median_ms": 53.76,
    "itl_p99_ms": 1191.12,
    "request_throughput_req_s": 20.05,
    "output_token_throughput_tok_s": 1071.1
  },
  "raw_output": "token Latency----------------\nMean ITL (ms):                           96.10     \nMedian ITL (ms):                         53.76     \nP99 ITL (ms):                            1191.12   \n==================================================\n============ Serving Benchmark Result ============\nRequest throughput (req/s):              20.05     \nInput token throughput (tok/s):          5132.92   \nOutput token throughput (tok/s):         1071.10   \nMean TTFT (ms):                          1017.28   \nMedian TTFT (ms):                        1096.21   \nP99 TTFT (ms):                           1550.32   \nMean TPOT (ms):                          68.63     \nMedian TPOT (ms):                        65.34     \nP99 TPOT (ms):                           130.76    \nMean ITL (ms):                           96.10     \nMedian ITL (ms):                         53.76     \nP99 ITL (ms):                            1191.12   \n==================================================\nBENCHMARK_DONE\nUnable to find image 'anonymous/vllm-baseline:baseline-8d59dbb00044' locally\nbaseline-8d59dbb00044: Pulling from anonymous/vllm-baseline\n43cfb69dbb46: Pulling fs layer\nfbcd35dc5bc3: Pulling fs layer\nc7232af9ae05: Pulling fs layer\ndb6cdef1932a: Pulling fs layer\n56dc85502937: Pulling fs layer\nfaeb796bb7e6: Pulling fs layer\n01eb6572c8f1: Pulling fs layer\n27ea311cab37: Pulling fs layer\n993556ea2050: Pulling fs layer\n4f4fb700ef54: Pulling fs layer\naa22693e6cf8: Pulling fs layer\n41675c81749a: Pulling fs layer\nb1ee31125d26: Pulling fs layer\nbc1c06ae98ee: Pulling fs layer\n8a9e144a43d5: Pulling fs layer\nc2fb35ae3f44: Pulling fs layer\ne8eb98f5a0c9: Pulling fs layer\ne7f2fe11be34: Pulling fs layer\nf51098b290a2: Pulling fs layer\ne93f7576b5d0: Pulling fs layer\nc069e9737266: Pulling fs layer\n203e5a9aa605: Pulling fs layer\n1323ecd047ac: Pulling fs layer\n95dd4a4f2456: Pulling fs layer\ndb6cdef1932a: Waiting\n56dc85502937: Waiting\nfaeb796bb7e6: Waiting\n01eb6572c8f1: Waiting\n27ea311cab37: Waiting\n993556ea2050: Waiting\n4f4fb700ef54: Waiting\naa22693e6cf8: Waiting\n41675c81749a: Waiting\nb1ee31125d26: Waiting\nbc1c06ae98ee: Waiting\n8a9e144a43d5: Waiting\nc2fb35ae3f44: Waiting\ne8eb98f5a0c9: Waiting\ne7f2fe11be34: Waiting\nf51098b290a2: Waiting\ne93f7576b5d0: Waiting\nc069e9737266: Waiting\n203e5a9aa605: Waiting\n1323ecd047ac: Waiting\n95dd4a4f2456: Waiting\nfbcd35dc5bc3: Verifying Checksum\nfbcd35dc5bc3: Download complete\n43cfb69dbb46: Verifying Checksum\n43cfb69dbb46: Download complete\ndb6cdef1932a: Download complete\nc7232af9ae05: Verifying Checksum\nc7232af9ae05: Download complete\n56dc85502937: Download complete\nfaeb796bb7e6: Verifying Checksum\nfaeb796bb7e6: Download complete\n993556ea2050: Verifying Checksum\n993556ea2050: Download complete\n4f4fb700ef54: Verifying Checksum\n4f4fb700ef54: Download complete\naa22693e6cf8: Verifying Checksum\naa22693e6cf8: Download complete\n43cfb69dbb46: Pull complete\n27ea311cab37: Verifying Checksum\n27ea311cab37: Download complete\nfbcd35dc5bc3: Pull complete\n01eb6572c8f1: Verifying Checksum\n01eb6572c8f1: Download complete\nc7232af9ae05: Pull complete\ndb6cdef1932a: Pull complete\n56dc85502937: Pull complete\nfaeb796bb7e6: Pull complete\n01eb6572c8f1: Pull complete\nb1ee31125d26: Verifying Checksum\nb1ee31125d26: Download complete\n8a9e144a43d5: Verifying Checksum\n8a9e144a43d5: Download complete\nbc1c06ae98ee: Verifying Checksum\nbc1c06ae98ee: Download complete\ne8eb98f5a0c9: Verifying Checksum\ne8eb98f5a0c9: Download complete\ne7f2fe11be34: Download complete\nf51098b290a2: Verifying Checksum\nf51098b290a2: Download complete\ne93f7576b5d0: Verifying Checksum\ne93f7576b5d0: Download complete\nc069e9737266: Verifying Checksum\nc069e9737266: Download complete\n203e5a9aa605: Verifying Checksum\n203e5a9aa605: Download complete\n1323ecd047ac: Verifying Checksum\n1323ecd047ac: Download complete\n95dd4a4f2456: Verifying Checksum\n95dd4a4f2456: Download complete\n41675c81749a: Verifying Checksum\n41675c81749a: Download complete\n27ea311cab37: Pull complete\n993556ea2050: Pull complete\n4f4fb700ef54: Pull complete\naa22693e6cf8: Pull complete\nc2fb35ae3f44: Verifying Checksum\nc2fb35ae3f44: Download complete\n41675c81749a: Pull complete\nb1ee31125d26: Pull complete\nbc1c06ae98ee: Pull complete\n8a9e144a43d5: Pull complete\nc2fb35ae3f44: Pull complete\ne8eb98f5a0c9: Pull complete\ne7f2fe11be34: Pull complete\nf51098b290a2: Pull complete\ne93f7576b5d0: Pull complete\nc069e9737266: Pull complete\n203e5a9aa605: Pull complete\n1323ecd047ac: Pull complete\n95dd4a4f2456: Pull complete\nDigest: sha256:e16a7e667719a7046598034d082f14be77c3ec5cb2abb4e7f52344c573a6ff93\nStatus: Downloaded newer image for anonymous/vllm-baseline:baseline-8d59dbb00044\n/usr/local/lib/python3.10/dist-packages/pyairports/airports.py:1: UserWarning: pkg_resources is deprecated as an API. See https://setuptools.pypa.io/en/latest/pkg_resources.html. The pkg_resources package is slated for removal as early as 2025-11-30. Refrain from using this package or pin to Setuptools<81.\n  from pkg_resources import resource_string\n",
  "timestamp": "2026-01-21 13:00:24"
}