{
  "human_commit": "89a84b0b",
  "human_commit_full": "89a84b0bb7b30706a02836234a94493ea8f780bf",
  "parent_commit": "084a01fd3544557990f8af8af6fd3c1185bae848",
  "model": "Qwen/Qwen1.5-0.5B",
  "status": "success",
  "error": null,
  "duration_s": 813.5411727428436,
  "metrics": {
    "ttft_mean_ms": 772.11,
    "ttft_median_ms": 777.2,
    "ttft_p99_ms": 877.21,
    "tpot_mean_ms": 54.82,
    "tpot_median_ms": 53.6,
    "tpot_p99_ms": 92.1,
    "itl_mean_ms": 64.92,
    "itl_median_ms": 46.57,
    "itl_p99_ms": 745.9,
    "request_throughput_req_s": 23.81,
    "output_token_throughput_tok_s": 1483.8
  },
  "raw_output": "v1/completions HTTP/1.1\" 200 OK\nINFO:     127.0.0.1:59372 - \"POST /v1/completions HTTP/1.1\" 200 OK\nINFO:     127.0.0.1:59378 - \"POST /v1/completions HTTP/1.1\" 200 OK\nINFO:     127.0.0.1:59386 - \"POST /v1/completions HTTP/1.1\" 200 OK\nINFO:     127.0.0.1:59400 - \"POST /v1/completions HTTP/1.1\" 200 OK\n\n  1%|          | 1/100 [00:01<02:06,  1.28s/it]\n  2%|\u258f         | 2/100 [00:04<03:39,  2.24s/it]\n100%|\u2588\u2588\u2588\u2588\u2588\u2588\u2588\u2588\u2588\u2588| 100/100 [00:04<00:00, 23.81it/s]\n============ Serving Benchmark Result ============\nSuccessful requests:                     100       \nBenchmark duration (s):                  4.20      \nTotal input tokens:                      25600     \nTotal generated tokens:                  6231      \nRequest throughput (req/s):              23.81     \nInput token throughput (tok/s):          6096.16   \nOutput token throughput (tok/s):         1483.80   \n---------------Time to First Token----------------\nMean TTFT (ms):                          772.11    \nMedian TTFT (ms):                        777.20    \nP99 TTFT (ms):                           877.21    \n-----Time per Output Token (excl. 1st token)------\nMean TPOT (ms):                          54.82     \nMedian TPOT (ms):                        53.60     \nP99 TPOT (ms):                           92.10     \n---------------Inter-token Latency----------------\nMean ITL (ms):                           64.92     \nMedian ITL (ms):                         46.57     \nP99 ITL (ms):                            745.90    \n==================================================\nINFO 01-21 13:42:56 metrics.py:406] Avg prompt throughput: 5412.8 tokens/s, Avg generation throughput: 1275.2 tokens/s, Running: 0 reqs, Swapped: 0 reqs, Pending: 0 reqs, GPU KV cache usage: 0.0%, CPU KV cache usage: 0.0%.\n============ Serving Benchmark Result ============\nRequest throughput (req/s):              23.81     \nInput token throughput (tok/s):          6096.16   \nOutput token throughput (tok/s):         1483.80   \nMean TTFT (ms):                          772.11    \nMedian TTFT (ms):                        777.20    \nP99 TTFT (ms):                           877.21    \nMean TPOT (ms):                          54.82     \nMedian TPOT (ms):                        53.60     \nP99 TPOT (ms):                           92.10     \nMean ITL (ms):                           64.92     \nMedian ITL (ms):                         46.57     \nP99 ITL (ms):                            745.90    \n==================================================\nBENCHMARK_DONE\nUnable to find image 'anonymous/vllm-baseline:baseline-084a01fd3544' locally\nbaseline-084a01fd3544: Pulling from anonymous/vllm-baseline\n43cfb69dbb46: Pulling fs layer\nfbcd35dc5bc3: Pulling fs layer\nc7232af9ae05: Pulling fs layer\ndb6cdef1932a: Pulling fs layer\n56dc85502937: Pulling fs layer\n40b94ba5ab89: Pulling fs layer\n61fa7fc5e3d7: Pulling fs layer\nd7d20522cac4: Pulling fs layer\nd5079b3f0e5e: Pulling fs layer\n4f4fb700ef54: Pulling fs layer\n16c4ca3b43b5: Pulling fs layer\nd9b787298ba1: Pulling fs layer\n3353739a0484: Pulling fs layer\n9b2ac14744bf: Pulling fs layer\n6953032d916a: Pulling fs layer\n01df4b535604: Pulling fs layer\nd9b787298ba1: Waiting\n3353739a0484: Waiting\n40b94ba5ab89: Waiting\n9b2ac14744bf: Waiting\n6953032d916a: Waiting\n61fa7fc5e3d7: Waiting\n01df4b535604: Waiting\nd7d20522cac4: Waiting\nd5079b3f0e5e: Waiting\n4f4fb700ef54: Waiting\n16c4ca3b43b5: Waiting\ndb6cdef1932a: Waiting\n56dc85502937: Waiting\nfbcd35dc5bc3: Verifying Checksum\nfbcd35dc5bc3: Download complete\n43cfb69dbb46: Verifying Checksum\n43cfb69dbb46: Download complete\ndb6cdef1932a: Download complete\nc7232af9ae05: Verifying Checksum\nc7232af9ae05: Download complete\n56dc85502937: Verifying Checksum\n56dc85502937: Download complete\n40b94ba5ab89: Verifying Checksum\n40b94ba5ab89: Download complete\n43cfb69dbb46: Pull complete\nd5079b3f0e5e: Verifying Checksum\nd5079b3f0e5e: Download complete\nfbcd35dc5bc3: Pull complete\n4f4fb700ef54: Verifying Checksum\n4f4fb700ef54: Download complete\n16c4ca3b43b5: Verifying Checksum\n16c4ca3b43b5: Download complete\nc7232af9ae05: Pull complete\ndb6cdef1932a: Pull complete\n61fa7fc5e3d7: Verifying Checksum\n61fa7fc5e3d7: Download complete\nd7d20522cac4: Verifying Checksum\nd7d20522cac4: Download complete\n56dc85502937: Pull complete\n40b94ba5ab89: Pull complete\n61fa7fc5e3d7: Pull complete\n3353739a0484: Verifying Checksum\n3353739a0484: Download complete\n6953032d916a: Verifying Checksum\n6953032d916a: Download complete\nd7d20522cac4: Pull complete\nd5079b3f0e5e: Pull complete\n4f4fb700ef54: Pull complete\n16c4ca3b43b5: Pull complete\n9b2ac14744bf: Verifying Checksum\n9b2ac14744bf: Download complete\nd9b787298ba1: Download complete\n01df4b535604: Download complete\nd9b787298ba1: Pull complete\n3353739a0484: Pull complete\n9b2ac14744bf: Pull complete\n6953032d916a: Pull complete\n01df4b535604: Pull complete\nDigest: sha256:05c1d3bb759c96c31cf5b8a0707b4d6cc6d807aaf89058b64a410a72d3dbb8e4\nStatus: Downloaded newer image for anonymous/vllm-baseline:baseline-084a01fd3544\n",
  "timestamp": "2026-01-21 13:43:37"
}