{
  "human_commit": "99abb8b6",
  "human_commit_full": "99abb8b650c66664cdc84d815b7f306f33bd9881",
  "parent_commit": "3a1e6481586ed7f079275b5d5072a6e246af691e",
  "model": "meta-llama/Llama-3.1-8B-Instruct",
  "status": "success",
  "error": null,
  "duration_s": 1254.9938426017761,
  "metrics": {
    "ttft_mean_ms": 834.29,
    "ttft_median_ms": 818.52,
    "ttft_p99_ms": 1245.5,
    "tpot_mean_ms": 34.1,
    "tpot_median_ms": 27.21,
    "tpot_p99_ms": 184.59,
    "itl_mean_ms": 27.15,
    "itl_median_ms": 19.44,
    "itl_p99_ms": 345.56,
    "request_throughput_req_s": 38.27,
    "output_token_throughput_tok_s": 2370.22,
    "total_token_throughput_tok_s": 12166.42
  },
  "raw_output": "                        19.44     \nP99 ITL (ms):                            345.56    \n==================================================\n============ Serving Benchmark Result ============\nRequest throughput (req/s):              38.27     \nOutput token throughput (tok/s):         2370.22   \nTotal Token throughput (tok/s):          12166.42  \nMean TTFT (ms):                          834.29    \nMedian TTFT (ms):                        818.52    \nP99 TTFT (ms):                           1245.50   \nMean TPOT (ms):                          34.10     \nMedian TPOT (ms):                        27.21     \nP99 TPOT (ms):                           184.59    \nMean ITL (ms):                           27.15     \nMedian ITL (ms):                         19.44     \nP99 ITL (ms):                            345.56    \n==================================================\nBENCHMARK_DONE\nUnable to find image 'anonymous/vllm-baseline:baseline-3a1e6481586e' locally\nbaseline-3a1e6481586e: Pulling from anonymous/vllm-baseline\n3c645031de29: Already exists\n0d6448aff889: Already exists\n0a7674e3e8fe: Already exists\nb71b637b97c5: Already exists\n56dc85502937: Already exists\nec6d5f6c9ed9: Pulling fs layer\n47b8539d532f: Pulling fs layer\nfd9cc1ad8dee: Pulling fs layer\n83525caeeb35: Pulling fs layer\n8e79813a7b9d: Pulling fs layer\n312a542960e3: Pulling fs layer\n949691b47390: Pulling fs layer\n7cbb09265719: Pulling fs layer\nc1418d32082b: Pulling fs layer\n7b190e861cd3: Pulling fs layer\na2174ed770d5: Pulling fs layer\n4f4fb700ef54: Pulling fs layer\nb652f1805f42: Pulling fs layer\nc37de3041c01: Pulling fs layer\n0fe2e5d2db60: Pulling fs layer\ne265b8391010: Pulling fs layer\n955a4eae3855: Pulling fs layer\n477046108da7: Pulling fs layer\nc67f74973e7f: Pulling fs layer\n7bcd0463dc86: Pulling fs layer\n66779ff514ad: Pulling fs layer\n0c2c60a46571: Pulling fs layer\n7360833000a6: Pulling fs layer\nac4aa7fe0d29: Pulling fs layer\n7ca439f6a33a: Pulling fs layer\n061b90eb249a: Pulling fs layer\n546dc8de3126: Pulling fs layer\n83525caeeb35: Waiting\n8e79813a7b9d: Waiting\n312a542960e3: Waiting\n949691b47390: Waiting\n7cbb09265719: Waiting\nc1418d32082b: Waiting\n7bcd0463dc86: Waiting\n7b190e861cd3: Waiting\na2174ed770d5: Waiting\n4f4fb700ef54: Waiting\n66779ff514ad: Waiting\n0c2c60a46571: Waiting\n7360833000a6: Waiting\nac4aa7fe0d29: Waiting\n7ca439f6a33a: Waiting\n061b90eb249a: Waiting\n546dc8de3126: Waiting\nb652f1805f42: Waiting\nc37de3041c01: Waiting\n0fe2e5d2db60: Waiting\ne265b8391010: Waiting\n955a4eae3855: Waiting\nc67f74973e7f: Waiting\n477046108da7: Waiting\nfd9cc1ad8dee: Download complete\n47b8539d532f: Verifying Checksum\n47b8539d532f: Download complete\n83525caeeb35: Verifying Checksum\n83525caeeb35: Download complete\n312a542960e3: Verifying Checksum\n312a542960e3: Download complete\n949691b47390: Verifying Checksum\n949691b47390: Download complete\n7cbb09265719: Verifying Checksum\n7cbb09265719: Download complete\nec6d5f6c9ed9: Verifying Checksum\nec6d5f6c9ed9: Download complete\n7b190e861cd3: Verifying Checksum\n7b190e861cd3: Download complete\na2174ed770d5: Verifying Checksum\na2174ed770d5: Download complete\n4f4fb700ef54: Download complete\nc1418d32082b: Download complete\n8e79813a7b9d: Verifying Checksum\n8e79813a7b9d: Download complete\n0fe2e5d2db60: Download complete\ne265b8391010: Verifying Checksum\ne265b8391010: Download complete\n955a4eae3855: Verifying Checksum\n955a4eae3855: Download complete\n477046108da7: Verifying Checksum\n477046108da7: Download complete\nc37de3041c01: Verifying Checksum\nc37de3041c01: Download complete\n7bcd0463dc86: Verifying Checksum\n7bcd0463dc86: Download complete\nc67f74973e7f: Download complete\n0c2c60a46571: Download complete\n7360833000a6: Verifying Checksum\n7360833000a6: Download complete\nec6d5f6c9ed9: Pull complete\n66779ff514ad: Verifying Checksum\n66779ff514ad: Download complete\n47b8539d532f: Pull complete\n7ca439f6a33a: Verifying Checksum\n7ca439f6a33a: Download complete\n061b90eb249a: Verifying Checksum\n061b90eb249a: Download complete\nfd9cc1ad8dee: Pull complete\n546dc8de3126: Verifying Checksum\n546dc8de3126: Download complete\n83525caeeb35: Pull complete\nac4aa7fe0d29: Verifying Checksum\nac4aa7fe0d29: Download complete\nb652f1805f42: Download complete\n8e79813a7b9d: Pull complete\n312a542960e3: Pull complete\n949691b47390: Pull complete\n7cbb09265719: Pull complete\nc1418d32082b: Pull complete\n7b190e861cd3: Pull complete\na2174ed770d5: Pull complete\n4f4fb700ef54: Pull complete\nb652f1805f42: Pull complete\nc37de3041c01: Pull complete\n0fe2e5d2db60: Pull complete\ne265b8391010: Pull complete\n955a4eae3855: Pull complete\n477046108da7: Pull complete\nc67f74973e7f: Pull complete\n7bcd0463dc86: Pull complete\n66779ff514ad: Pull complete\n0c2c60a46571: Pull complete\n7360833000a6: Pull complete\nac4aa7fe0d29: Pull complete\n7ca439f6a33a: Pull complete\n061b90eb249a: Pull complete\n546dc8de3126: Pull complete\nDigest: sha256:4c91793d407626e0b2c0385e1bd7c08de71e2a7a197f5c7bf0409de32191b98b\nStatus: Downloaded newer image for anonymous/vllm-baseline:baseline-3a1e6481586e\n",
  "timestamp": "2026-01-21 14:52:40"
}