{
  "human_commit": "b55ed6ef",
  "human_commit_full": "b55ed6ef8ab0dce7fb0f79ff292dafdb4d22610c",
  "parent_commit": "2f385183f35497e030ef22c9820d83b83bc4f6db",
  "model": "meta-llama/Llama-3.1-8B-Instruct",
  "status": "success",
  "error": null,
  "duration_s": 1064.0809557437897,
  "metrics": {
    "ttft_mean_ms": 921.98,
    "ttft_median_ms": 977.24,
    "ttft_p99_ms": 1343.25,
    "tpot_mean_ms": 25.33,
    "tpot_median_ms": 23.7,
    "tpot_p99_ms": 61.46,
    "itl_mean_ms": 27.54,
    "itl_median_ms": 16.3,
    "itl_p99_ms": 307.36,
    "request_throughput_req_s": 39.43,
    "output_token_throughput_tok_s": 2210.27,
    "total_token_throughput_tok_s": 12304.75
  },
  "raw_output": "                      24064     \nTotal generated tokens:                  5269      \nRequest throughput (req/s):              39.43     \nOutput token throughput (tok/s):         2210.27   \nTotal Token throughput (tok/s):          12304.75  \n---------------Time to First Token----------------\nMean TTFT (ms):                          921.98    \nMedian TTFT (ms):                        977.24    \nP99 TTFT (ms):                           1343.25   \n-----Time per Output Token (excl. 1st token)------\nMean TPOT (ms):                          25.33     \nMedian TPOT (ms):                        23.70     \nP99 TPOT (ms):                           61.46     \n---------------Inter-token Latency----------------\nMean ITL (ms):                           27.54     \nMedian ITL (ms):                         16.30     \nP99 ITL (ms):                            307.36    \n==================================================\n============ Serving Benchmark Result ============\nRequest throughput (req/s):              39.43     \nOutput token throughput (tok/s):         2210.27   \nTotal Token throughput (tok/s):          12304.75  \nMean TTFT (ms):                          921.98    \nMedian TTFT (ms):                        977.24    \nP99 TTFT (ms):                           1343.25   \nMean TPOT (ms):                          25.33     \nMedian TPOT (ms):                        23.70     \nP99 TPOT (ms):                           61.46     \nMean ITL (ms):                           27.54     \nMedian ITL (ms):                         16.30     \nP99 ITL (ms):                            307.36    \n==================================================\nBENCHMARK_DONE\nUnable to find image 'anonymous/vllm-baseline:baseline-2f385183f354' locally\nbaseline-2f385183f354: Pulling from anonymous/vllm-baseline\n3c645031de29: Pulling fs layer\n0d6448aff889: Pulling fs layer\n0a7674e3e8fe: Pulling fs layer\nb71b637b97c5: Pulling fs layer\n56dc85502937: Pulling fs layer\nb9839793d66a: Pulling fs layer\n383fba9dc77a: Pulling fs layer\n118edadc7038: Pulling fs layer\n4e0a4729cf8f: Pulling fs layer\n4f4fb700ef54: Pulling fs layer\ne5163ec7bd9e: Pulling fs layer\nf86f37175918: Pulling fs layer\nfbdd9b775289: Pulling fs layer\na408d17e6542: Pulling fs layer\n2c0d3b618a71: Pulling fs layer\na4ab873e4ee3: Pulling fs layer\n5ae93a3e7e44: Pulling fs layer\nd902db124107: Pulling fs layer\n6ffc40277f98: Pulling fs layer\nf95a4c76edfe: Pulling fs layer\n838dd1b97860: Pulling fs layer\n07b68f7a80b6: Pulling fs layer\nb71b637b97c5: Waiting\nf86f37175918: Waiting\n56dc85502937: Waiting\nfbdd9b775289: Waiting\nb9839793d66a: Waiting\na408d17e6542: Waiting\n383fba9dc77a: Waiting\n2c0d3b618a71: Waiting\n118edadc7038: Waiting\nf95a4c76edfe: Waiting\n4e0a4729cf8f: Waiting\na4ab873e4ee3: Waiting\n4f4fb700ef54: Waiting\n838dd1b97860: Waiting\ne5163ec7bd9e: Waiting\n5ae93a3e7e44: Waiting\n07b68f7a80b6: Waiting\nd902db124107: Waiting\n6ffc40277f98: Waiting\n0d6448aff889: Verifying Checksum\n0d6448aff889: Download complete\n3c645031de29: Verifying Checksum\n3c645031de29: Download complete\nb71b637b97c5: Download complete\n56dc85502937: Verifying Checksum\n56dc85502937: Download complete\n0a7674e3e8fe: Verifying Checksum\n0a7674e3e8fe: Download complete\nb9839793d66a: Download complete\n383fba9dc77a: Verifying Checksum\n383fba9dc77a: Download complete\n4e0a4729cf8f: Verifying Checksum\n4e0a4729cf8f: Download complete\n4f4fb700ef54: Verifying Checksum\n4f4fb700ef54: Download complete\n3c645031de29: Pull complete\n0d6448aff889: Pull complete\n118edadc7038: Verifying Checksum\n118edadc7038: Download complete\n0a7674e3e8fe: Pull complete\nfbdd9b775289: Verifying Checksum\nfbdd9b775289: Download complete\nb71b637b97c5: Pull complete\n56dc85502937: Pull complete\nb9839793d66a: Pull complete\n383fba9dc77a: Pull complete\na408d17e6542: Verifying Checksum\na408d17e6542: Download complete\nf86f37175918: Verifying Checksum\nf86f37175918: Download complete\na4ab873e4ee3: Verifying Checksum\na4ab873e4ee3: Download complete\n5ae93a3e7e44: Verifying Checksum\n5ae93a3e7e44: Download complete\nd902db124107: Verifying Checksum\nd902db124107: Download complete\n6ffc40277f98: Verifying Checksum\n6ffc40277f98: Download complete\nf95a4c76edfe: Verifying Checksum\nf95a4c76edfe: Download complete\n838dd1b97860: Verifying Checksum\n838dd1b97860: Download complete\n118edadc7038: Pull complete\n07b68f7a80b6: Download complete\n4e0a4729cf8f: Pull complete\n4f4fb700ef54: Pull complete\ne5163ec7bd9e: Verifying Checksum\ne5163ec7bd9e: Download complete\n2c0d3b618a71: Verifying Checksum\ne5163ec7bd9e: Pull complete\nf86f37175918: Pull complete\nfbdd9b775289: Pull complete\na408d17e6542: Pull complete\n2c0d3b618a71: Pull complete\na4ab873e4ee3: Pull complete\n5ae93a3e7e44: Pull complete\nd902db124107: Pull complete\n6ffc40277f98: Pull complete\nf95a4c76edfe: Pull complete\n838dd1b97860: Pull complete\n07b68f7a80b6: Pull complete\nDigest: sha256:7fadf3f064b2b7b0107710b92750169f85f1b8c8b0c8f29ddc368d9b136d2990\nStatus: Downloaded newer image for anonymous/vllm-baseline:baseline-2f385183f354\n",
  "timestamp": "2026-01-21 16:45:35"
}