{
  "human_commit": "c0569dbc",
  "human_commit_full": "c0569dbc82b5e945a77878190114d1b68027828b",
  "parent_commit": "8bb43b9c9ee878e07038d3f36aaf279ffb2fabab",
  "model": "Qwen/Qwen3-30B-A3B-FP8",
  "status": "success",
  "error": null,
  "duration_s": 388.8589377403259,
  "metrics": {
    "ttft_mean_ms": 584.59,
    "ttft_median_ms": 553.38,
    "ttft_p99_ms": 899.65,
    "tpot_mean_ms": 21.51,
    "tpot_median_ms": 21.98,
    "tpot_p99_ms": 26.96,
    "itl_mean_ms": 21.51,
    "itl_median_ms": 16.33,
    "itl_p99_ms": 265.12,
    "request_throughput_req_s": 51.06,
    "output_token_throughput_tok_s": 3267.75,
    "total_token_throughput_tok_s": 18381.09
  },
  "raw_output": "1/completions HTTP/1.1\" 200 OK\nINFO:     127.0.0.1:48280 - \"POST /v1/completions HTTP/1.1\" 200 OK\nINFO:     127.0.0.1:48288 - \"POST /v1/completions HTTP/1.1\" 200 OK\nINFO:     127.0.0.1:48304 - \"POST /v1/completions HTTP/1.1\" 200 OK\nINFO:     127.0.0.1:48318 - \"POST /v1/completions HTTP/1.1\" 200 OK\n\n  1%|          | 1/100 [00:01<03:13,  1.96s/it]\n100%|\u2588\u2588\u2588\u2588\u2588\u2588\u2588\u2588\u2588\u2588| 100/100 [00:01<00:00, 51.06it/s]\n============ Serving Benchmark Result ============\nSuccessful requests:                     100       \nBenchmark duration (s):                  1.96      \nTotal input tokens:                      29600     \nTotal generated tokens:                  6400      \nRequest throughput (req/s):              51.06     \nOutput token throughput (tok/s):         3267.75   \nTotal Token throughput (tok/s):          18381.09  \n---------------Time to First Token----------------\nMean TTFT (ms):                          584.59    \nMedian TTFT (ms):                        553.38    \nP99 TTFT (ms):                           899.65    \n-----Time per Output Token (excl. 1st token)------\nMean TPOT (ms):                          21.51     \nMedian TPOT (ms):                        21.98     \nP99 TPOT (ms):                           26.96     \n---------------Inter-token Latency----------------\nMean ITL (ms):                           21.51     \nMedian ITL (ms):                         16.33     \nP99 ITL (ms):                            265.12    \n==================================================\n============ Serving Benchmark Result ============\nRequest throughput (req/s):              51.06     \nOutput token throughput (tok/s):         3267.75   \nTotal Token throughput (tok/s):          18381.09  \nMean TTFT (ms):                          584.59    \nMedian TTFT (ms):                        553.38    \nP99 TTFT (ms):                           899.65    \nMean TPOT (ms):                          21.51     \nMedian TPOT (ms):                        21.98     \nP99 TPOT (ms):                           26.96     \nMean ITL (ms):                           21.51     \nMedian ITL (ms):                         16.33     \nP99 ITL (ms):                            265.12    \n==================================================\nBENCHMARK_DONE\nUnable to find image 'anonymous/vllm-bench:c0569dbc82b5e945a77878190114d1b68027828b' locally\nc0569dbc82b5e945a77878190114d1b68027828b: Pulling from anonymous/vllm-bench\n9cb31e2e37ea: Already exists\nb95112eaf283: Already exists\n030ef8250936: Already exists\n72ac9ccfda38: Already exists\n73389fbd088f: Already exists\n0264850675f7: Already exists\nde1d03310308: Already exists\nc1d2af7fad0f: Already exists\n5601308b3ac6: Already exists\n6b2035e8b73e: Already exists\ned71f8f81b33: Already exists\n540cfbdd0553: Pulling fs layer\nbd6bc9ba88a4: Pulling fs layer\n66fd8f04aaef: Pulling fs layer\n7d37c382e738: Pulling fs layer\n214c7e439bc3: Pulling fs layer\nfb1fa7eafb5d: Pulling fs layer\n955e93cd4ba1: Pulling fs layer\n7d37c382e738: Waiting\n79eeec4ab315: Pulling fs layer\nded0b6c85ef1: Pulling fs layer\n214c7e439bc3: Waiting\nfe1478b9ba77: Pulling fs layer\n3b6fd5c2b205: Pulling fs layer\ne4d14cf72599: Pulling fs layer\n97f3a875c42c: Pulling fs layer\n0ec51324ca89: Pulling fs layer\ndf82fa830bd6: Pulling fs layer\n6f6b681f4147: Pulling fs layer\n955e93cd4ba1: Waiting\ne4d14cf72599: Waiting\n97f3a875c42c: Waiting\n79eeec4ab315: Waiting\nfb1fa7eafb5d: Waiting\nded0b6c85ef1: Waiting\n0ec51324ca89: Waiting\ndf82fa830bd6: Waiting\nfe1478b9ba77: Waiting\n6f6b681f4147: Waiting\n3b6fd5c2b205: Waiting\n540cfbdd0553: Verifying Checksum\n540cfbdd0553: Download complete\n540cfbdd0553: Pull complete\nbd6bc9ba88a4: Download complete\nbd6bc9ba88a4: Pull complete\n214c7e439bc3: Verifying Checksum\n214c7e439bc3: Download complete\nfb1fa7eafb5d: Verifying Checksum\nfb1fa7eafb5d: Download complete\n7d37c382e738: Verifying Checksum\n7d37c382e738: Download complete\n66fd8f04aaef: Download complete\nded0b6c85ef1: Download complete\nfe1478b9ba77: Download complete\n3b6fd5c2b205: Verifying Checksum\n3b6fd5c2b205: Download complete\ne4d14cf72599: Verifying Checksum\n97f3a875c42c: Download complete\n0ec51324ca89: Verifying Checksum\n0ec51324ca89: Download complete\ndf82fa830bd6: Verifying Checksum\ndf82fa830bd6: Download complete\n79eeec4ab315: Verifying Checksum\n79eeec4ab315: Download complete\n66fd8f04aaef: Pull complete\n7d37c382e738: Pull complete\n214c7e439bc3: Pull complete\nfb1fa7eafb5d: Pull complete\n6f6b681f4147: Verifying Checksum\n6f6b681f4147: Download complete\n955e93cd4ba1: Verifying Checksum\n955e93cd4ba1: Download complete\n955e93cd4ba1: Pull complete\n79eeec4ab315: Pull complete\nded0b6c85ef1: Pull complete\nfe1478b9ba77: Pull complete\n3b6fd5c2b205: Pull complete\ne4d14cf72599: Pull complete\n97f3a875c42c: Pull complete\n0ec51324ca89: Pull complete\ndf82fa830bd6: Pull complete\n6f6b681f4147: Pull complete\nDigest: sha256:8f6964edd02f5ebe80fde0fcea3652c00f24cfdea06c7946d850bdfaf9879af5\nStatus: Downloaded newer image for anonymous/vllm-bench:c0569dbc82b5e945a77878190114d1b68027828b\n",
  "timestamp": "2026-01-18 12:40:31"
}