{
  "human_commit": "dcc6cfb9",
  "human_commit_full": "dcc6cfb991cd76369aad96e04424f29c8fecdbd8",
  "parent_commit": "dd572c0ab3effa539b74f9a1288bb61ce83ada76",
  "model": "Qwen/Qwen3-30B-A3B-FP8",
  "status": "success",
  "error": null,
  "duration_s": 424.11417150497437,
  "metrics": {
    "ttft_mean_ms": 615.04,
    "ttft_median_ms": 605.71,
    "ttft_p99_ms": 927.63,
    "tpot_mean_ms": 21.17,
    "tpot_median_ms": 21.31,
    "tpot_p99_ms": 27.08,
    "itl_mean_ms": 21.17,
    "itl_median_ms": 16.02,
    "itl_p99_ms": 237.62,
    "request_throughput_req_s": 50.88,
    "output_token_throughput_tok_s": 3256.43,
    "total_token_throughput_tok_s": 18317.44
  },
  "raw_output": ":     127.0.0.1:58168 - \"POST /v1/completions HTTP/1.1\" 200 OK\nINFO:     127.0.0.1:58184 - \"POST /v1/completions HTTP/1.1\" 200 OK\nINFO:     127.0.0.1:58196 - \"POST /v1/completions HTTP/1.1\" 200 OK\nINFO:     127.0.0.1:58198 - \"POST /v1/completions HTTP/1.1\" 200 OK\nINFO:     127.0.0.1:58208 - \"POST /v1/completions HTTP/1.1\" 200 OK\n\n  1%|          | 1/100 [00:01<03:14,  1.96s/it]\n100%|\u2588\u2588\u2588\u2588\u2588\u2588\u2588\u2588\u2588\u2588| 100/100 [00:01<00:00, 50.88it/s]\n============ Serving Benchmark Result ============\nSuccessful requests:                     100       \nBenchmark duration (s):                  1.97      \nTotal input tokens:                      29600     \nTotal generated tokens:                  6400      \nRequest throughput (req/s):              50.88     \nOutput token throughput (tok/s):         3256.43   \nTotal Token throughput (tok/s):          18317.44  \n---------------Time to First Token----------------\nMean TTFT (ms):                          615.04    \nMedian TTFT (ms):                        605.71    \nP99 TTFT (ms):                           927.63    \n-----Time per Output Token (excl. 1st token)------\nMean TPOT (ms):                          21.17     \nMedian TPOT (ms):                        21.31     \nP99 TPOT (ms):                           27.08     \n---------------Inter-token Latency----------------\nMean ITL (ms):                           21.17     \nMedian ITL (ms):                         16.02     \nP99 ITL (ms):                            237.62    \n==================================================\n============ Serving Benchmark Result ============\nRequest throughput (req/s):              50.88     \nOutput token throughput (tok/s):         3256.43   \nTotal Token throughput (tok/s):          18317.44  \nMean TTFT (ms):                          615.04    \nMedian TTFT (ms):                        605.71    \nP99 TTFT (ms):                           927.63    \nMean TPOT (ms):                          21.17     \nMedian TPOT (ms):                        21.31     \nP99 TPOT (ms):                           27.08     \nMean ITL (ms):                           21.17     \nMedian ITL (ms):                         16.02     \nP99 ITL (ms):                            237.62    \n==================================================\nBENCHMARK_DONE\nUnable to find image 'anonymous/vllm-bench:dcc6cfb991cd76369aad96e04424f29c8fecdbd8' locally\ndcc6cfb991cd76369aad96e04424f29c8fecdbd8: Pulling from anonymous/vllm-bench\n9cb31e2e37ea: Already exists\nb95112eaf283: Already exists\n030ef8250936: Already exists\n72ac9ccfda38: Already exists\n73389fbd088f: Already exists\n0264850675f7: Already exists\nde1d03310308: Already exists\nc1d2af7fad0f: Already exists\n5601308b3ac6: Already exists\n6b2035e8b73e: Already exists\ned71f8f81b33: Already exists\n6a2306edc128: Pulling fs layer\nbb5ee2f41954: Pulling fs layer\nae1cc335b65b: Pulling fs layer\n2fb01f5ad376: Pulling fs layer\nb7dfd152a1fd: Pulling fs layer\n2987a32afa11: Pulling fs layer\nac6e8965f5b8: Pulling fs layer\nde0ab49724bc: Pulling fs layer\nd97f30c8397a: Pulling fs layer\na24b30683680: Pulling fs layer\n2fb01f5ad376: Waiting\n7c35f4340a1b: Pulling fs layer\n2987a32afa11: Waiting\n344b06fc47ec: Pulling fs layer\n566bdf59c3d0: Pulling fs layer\nac6e8965f5b8: Waiting\nde0ab49724bc: Waiting\n24b39caa0d68: Pulling fs layer\ncb0f2dea92e5: Pulling fs layer\nb7dfd152a1fd: Waiting\nd97f30c8397a: Waiting\nf7b8e541c49b: Pulling fs layer\na24b30683680: Waiting\n344b06fc47ec: Waiting\n7c35f4340a1b: Waiting\n24b39caa0d68: Waiting\nf7b8e541c49b: Waiting\n566bdf59c3d0: Waiting\ncb0f2dea92e5: Waiting\n6a2306edc128: Download complete\n6a2306edc128: Pull complete\nbb5ee2f41954: Pull complete\nb7dfd152a1fd: Download complete\n2987a32afa11: Verifying Checksum\n2987a32afa11: Download complete\n2fb01f5ad376: Verifying Checksum\n2fb01f5ad376: Download complete\nae1cc335b65b: Download complete\nd97f30c8397a: Verifying Checksum\nd97f30c8397a: Download complete\na24b30683680: Verifying Checksum\na24b30683680: Download complete\n7c35f4340a1b: Verifying Checksum\n7c35f4340a1b: Download complete\n344b06fc47ec: Download complete\n566bdf59c3d0: Verifying Checksum\n24b39caa0d68: Verifying Checksum\n24b39caa0d68: Download complete\ncb0f2dea92e5: Verifying Checksum\ncb0f2dea92e5: Download complete\nae1cc335b65b: Pull complete\n2fb01f5ad376: Pull complete\nb7dfd152a1fd: Pull complete\n2987a32afa11: Pull complete\nde0ab49724bc: Verifying Checksum\nde0ab49724bc: Download complete\nf7b8e541c49b: Verifying Checksum\nf7b8e541c49b: Download complete\nac6e8965f5b8: Verifying Checksum\nac6e8965f5b8: Download complete\nac6e8965f5b8: Pull complete\nde0ab49724bc: Pull complete\nd97f30c8397a: Pull complete\na24b30683680: Pull complete\n7c35f4340a1b: Pull complete\n344b06fc47ec: Pull complete\n566bdf59c3d0: Pull complete\n24b39caa0d68: Pull complete\ncb0f2dea92e5: Pull complete\nf7b8e541c49b: Pull complete\nDigest: sha256:9d0b2175ec90b7fdb597e28510892ebd3f4ea0cddecd4e834456db49d6c6eeb3\nStatus: Downloaded newer image for anonymous/vllm-bench:dcc6cfb991cd76369aad96e04424f29c8fecdbd8\n",
  "timestamp": "2026-01-18 12:54:34"
}