{
  "human_commit": "25ebed2f",
  "human_commit_full": "25ebed2f8ca6d747d63f2be9ede023c561851ac8",
  "parent_commit": "d263bd9df7b2f5586910e5d006a11ff11ba7c310",
  "model": "meta-llama/Llama-3.1-8B-Instruct",
  "status": "success",
  "error": null,
  "duration_s": 199.6857945919037,
  "metrics": {
    "ttft_mean_ms": 602.47,
    "ttft_median_ms": 566.79,
    "ttft_p99_ms": 967.87,
    "tpot_mean_ms": 22.62,
    "tpot_median_ms": 23.21,
    "tpot_p99_ms": 30.24,
    "itl_mean_ms": 22.56,
    "itl_median_ms": 16.44,
    "itl_p99_ms": 290.38,
    "request_throughput_req_s": 48.83,
    "output_token_throughput_tok_s": 3125.18,
    "total_token_throughput_tok_s": 14824.11
  },
  "raw_output": "INFO:     127.0.0.1:33486 - \"POST /v1/completions HTTP/1.1\" 200 OK\nINFO:     127.0.0.1:33490 - \"POST /v1/completions HTTP/1.1\" 200 OK\n\n  1%|          | 1/100 [00:02<03:22,  2.05s/it]\n100%|\u2588\u2588\u2588\u2588\u2588\u2588\u2588\u2588\u2588\u2588| 100/100 [00:02<00:00, 48.83it/s]\n============ Serving Benchmark Result ============\nSuccessful requests:                     100       \nBenchmark duration (s):                  2.05      \nTotal input tokens:                      23958     \nTotal generated tokens:                  6400      \nRequest throughput (req/s):              48.83     \nOutput token throughput (tok/s):         3125.18   \nTotal Token throughput (tok/s):          14824.11  \n---------------Time to First Token----------------\nMean TTFT (ms):                          602.47    \nMedian TTFT (ms):                        566.79    \nP99 TTFT (ms):                           967.87    \n-----Time per Output Token (excl. 1st token)------\nMean TPOT (ms):                          22.62     \nMedian TPOT (ms):                        23.21     \nP99 TPOT (ms):                           30.24     \n---------------Inter-token Latency----------------\nMean ITL (ms):                           22.56     \nMedian ITL (ms):                         16.44     \nP99 ITL (ms):                            290.38    \n==================================================\n============ Serving Benchmark Result ============\nRequest throughput (req/s):              48.83     \nOutput token throughput (tok/s):         3125.18   \nTotal Token throughput (tok/s):          14824.11  \nMean TTFT (ms):                          602.47    \nMedian TTFT (ms):                        566.79    \nP99 TTFT (ms):                           967.87    \nMean TPOT (ms):                          22.62     \nMedian TPOT (ms):                        23.21     \nP99 TPOT (ms):                           30.24     \nMean ITL (ms):                           22.56     \nMedian ITL (ms):                         16.44     \nP99 ITL (ms):                            290.38    \n==================================================\nBENCHMARK_DONE\nUnable to find image 'anonymous/vllm-baseline:baseline-d263bd9df7b2' locally\nbaseline-d263bd9df7b2: Pulling from anonymous/vllm-baseline\n3c645031de29: Already exists\n0d6448aff889: Already exists\n0a7674e3e8fe: Already exists\nb71b637b97c5: Already exists\n56dc85502937: Already exists\nb9839793d66a: Pulling fs layer\n2b5f54714bab: Pulling fs layer\n7fb1d733c143: Pulling fs layer\ndfe7effe1245: Pulling fs layer\n2c5d1eae04e0: Pulling fs layer\n54d061bf5ef2: Pulling fs layer\n88fa1d2eef78: Pulling fs layer\ndfe7effe1245: Waiting\n35f0d8170071: Pulling fs layer\n2c5d1eae04e0: Waiting\n54d061bf5ef2: Waiting\n88fa1d2eef78: Waiting\ndc8b6540faad: Pulling fs layer\nfe826663c88f: Pulling fs layer\n35f0d8170071: Waiting\ndc8b6540faad: Waiting\n64fc46d31217: Pulling fs layer\nadc0ca68ff33: Pulling fs layer\n4f05f59dc675: Pulling fs layer\n64fc46d31217: Waiting\nfe826663c88f: Waiting\nadc0ca68ff33: Waiting\n0a4778bb88af: Pulling fs layer\n4f05f59dc675: Waiting\n52f980307ae6: Pulling fs layer\n6e514a953a16: Pulling fs layer\ndc15adbd456c: Pulling fs layer\n63dd6f95a2bc: Pulling fs layer\n0a4778bb88af: Waiting\ndc15adbd456c: Waiting\n6e514a953a16: Waiting\n63dd6f95a2bc: Waiting\n52f980307ae6: Waiting\nb9839793d66a: Download complete\n2b5f54714bab: Verifying Checksum\n2b5f54714bab: Download complete\nb9839793d66a: Pull complete\n2b5f54714bab: Pull complete\ndfe7effe1245: Verifying Checksum\ndfe7effe1245: Download complete\n7fb1d733c143: Verifying Checksum\n7fb1d733c143: Download complete\n88fa1d2eef78: Download complete\n35f0d8170071: Verifying Checksum\n35f0d8170071: Download complete\n7fb1d733c143: Pull complete\ndfe7effe1245: Pull complete\n54d061bf5ef2: Verifying Checksum\n54d061bf5ef2: Download complete\nfe826663c88f: Verifying Checksum\nfe826663c88f: Download complete\n64fc46d31217: Verifying Checksum\n64fc46d31217: Download complete\nadc0ca68ff33: Download complete\n4f05f59dc675: Verifying Checksum\n4f05f59dc675: Download complete\n0a4778bb88af: Verifying Checksum\n0a4778bb88af: Download complete\n52f980307ae6: Verifying Checksum\n52f980307ae6: Download complete\n6e514a953a16: Verifying Checksum\n6e514a953a16: Download complete\ndc15adbd456c: Verifying Checksum\ndc15adbd456c: Download complete\n63dd6f95a2bc: Verifying Checksum\n63dd6f95a2bc: Download complete\n2c5d1eae04e0: Verifying Checksum\n2c5d1eae04e0: Download complete\ndc8b6540faad: Verifying Checksum\ndc8b6540faad: Download complete\n2c5d1eae04e0: Pull complete\n54d061bf5ef2: Pull complete\n88fa1d2eef78: Pull complete\n35f0d8170071: Pull complete\ndc8b6540faad: Pull complete\nfe826663c88f: Pull complete\n64fc46d31217: Pull complete\nadc0ca68ff33: Pull complete\n4f05f59dc675: Pull complete\n0a4778bb88af: Pull complete\n52f980307ae6: Pull complete\n6e514a953a16: Pull complete\ndc15adbd456c: Pull complete\n63dd6f95a2bc: Pull complete\nDigest: sha256:2fbc96cd904891908e87b9c9b7116ae8d435a2c291755054431ed9d409adaa3f\nStatus: Downloaded newer image for anonymous/vllm-baseline:baseline-d263bd9df7b2\n",
  "timestamp": "2026-01-14 21:13:23"
}