{
  "human_commit": "9f1710f1",
  "human_commit_full": "9f1710f1ace3535920c0bb6d4cc329c36289080e",
  "parent_commit": "e642ec962cf2283f9aa44492727e6efc17a32129",
  "model": "deepseek-ai/DeepSeek-V2-Lite-Chat",
  "status": "success",
  "error": null,
  "duration_s": 210.0050117969513,
  "metrics": {
    "ttft_mean_ms": 590.1,
    "ttft_median_ms": 573.53,
    "ttft_p99_ms": 778.34,
    "tpot_mean_ms": 25.9,
    "tpot_median_ms": 26.2,
    "tpot_p99_ms": 31.68,
    "itl_mean_ms": 25.9,
    "itl_median_ms": 23.3,
    "itl_p99_ms": 119.4,
    "request_throughput_req_s": 44.56,
    "output_token_throughput_tok_s": 2851.87,
    "total_token_throughput_tok_s": 13420.29
  },
  "raw_output": "                       573.53    \nP99 TTFT (ms):                           778.34    \n-----Time per Output Token (excl. 1st token)------\nMean TPOT (ms):                          25.90     \nMedian TPOT (ms):                        26.20     \nP99 TPOT (ms):                           31.68     \n---------------Inter-token Latency----------------\nMean ITL (ms):                           25.90     \nMedian ITL (ms):                         23.30     \nP99 ITL (ms):                            119.40    \n==================================================\n============ Serving Benchmark Result ============\nRequest throughput (req/s):              44.56     \nOutput token throughput (tok/s):         2851.87   \nTotal Token throughput (tok/s):          13420.29  \nMean TTFT (ms):                          590.10    \nMedian TTFT (ms):                        573.53    \nP99 TTFT (ms):                           778.34    \nMean TPOT (ms):                          25.90     \nMedian TPOT (ms):                        26.20     \nP99 TPOT (ms):                           31.68     \nMean ITL (ms):                           25.90     \nMedian ITL (ms):                         23.30     \nP99 ITL (ms):                            119.40    \n==================================================\nBENCHMARK_DONE\nUnable to find image 'anonymous/vllm-baseline:baseline-e642ec962cf2' locally\nbaseline-e642ec962cf2: Pulling from anonymous/vllm-baseline\n3c645031de29: Already exists\n0d6448aff889: Already exists\n0a7674e3e8fe: Already exists\nb71b637b97c5: Already exists\n56dc85502937: Already exists\nec6d5f6c9ed9: Already exists\n47b8539d532f: Already exists\nfd9cc1ad8dee: Already exists\n83525caeeb35: Already exists\n8e79813a7b9d: Already exists\n312a542960e3: Already exists\n479ef8d53ea8: Pulling fs layer\n1a983e62f512: Pulling fs layer\n5e6f59d997eb: Pulling fs layer\nc1477dac7811: Pulling fs layer\nebf04c7ca259: Pulling fs layer\n0ce3ad053c88: Pulling fs layer\ned9d2311c2bf: Pulling fs layer\n7a03f2abcbf7: Pulling fs layer\n69e9cb47d245: Pulling fs layer\nde507d7a7a79: Pulling fs layer\nfbbc2178b077: Pulling fs layer\n9e2aa61688ef: Pulling fs layer\nebf04c7ca259: Waiting\n0ce3ad053c88: Waiting\nc1477dac7811: Waiting\ned9d2311c2bf: Waiting\nc30c7f0f11f0: Pulling fs layer\n7a03f2abcbf7: Waiting\n69e9cb47d245: Waiting\nfbbc2178b077: Waiting\nde507d7a7a79: Waiting\n9e2aa61688ef: Waiting\na1cb6ca750a0: Pulling fs layer\nc30c7f0f11f0: Waiting\nb55bf2cb80f1: Pulling fs layer\na1cb6ca750a0: Waiting\n66aef43de895: Pulling fs layer\nb55bf2cb80f1: Waiting\n2269533d4707: Pulling fs layer\n581b2a19a2d0: Pulling fs layer\nfb2909343e7d: Pulling fs layer\n2269533d4707: Waiting\n0f9795344a32: Pulling fs layer\n581b2a19a2d0: Waiting\nfb2909343e7d: Waiting\n75d8b89cbdf6: Pulling fs layer\n0f9795344a32: Waiting\n06fe87de738b: Pulling fs layer\n06fe87de738b: Waiting\n75d8b89cbdf6: Waiting\n1a983e62f512: Verifying Checksum\n1a983e62f512: Download complete\n479ef8d53ea8: Verifying Checksum\n479ef8d53ea8: Download complete\n479ef8d53ea8: Pull complete\n1a983e62f512: Pull complete\nebf04c7ca259: Download complete\n0ce3ad053c88: Verifying Checksum\n0ce3ad053c88: Download complete\nc1477dac7811: Verifying Checksum\nc1477dac7811: Download complete\n5e6f59d997eb: Verifying Checksum\n5e6f59d997eb: Download complete\n69e9cb47d245: Verifying Checksum\n69e9cb47d245: Download complete\nde507d7a7a79: Verifying Checksum\nde507d7a7a79: Download complete\nfbbc2178b077: Verifying Checksum\nfbbc2178b077: Download complete\n9e2aa61688ef: Verifying Checksum\n9e2aa61688ef: Download complete\n7a03f2abcbf7: Verifying Checksum\n7a03f2abcbf7: Download complete\na1cb6ca750a0: Verifying Checksum\na1cb6ca750a0: Download complete\nb55bf2cb80f1: Verifying Checksum\nb55bf2cb80f1: Download complete\n66aef43de895: Download complete\n2269533d4707: Verifying Checksum\n2269533d4707: Download complete\nc30c7f0f11f0: Verifying Checksum\nc30c7f0f11f0: Download complete\nfb2909343e7d: Verifying Checksum\nfb2909343e7d: Download complete\n0f9795344a32: Verifying Checksum\n0f9795344a32: Download complete\n75d8b89cbdf6: Verifying Checksum\n75d8b89cbdf6: Download complete\n5e6f59d997eb: Pull complete\nc1477dac7811: Pull complete\nebf04c7ca259: Pull complete\n0ce3ad053c88: Pull complete\n06fe87de738b: Verifying Checksum\n06fe87de738b: Download complete\n581b2a19a2d0: Verifying Checksum\n581b2a19a2d0: Download complete\ned9d2311c2bf: Verifying Checksum\ned9d2311c2bf: Download complete\ned9d2311c2bf: Pull complete\n7a03f2abcbf7: Pull complete\n69e9cb47d245: Pull complete\nde507d7a7a79: Pull complete\nfbbc2178b077: Pull complete\n9e2aa61688ef: Pull complete\nc30c7f0f11f0: Pull complete\na1cb6ca750a0: Pull complete\nb55bf2cb80f1: Pull complete\n66aef43de895: Pull complete\n2269533d4707: Pull complete\n581b2a19a2d0: Pull complete\nfb2909343e7d: Pull complete\n0f9795344a32: Pull complete\n75d8b89cbdf6: Pull complete\n06fe87de738b: Pull complete\nDigest: sha256:ff264826494c2eafe34cf7650e56890a7f0dc2885559f5b546174efd7f50dcad\nStatus: Downloaded newer image for anonymous/vllm-baseline:baseline-e642ec962cf2\n",
  "timestamp": "2026-01-14 22:38:37"
}