{
  "human_commit": "ca7a2d5f",
  "human_commit_full": "ca7a2d5f28eac9621474563cdda0e08596222755",
  "parent_commit": "333681408feabb97193880303b23f6571ba39045",
  "model": "deepseek-ai/DeepSeek-Coder-V2-Lite-Instruct",
  "status": "success",
  "error": null,
  "duration_s": 222.17080187797546,
  "metrics": {
    "ttft_mean_ms": 585.94,
    "ttft_median_ms": 582.67,
    "ttft_p99_ms": 778.31,
    "tpot_mean_ms": 23.38,
    "tpot_median_ms": 23.46,
    "tpot_p99_ms": 28.96,
    "itl_mean_ms": 23.38,
    "itl_median_ms": 20.21,
    "itl_p99_ms": 110.94,
    "request_throughput_req_s": 48.06,
    "output_token_throughput_tok_s": 3075.8,
    "total_token_throughput_tok_s": 14474.04
  },
  "raw_output": "l generated tokens:                  6400      \nRequest throughput (req/s):              48.06     \nOutput token throughput (tok/s):         3075.80   \nTotal Token throughput (tok/s):          14474.04  \n---------------Time to First Token----------------\nMean TTFT (ms):                          585.94    \nMedian TTFT (ms):                        582.67    \nP99 TTFT (ms):                           778.31    \n-----Time per Output Token (excl. 1st token)------\nMean TPOT (ms):                          23.38     \nMedian TPOT (ms):                        23.46     \nP99 TPOT (ms):                           28.96     \n---------------Inter-token Latency----------------\nMean ITL (ms):                           23.38     \nMedian ITL (ms):                         20.21     \nP99 ITL (ms):                            110.94    \n==================================================\n============ Serving Benchmark Result ============\nRequest throughput (req/s):              48.06     \nOutput token throughput (tok/s):         3075.80   \nTotal Token throughput (tok/s):          14474.04  \nMean TTFT (ms):                          585.94    \nMedian TTFT (ms):                        582.67    \nP99 TTFT (ms):                           778.31    \nMean TPOT (ms):                          23.38     \nMedian TPOT (ms):                        23.46     \nP99 TPOT (ms):                           28.96     \nMean ITL (ms):                           23.38     \nMedian ITL (ms):                         20.21     \nP99 ITL (ms):                            110.94    \n==================================================\nBENCHMARK_DONE\nUnable to find image 'anonymous/vllm-baseline:baseline-333681408fea' locally\nbaseline-333681408fea: Pulling from anonymous/vllm-baseline\n3c645031de29: Already exists\n0d6448aff889: Already exists\n0a7674e3e8fe: Already exists\nb71b637b97c5: Already exists\n56dc85502937: Already exists\nec6d5f6c9ed9: Already exists\n47b8539d532f: Already exists\nfd9cc1ad8dee: Already exists\n83525caeeb35: Already exists\n8e79813a7b9d: Already exists\n312a542960e3: Already exists\n479ef8d53ea8: Already exists\n1a983e62f512: Already exists\n76ea787092a7: Pulling fs layer\n652dca9ec9a1: Pulling fs layer\n75431439e081: Pulling fs layer\n4f4fb700ef54: Pulling fs layer\n40f7bfcf3f68: Pulling fs layer\n0507492502cc: Pulling fs layer\na5d14b6ad608: Pulling fs layer\nb8059c919248: Pulling fs layer\n4f4fb700ef54: Waiting\n40f7bfcf3f68: Waiting\naeb49feb970c: Pulling fs layer\n0507492502cc: Waiting\na5d14b6ad608: Waiting\nc7571a2a9362: Pulling fs layer\nb8059c919248: Waiting\naeb49feb970c: Waiting\n384c4da2a38e: Pulling fs layer\nf608558cfb66: Pulling fs layer\n57f4e6ffdddc: Pulling fs layer\nc7571a2a9362: Waiting\n9a9359900dab: Pulling fs layer\n384c4da2a38e: Waiting\nf608558cfb66: Waiting\n9394c2b951a3: Pulling fs layer\n57f4e6ffdddc: Waiting\n75d44187352a: Pulling fs layer\n9a9359900dab: Waiting\n76ffb49a0b0a: Pulling fs layer\n9394c2b951a3: Waiting\n75d44187352a: Waiting\n860be9d2b4d7: Pulling fs layer\n76ffb49a0b0a: Waiting\n1247761ab3fd: Pulling fs layer\n860be9d2b4d7: Waiting\n1247761ab3fd: Waiting\n75431439e081: Verifying Checksum\n75431439e081: Download complete\n4f4fb700ef54: Verifying Checksum\n4f4fb700ef54: Download complete\n652dca9ec9a1: Verifying Checksum\n652dca9ec9a1: Download complete\n76ea787092a7: Verifying Checksum\n76ea787092a7: Download complete\na5d14b6ad608: Verifying Checksum\na5d14b6ad608: Download complete\nb8059c919248: Verifying Checksum\nb8059c919248: Download complete\naeb49feb970c: Verifying Checksum\naeb49feb970c: Download complete\nc7571a2a9362: Verifying Checksum\nc7571a2a9362: Download complete\n0507492502cc: Verifying Checksum\n0507492502cc: Download complete\nf608558cfb66: Verifying Checksum\nf608558cfb66: Download complete\n57f4e6ffdddc: Verifying Checksum\n57f4e6ffdddc: Download complete\n9a9359900dab: Download complete\n9394c2b951a3: Verifying Checksum\n9394c2b951a3: Download complete\n76ea787092a7: Pull complete\n652dca9ec9a1: Pull complete\n75431439e081: Pull complete\n4f4fb700ef54: Pull complete\n384c4da2a38e: Verifying Checksum\n384c4da2a38e: Download complete\n76ffb49a0b0a: Verifying Checksum\n76ffb49a0b0a: Download complete\n860be9d2b4d7: Verifying Checksum\n860be9d2b4d7: Download complete\n1247761ab3fd: Verifying Checksum\n1247761ab3fd: Download complete\n75d44187352a: Verifying Checksum\n75d44187352a: Download complete\n40f7bfcf3f68: Verifying Checksum\n40f7bfcf3f68: Download complete\n40f7bfcf3f68: Pull complete\n0507492502cc: Pull complete\na5d14b6ad608: Pull complete\nb8059c919248: Pull complete\naeb49feb970c: Pull complete\nc7571a2a9362: Pull complete\n384c4da2a38e: Pull complete\nf608558cfb66: Pull complete\n57f4e6ffdddc: Pull complete\n9a9359900dab: Pull complete\n9394c2b951a3: Pull complete\n75d44187352a: Pull complete\n76ffb49a0b0a: Pull complete\n860be9d2b4d7: Pull complete\n1247761ab3fd: Pull complete\nDigest: sha256:4b781a687d771d9f5608ca45e7c353b9bd799034b530072cb84aa509662ce6a0\nStatus: Downloaded newer image for anonymous/vllm-baseline:baseline-333681408fea\n",
  "timestamp": "2026-01-14 23:33:08"
}