{
  "human_commit": "f092153f",
  "human_commit_full": "f092153fbe349a9a1742940e3703bfcff6aa0a6d",
  "parent_commit": "1da8f0e1dddaf8625829e7ecca7fce93eb685c03",
  "model": "meta-llama/Llama-3.1-8B-Instruct",
  "status": "success",
  "error": null,
  "duration_s": 204.87580585479736,
  "metrics": {
    "ttft_mean_ms": 599.09,
    "ttft_median_ms": 552.69,
    "ttft_p99_ms": 962.4,
    "tpot_mean_ms": 22.55,
    "tpot_median_ms": 23.31,
    "tpot_p99_ms": 30.26,
    "itl_mean_ms": 22.49,
    "itl_median_ms": 16.43,
    "itl_p99_ms": 293.56,
    "request_throughput_req_s": 49.02,
    "output_token_throughput_tok_s": 3137.21,
    "total_token_throughput_tok_s": 14881.18
  },
  "raw_output": "ions HTTP/1.1\" 200 OK\nINFO:     127.0.0.1:47014 - \"POST /v1/completions HTTP/1.1\" 200 OK\nINFO:     127.0.0.1:47030 - \"POST /v1/completions HTTP/1.1\" 200 OK\nINFO:     127.0.0.1:47044 - \"POST /v1/completions HTTP/1.1\" 200 OK\nINFO:     127.0.0.1:47054 - \"POST /v1/completions HTTP/1.1\" 200 OK\nINFO:     127.0.0.1:47058 - \"POST /v1/completions HTTP/1.1\" 200 OK\nINFO:     127.0.0.1:47066 - \"POST /v1/completions HTTP/1.1\" 200 OK\n\n  1%|          | 1/100 [00:02<03:21,  2.04s/it]\n100%|\u2588\u2588\u2588\u2588\u2588\u2588\u2588\u2588\u2588\u2588| 100/100 [00:02<00:00, 49.02it/s]\n============ Serving Benchmark Result ============\nSuccessful requests:                     100       \nBenchmark duration (s):                  2.04      \nTotal input tokens:                      23958     \nTotal generated tokens:                  6400      \nRequest throughput (req/s):              49.02     \nOutput token throughput (tok/s):         3137.21   \nTotal Token throughput (tok/s):          14881.18  \n---------------Time to First Token----------------\nMean TTFT (ms):                          599.09    \nMedian TTFT (ms):                        552.69    \nP99 TTFT (ms):                           962.40    \n-----Time per Output Token (excl. 1st token)------\nMean TPOT (ms):                          22.55     \nMedian TPOT (ms):                        23.31     \nP99 TPOT (ms):                           30.26     \n---------------Inter-token Latency----------------\nMean ITL (ms):                           22.49     \nMedian ITL (ms):                         16.43     \nP99 ITL (ms):                            293.56    \n==================================================\n============ Serving Benchmark Result ============\nRequest throughput (req/s):              49.02     \nOutput token throughput (tok/s):         3137.21   \nTotal Token throughput (tok/s):          14881.18  \nMean TTFT (ms):                          599.09    \nMedian TTFT (ms):                        552.69    \nP99 TTFT (ms):                           962.40    \nMean TPOT (ms):                          22.55     \nMedian TPOT (ms):                        23.31     \nP99 TPOT (ms):                           30.26     \nMean ITL (ms):                           22.49     \nMedian ITL (ms):                         16.43     \nP99 ITL (ms):                            293.56    \n==================================================\nBENCHMARK_DONE\nUnable to find image 'anonymous/vllm-baseline:baseline-1da8f0e1ddda' locally\nbaseline-1da8f0e1ddda: Pulling from anonymous/vllm-baseline\n3c645031de29: Already exists\n0d6448aff889: Already exists\n0a7674e3e8fe: Already exists\nb71b637b97c5: Already exists\n56dc85502937: Already exists\nb9839793d66a: Pulling fs layer\n2b5f54714bab: Pulling fs layer\n7fb1d733c143: Pulling fs layer\ndfe7effe1245: Pulling fs layer\nade1e18f6b5d: Pulling fs layer\n3b97b6503e2a: Pulling fs layer\n008cc8c3a152: Pulling fs layer\nc1c7519c007f: Pulling fs layer\n0fe41f7f4652: Pulling fs layer\nfdb92580a58f: Pulling fs layer\n029ad33b283e: Pulling fs layer\n288bb10f4007: Pulling fs layer\nc28e32e45baf: Pulling fs layer\nade1e18f6b5d: Waiting\n3b97b6503e2a: Waiting\n008cc8c3a152: Waiting\nfe67f3a059d4: Pulling fs layer\n029ad33b283e: Waiting\nd81fe7f4b661: Pulling fs layer\n288bb10f4007: Waiting\nc1c7519c007f: Waiting\n21179d0b986e: Pulling fs layer\n0fe41f7f4652: Waiting\nc28e32e45baf: Waiting\nfe67f3a059d4: Waiting\nd81fe7f4b661: Waiting\n21179d0b986e: Waiting\nfdb92580a58f: Waiting\ndfe7effe1245: Waiting\n2b5f54714bab: Verifying Checksum\n2b5f54714bab: Download complete\nb9839793d66a: Verifying Checksum\nb9839793d66a: Download complete\nb9839793d66a: Pull complete\n2b5f54714bab: Pull complete\ndfe7effe1245: Verifying Checksum\ndfe7effe1245: Download complete\n7fb1d733c143: Verifying Checksum\n008cc8c3a152: Verifying Checksum\n008cc8c3a152: Download complete\nc1c7519c007f: Verifying Checksum\nc1c7519c007f: Download complete\n3b97b6503e2a: Verifying Checksum\n3b97b6503e2a: Download complete\nfdb92580a58f: Verifying Checksum\nfdb92580a58f: Download complete\n029ad33b283e: Verifying Checksum\n029ad33b283e: Download complete\n288bb10f4007: Verifying Checksum\n288bb10f4007: Download complete\n7fb1d733c143: Pull complete\ndfe7effe1245: Pull complete\nc28e32e45baf: Verifying Checksum\nc28e32e45baf: Download complete\nfe67f3a059d4: Download complete\nd81fe7f4b661: Verifying Checksum\nd81fe7f4b661: Download complete\n21179d0b986e: Verifying Checksum\n21179d0b986e: Download complete\nade1e18f6b5d: Verifying Checksum\nade1e18f6b5d: Download complete\n0fe41f7f4652: Verifying Checksum\nade1e18f6b5d: Pull complete\n3b97b6503e2a: Pull complete\n008cc8c3a152: Pull complete\nc1c7519c007f: Pull complete\n0fe41f7f4652: Pull complete\nfdb92580a58f: Pull complete\n029ad33b283e: Pull complete\n288bb10f4007: Pull complete\nc28e32e45baf: Pull complete\nfe67f3a059d4: Pull complete\nd81fe7f4b661: Pull complete\n21179d0b986e: Pull complete\nDigest: sha256:f76234a05bea15dda5b7a918f2136cb21a20e1eb895bf60ca6c4998bede7864e\nStatus: Downloaded newer image for anonymous/vllm-baseline:baseline-1da8f0e1ddda\n",
  "timestamp": "2026-01-14 23:15:04"
}