{
  "human_commit": "58eee5f2",
  "human_commit_full": "58eee5f2e05b74eb2cb1a3bbda9c04df4805e4cc",
  "parent_commit": "067c34a1559400e956311f067ddd185f54207a2b",
  "model": "meta-llama/Llama-3.1-8B-Instruct",
  "status": "success",
  "error": null,
  "duration_s": 326.6190655231476,
  "metrics": {
    "ttft_mean_ms": 635.42,
    "ttft_median_ms": 694.38,
    "ttft_p99_ms": 1017.67,
    "tpot_mean_ms": 27.99,
    "tpot_median_ms": 23.61,
    "tpot_p99_ms": 183.44,
    "itl_mean_ms": 23.57,
    "itl_median_ms": 16.85,
    "itl_p99_ms": 349.21,
    "request_throughput_req_s": 47.0,
    "output_token_throughput_tok_s": 2907.55,
    "total_token_throughput_tok_s": 14893.06
  },
  "raw_output": "======\nRequest throughput (req/s):              47.00     \nOutput token throughput (tok/s):         2907.55   \nTotal Token throughput (tok/s):          14893.06  \nMean TTFT (ms):                          635.42    \nMedian TTFT (ms):                        694.38    \nP99 TTFT (ms):                           1017.67   \nMean TPOT (ms):                          27.99     \nMedian TPOT (ms):                        23.61     \nP99 TPOT (ms):                           183.44    \nMean ITL (ms):                           23.57     \nMedian ITL (ms):                         16.85     \nP99 ITL (ms):                            349.21    \n==================================================\nBENCHMARK_DONE\nUnable to find image 'anonymous/vllm-baseline:baseline-067c34a15594' locally\nbaseline-067c34a15594: Pulling from anonymous/vllm-baseline\n9cb31e2e37ea: Already exists\nb95112eaf283: Already exists\n030ef8250936: Already exists\n72ac9ccfda38: Already exists\n73389fbd088f: Already exists\n0264850675f7: Already exists\nde1d03310308: Already exists\nc1d2af7fad0f: Already exists\n5601308b3ac6: Already exists\n6b2035e8b73e: Already exists\ned71f8f81b33: Already exists\n6a2306edc128: Pulling fs layer\nbb5ee2f41954: Pulling fs layer\nae1cc335b65b: Pulling fs layer\n2fb01f5ad376: Pulling fs layer\nb7dfd152a1fd: Pulling fs layer\n2987a32afa11: Pulling fs layer\nb7dfd152a1fd: Waiting\n2fb01f5ad376: Waiting\n426c0b8657c7: Pulling fs layer\n2987a32afa11: Waiting\n4053ab814291: Pulling fs layer\n426c0b8657c7: Waiting\n13ce3c4816f4: Pulling fs layer\n3e1389305925: Pulling fs layer\n99bc1d2b2603: Pulling fs layer\n97b0b6f3fc9a: Pulling fs layer\nfdbaa8926896: Pulling fs layer\n13ce3c4816f4: Waiting\na0ae8e6f2a8d: Pulling fs layer\n3e1389305925: Waiting\n00935140b73f: Pulling fs layer\n4053ab814291: Waiting\n99bc1d2b2603: Waiting\nfdbaa8926896: Waiting\na0ae8e6f2a8d: Waiting\n97b0b6f3fc9a: Waiting\n11f35d6da56c: Pulling fs layer\n00935140b73f: Waiting\nf340b2094e32: Pulling fs layer\nc350221da2b3: Pulling fs layer\n339c01e76e25: Pulling fs layer\n4a0782f02aad: Pulling fs layer\n11f35d6da56c: Waiting\nc350221da2b3: Waiting\nf340b2094e32: Waiting\n339c01e76e25: Waiting\n006512d4c9bf: Pulling fs layer\n4a0782f02aad: Waiting\n905dec21e628: Pulling fs layer\n006512d4c9bf: Waiting\na1e3c1c6a78d: Pulling fs layer\nccf5c6e9945c: Pulling fs layer\n905dec21e628: Waiting\na1e3c1c6a78d: Waiting\ne8636652ee50: Pulling fs layer\n13d7d96ab8fc: Pulling fs layer\nccf5c6e9945c: Waiting\n2b674569a9e7: Pulling fs layer\n13d7d96ab8fc: Waiting\ne8636652ee50: Waiting\n6a2306edc128: Download complete\nbb5ee2f41954: Verifying Checksum\nbb5ee2f41954: Download complete\n6a2306edc128: Pull complete\nbb5ee2f41954: Pull complete\nb7dfd152a1fd: Verifying Checksum\nb7dfd152a1fd: Download complete\n2987a32afa11: Verifying Checksum\n2987a32afa11: Download complete\n2fb01f5ad376: Verifying Checksum\n2fb01f5ad376: Download complete\n4053ab814291: Verifying Checksum\n4053ab814291: Download complete\n13ce3c4816f4: Verifying Checksum\n13ce3c4816f4: Download complete\n3e1389305925: Verifying Checksum\n3e1389305925: Download complete\n99bc1d2b2603: Verifying Checksum\n99bc1d2b2603: Download complete\n97b0b6f3fc9a: Download complete\nfdbaa8926896: Download complete\na0ae8e6f2a8d: Verifying Checksum\na0ae8e6f2a8d: Download complete\n00935140b73f: Verifying Checksum\n00935140b73f: Download complete\nae1cc335b65b: Download complete\n11f35d6da56c: Verifying Checksum\n11f35d6da56c: Download complete\nf340b2094e32: Verifying Checksum\nf340b2094e32: Download complete\n339c01e76e25: Verifying Checksum\n339c01e76e25: Download complete\n4a0782f02aad: Verifying Checksum\n4a0782f02aad: Download complete\n006512d4c9bf: Download complete\n905dec21e628: Download complete\na1e3c1c6a78d: Verifying Checksum\na1e3c1c6a78d: Download complete\nae1cc335b65b: Pull complete\n2fb01f5ad376: Pull complete\nb7dfd152a1fd: Pull complete\n2987a32afa11: Pull complete\nccf5c6e9945c: Verifying Checksum\nccf5c6e9945c: Download complete\ne8636652ee50: Verifying Checksum\ne8636652ee50: Download complete\n13d7d96ab8fc: Verifying Checksum\n13d7d96ab8fc: Download complete\n2b674569a9e7: Verifying Checksum\n2b674569a9e7: Download complete\nc350221da2b3: Verifying Checksum\nc350221da2b3: Download complete\n426c0b8657c7: Verifying Checksum\n426c0b8657c7: Download complete\n426c0b8657c7: Pull complete\n4053ab814291: Pull complete\n13ce3c4816f4: Pull complete\n3e1389305925: Pull complete\n99bc1d2b2603: Pull complete\n97b0b6f3fc9a: Pull complete\nfdbaa8926896: Pull complete\na0ae8e6f2a8d: Pull complete\n00935140b73f: Pull complete\n11f35d6da56c: Pull complete\nf340b2094e32: Pull complete\nc350221da2b3: Pull complete\n339c01e76e25: Pull complete\n4a0782f02aad: Pull complete\n006512d4c9bf: Pull complete\n905dec21e628: Pull complete\na1e3c1c6a78d: Pull complete\nccf5c6e9945c: Pull complete\ne8636652ee50: Pull complete\n13d7d96ab8fc: Pull complete\n2b674569a9e7: Pull complete\nDigest: sha256:149c3de29bc8738cc0e10a64f8ce7c03e210b9f99402394be309c4bad9d30101\nStatus: Image is up to date for anonymous/vllm-baseline:baseline-067c34a15594\n",
  "timestamp": "2026-01-15 04:32:51"
}