{
  "human_commit": "6ce01f30",
  "human_commit_full": "6ce01f30667bbae33f112152e07a3b66b841078f",
  "parent_commit": "6a11fdfbb8d6701c7ad38648aead23d8cbe6aac5",
  "model": "meta-llama/Meta-Llama-3-8B",
  "status": "success",
  "error": null,
  "duration_s": 242.48596811294556,
  "metrics": {
    "ttft_mean_ms": 870.06,
    "ttft_median_ms": 802.82,
    "ttft_p99_ms": 1428.57,
    "tpot_mean_ms": 50.21,
    "tpot_median_ms": 35.98,
    "tpot_p99_ms": 542.82,
    "itl_mean_ms": 56.88,
    "itl_median_ms": 26.6,
    "itl_p99_ms": 968.43,
    "request_throughput_req_s": 31.17,
    "output_token_throughput_tok_s": 1773.86
  },
  "raw_output": ".0.0.1:42228 - \"POST /v1/completions HTTP/1.1\" 200 OK\nINFO:     127.0.0.1:42242 - \"POST /v1/completions HTTP/1.1\" 200 OK\nINFO:     127.0.0.1:42250 - \"POST /v1/completions HTTP/1.1\" 200 OK\nINFO:     127.0.0.1:42258 - \"POST /v1/completions HTTP/1.1\" 200 OK\nINFO:     127.0.0.1:42260 - \"POST /v1/completions HTTP/1.1\" 200 OK\n\n  1%|          | 1/100 [00:01<02:22,  1.44s/it]INFO 01-17 19:55:06 metrics.py:406] Avg prompt throughput: 5402.6 tokens/s, Avg generation throughput: 296.5 tokens/s, Running: 94 reqs, Swapped: 0 reqs, Pending: 0 reqs, GPU KV cache usage: 6.1%, CPU KV cache usage: 0.0%.\n\n  7%|\u258b         | 7/100 [00:03<00:38,  2.42it/s]\n100%|\u2588\u2588\u2588\u2588\u2588\u2588\u2588\u2588\u2588\u2588| 100/100 [00:03<00:00, 31.17it/s]\n============ Serving Benchmark Result ============\nSuccessful requests:                     100       \nBenchmark duration (s):                  3.21      \nTotal input tokens:                      25600     \nTotal generated tokens:                  5691      \nRequest throughput (req/s):              31.17     \nInput token throughput (tok/s):          7979.39   \nOutput token throughput (tok/s):         1773.86   \n---------------Time to First Token----------------\nMean TTFT (ms):                          870.06    \nMedian TTFT (ms):                        802.82    \nP99 TTFT (ms):                           1428.57   \n-----Time per Output Token (excl. 1st token)------\nMean TPOT (ms):                          50.21     \nMedian TPOT (ms):                        35.98     \nP99 TPOT (ms):                           542.82    \n---------------Inter-token Latency----------------\nMean ITL (ms):                           56.88     \nMedian ITL (ms):                         26.60     \nP99 ITL (ms):                            968.43    \n==================================================\n============ Serving Benchmark Result ============\nRequest throughput (req/s):              31.17     \nInput token throughput (tok/s):          7979.39   \nOutput token throughput (tok/s):         1773.86   \nMean TTFT (ms):                          870.06    \nMedian TTFT (ms):                        802.82    \nP99 TTFT (ms):                           1428.57   \nMean TPOT (ms):                          50.21     \nMedian TPOT (ms):                        35.98     \nP99 TPOT (ms):                           542.82    \nMean ITL (ms):                           56.88     \nMedian ITL (ms):                         26.60     \nP99 ITL (ms):                            968.43    \n==================================================\nBENCHMARK_DONE\nUnable to find image 'anonymous/vllm-baseline:baseline-6a11fdfbb8d6' locally\nbaseline-6a11fdfbb8d6: Pulling from anonymous/vllm-baseline\n43cfb69dbb46: Pulling fs layer\nfbcd35dc5bc3: Pulling fs layer\nc7232af9ae05: Pulling fs layer\ndb6cdef1932a: Pulling fs layer\n56dc85502937: Pulling fs layer\nfaeb796bb7e6: Pulling fs layer\n01eb6572c8f1: Pulling fs layer\n27ea311cab37: Pulling fs layer\n993556ea2050: Pulling fs layer\n4f4fb700ef54: Pulling fs layer\naa22693e6cf8: Pulling fs layer\n56dc85502937: Waiting\nfaeb796bb7e6: Waiting\nfc32820587bf: Pulling fs layer\n01eb6572c8f1: Waiting\ned30c3c2916f: Pulling fs layer\n27ea311cab37: Waiting\ndb6cdef1932a: Waiting\n993556ea2050: Waiting\n3ac5fa2133c4: Pulling fs layer\naa22693e6cf8: Waiting\n4f4fb700ef54: Waiting\ned30c3c2916f: Waiting\n9ae34cefa0ba: Pulling fs layer\n3ac5fa2133c4: Waiting\n39b54e9dd0c2: Pulling fs layer\n9ae34cefa0ba: Waiting\n39b54e9dd0c2: Waiting\nfbcd35dc5bc3: Verifying Checksum\nfbcd35dc5bc3: Download complete\ndb6cdef1932a: Verifying Checksum\ndb6cdef1932a: Download complete\nc7232af9ae05: Verifying Checksum\nc7232af9ae05: Download complete\nfaeb796bb7e6: Download complete\n56dc85502937: Download complete\n43cfb69dbb46: Verifying Checksum\n43cfb69dbb46: Download complete\n993556ea2050: Verifying Checksum\n993556ea2050: Download complete\n4f4fb700ef54: Download complete\naa22693e6cf8: Verifying Checksum\naa22693e6cf8: Download complete\n01eb6572c8f1: Verifying Checksum\n01eb6572c8f1: Download complete\n43cfb69dbb46: Pull complete\nfbcd35dc5bc3: Pull complete\n27ea311cab37: Verifying Checksum\n27ea311cab37: Download complete\nc7232af9ae05: Pull complete\ndb6cdef1932a: Pull complete\n56dc85502937: Pull complete\nfaeb796bb7e6: Pull complete\ned30c3c2916f: Verifying Checksum\ned30c3c2916f: Download complete\n9ae34cefa0ba: Verifying Checksum\n9ae34cefa0ba: Download complete\n01eb6572c8f1: Pull complete\n27ea311cab37: Pull complete\n993556ea2050: Pull complete\nfc32820587bf: Verifying Checksum\nfc32820587bf: Download complete\n4f4fb700ef54: Pull complete\naa22693e6cf8: Pull complete\n39b54e9dd0c2: Verifying Checksum\n39b54e9dd0c2: Download complete\nfc32820587bf: Pull complete\n3ac5fa2133c4: Verifying Checksum\n3ac5fa2133c4: Download complete\ned30c3c2916f: Pull complete\n3ac5fa2133c4: Pull complete\n9ae34cefa0ba: Pull complete\n39b54e9dd0c2: Pull complete\nDigest: sha256:6d095eeb929f125ca42999c80e87e4bba35c0613c9969a66f8d902b0216ba58c\nStatus: Downloaded newer image for anonymous/vllm-baseline:baseline-6a11fdfbb8d6\n",
  "timestamp": "2026-01-17 19:55:20"
}