{
  "human_commit": "70b808fe",
  "human_commit_full": "70b808fe1a63322bc6bf5f46a91981a8f6b8af00",
  "parent_commit": "63d635d17962377df089cdc9d4a2684f0b007208",
  "model": "Qwen/Qwen2-VL-7B",
  "status": "success",
  "error": null,
  "duration_s": 232.29533863067627,
  "metrics": {
    "ttft_mean_ms": 678.85,
    "ttft_median_ms": 654.56,
    "ttft_p99_ms": 1080.37,
    "tpot_mean_ms": 26.42,
    "tpot_median_ms": 26.84,
    "tpot_p99_ms": 35.2,
    "itl_mean_ms": 26.42,
    "itl_median_ms": 19.52,
    "itl_p99_ms": 292.45,
    "request_throughput_req_s": 42.02,
    "output_token_throughput_tok_s": 2689.3,
    "total_token_throughput_tok_s": 13446.5
  },
  "raw_output": " 127.0.0.1:36746 - \"POST /v1/completions HTTP/1.1\" 200 OK\nINFO:     127.0.0.1:36758 - \"POST /v1/completions HTTP/1.1\" 200 OK\nINFO:     127.0.0.1:36774 - \"POST /v1/completions HTTP/1.1\" 200 OK\nINFO:     127.0.0.1:36780 - \"POST /v1/completions HTTP/1.1\" 200 OK\nINFO:     127.0.0.1:36792 - \"POST /v1/completions HTTP/1.1\" 200 OK\n\n  1%|          | 1/100 [00:02<03:55,  2.38s/it]\n100%|\u2588\u2588\u2588\u2588\u2588\u2588\u2588\u2588\u2588\u2588| 100/100 [00:02<00:00, 42.02it/s]\n============ Serving Benchmark Result ============\nSuccessful requests:                     100       \nBenchmark duration (s):                  2.38      \nTotal input tokens:                      25600     \nTotal generated tokens:                  6400      \nRequest throughput (req/s):              42.02     \nOutput token throughput (tok/s):         2689.30   \nTotal Token throughput (tok/s):          13446.50  \n---------------Time to First Token----------------\nMean TTFT (ms):                          678.85    \nMedian TTFT (ms):                        654.56    \nP99 TTFT (ms):                           1080.37   \n-----Time per Output Token (excl. 1st token)------\nMean TPOT (ms):                          26.42     \nMedian TPOT (ms):                        26.84     \nP99 TPOT (ms):                           35.20     \n---------------Inter-token Latency----------------\nMean ITL (ms):                           26.42     \nMedian ITL (ms):                         19.52     \nP99 ITL (ms):                            292.45    \n==================================================\n============ Serving Benchmark Result ============\nRequest throughput (req/s):              42.02     \nOutput token throughput (tok/s):         2689.30   \nTotal Token throughput (tok/s):          13446.50  \nMean TTFT (ms):                          678.85    \nMedian TTFT (ms):                        654.56    \nP99 TTFT (ms):                           1080.37   \nMean TPOT (ms):                          26.42     \nMedian TPOT (ms):                        26.84     \nP99 TPOT (ms):                           35.20     \nMean ITL (ms):                           26.42     \nMedian ITL (ms):                         19.52     \nP99 ITL (ms):                            292.45    \n==================================================\nBENCHMARK_DONE\nUnable to find image 'anonymous/vllm-baseline:baseline-63d635d17962' locally\nbaseline-63d635d17962: Pulling from anonymous/vllm-baseline\n3c645031de29: Already exists\n0d6448aff889: Already exists\n0a7674e3e8fe: Already exists\nb71b637b97c5: Already exists\n56dc85502937: Already exists\nec6d5f6c9ed9: Already exists\n47b8539d532f: Already exists\nfd9cc1ad8dee: Already exists\n83525caeeb35: Already exists\n8e79813a7b9d: Already exists\n312a542960e3: Already exists\n479ef8d53ea8: Already exists\n1a983e62f512: Already exists\nf632d9eacc9c: Already exists\n94039385962c: Already exists\n472a1e963f29: Already exists\n4f4fb700ef54: Already exists\nf9d67964e463: Pulling fs layer\n926b3a24bad3: Pulling fs layer\n86271008cb59: Pulling fs layer\n7822d1154bf5: Pulling fs layer\n0855e14e800c: Pulling fs layer\nd92c1c278caf: Pulling fs layer\n11f49f8c339e: Pulling fs layer\n085297f28c7d: Pulling fs layer\ndfaf1b8fd451: Pulling fs layer\n4a71fee41d15: Pulling fs layer\n63c76eb536a9: Pulling fs layer\n18ef1c0e049d: Pulling fs layer\n3747c6e173a6: Pulling fs layer\n09e69da7c0a1: Pulling fs layer\n8663f7d44b01: Pulling fs layer\n11f49f8c339e: Waiting\n86271008cb59: Download complete\n7822d1154bf5: Download complete\n0855e14e800c: Download complete\n4a71fee41d15: Waiting\n8663f7d44b01: Waiting\n085297f28c7d: Waiting\n63c76eb536a9: Waiting\ndfaf1b8fd451: Waiting\n18ef1c0e049d: Waiting\n09e69da7c0a1: Waiting\n3747c6e173a6: Waiting\nd92c1c278caf: Verifying Checksum\nd92c1c278caf: Download complete\n926b3a24bad3: Verifying Checksum\n926b3a24bad3: Download complete\n085297f28c7d: Verifying Checksum\n085297f28c7d: Download complete\ndfaf1b8fd451: Verifying Checksum\ndfaf1b8fd451: Download complete\n4a71fee41d15: Verifying Checksum\n4a71fee41d15: Download complete\n63c76eb536a9: Verifying Checksum\n63c76eb536a9: Download complete\n11f49f8c339e: Verifying Checksum\n11f49f8c339e: Download complete\n3747c6e173a6: Verifying Checksum\n3747c6e173a6: Download complete\n09e69da7c0a1: Verifying Checksum\n09e69da7c0a1: Download complete\n8663f7d44b01: Verifying Checksum\n8663f7d44b01: Download complete\nf9d67964e463: Download complete\n18ef1c0e049d: Verifying Checksum\n18ef1c0e049d: Download complete\nf9d67964e463: Pull complete\n926b3a24bad3: Pull complete\n86271008cb59: Pull complete\n7822d1154bf5: Pull complete\n0855e14e800c: Pull complete\nd92c1c278caf: Pull complete\n11f49f8c339e: Pull complete\n085297f28c7d: Pull complete\ndfaf1b8fd451: Pull complete\n4a71fee41d15: Pull complete\n63c76eb536a9: Pull complete\n18ef1c0e049d: Pull complete\n3747c6e173a6: Pull complete\n09e69da7c0a1: Pull complete\n8663f7d44b01: Pull complete\nDigest: sha256:4aab0281fbc591ea2ceb318d4a8b81353bbd4cb9df2ee00519c242ecc00145b3\nStatus: Image is up to date for anonymous/vllm-baseline:baseline-63d635d17962\n",
  "timestamp": "2026-01-15 04:41:01"
}