{
  "human_commit": "8a4e5c5f",
  "human_commit_full": "8a4e5c5f3c1d39e924e48a87c9cc6cf382aa3532",
  "parent_commit": "76b494444fd864ffc53a623420668d1865c804b9",
  "model": "meta-llama/Llama-3.1-8B-Instruct",
  "status": "success",
  "error": null,
  "duration_s": 274.23943066596985,
  "metrics": {
    "ttft_mean_ms": 619.93,
    "ttft_median_ms": 672.32,
    "ttft_p99_ms": 1010.11,
    "tpot_mean_ms": 32.32,
    "tpot_median_ms": 28.04,
    "tpot_p99_ms": 186.97,
    "itl_mean_ms": 27.98,
    "itl_median_ms": 17.09,
    "itl_p99_ms": 355.88,
    "request_throughput_req_s": 41.89,
    "output_token_throughput_tok_s": 2591.33,
    "total_token_throughput_tok_s": 13273.36
  },
  "raw_output": "cl. 1st token)------\nMean TPOT (ms):                          32.32     \nMedian TPOT (ms):                        28.04     \nP99 TPOT (ms):                           186.97    \n---------------Inter-token Latency----------------\nMean ITL (ms):                           27.98     \nMedian ITL (ms):                         17.09     \nP99 ITL (ms):                            355.88    \n==================================================\n============ Serving Benchmark Result ============\nRequest throughput (req/s):              41.89     \nOutput token throughput (tok/s):         2591.33   \nTotal Token throughput (tok/s):          13273.36  \nMean TTFT (ms):                          619.93    \nMedian TTFT (ms):                        672.32    \nP99 TTFT (ms):                           1010.11   \nMean TPOT (ms):                          32.32     \nMedian TPOT (ms):                        28.04     \nP99 TPOT (ms):                           186.97    \nMean ITL (ms):                           27.98     \nMedian ITL (ms):                         17.09     \nP99 ITL (ms):                            355.88    \n==================================================\nBENCHMARK_DONE\nUnable to find image 'anonymous/vllm-baseline:baseline-76b494444fd8' locally\nbaseline-76b494444fd8: Pulling from anonymous/vllm-baseline\n9cb31e2e37ea: Already exists\nb95112eaf283: Already exists\n030ef8250936: Already exists\n72ac9ccfda38: Already exists\n73389fbd088f: Already exists\n0264850675f7: Already exists\nde1d03310308: Already exists\nc1d2af7fad0f: Already exists\n5601308b3ac6: Already exists\n6b2035e8b73e: Already exists\ned71f8f81b33: Already exists\na04181a7ff83: Already exists\nb89dfbaf9e2c: Already exists\n985876fa77e6: Pulling fs layer\n5dc72b3ae2e9: Pulling fs layer\n79df58bdb47d: Pulling fs layer\n8def355fea68: Pulling fs layer\n7d20a4886623: Pulling fs layer\nc90a283aacd8: Pulling fs layer\n64f4f5696cf2: Pulling fs layer\n8f18f242cbee: Pulling fs layer\n309e2e7df04d: Pulling fs layer\n203f8d8e6283: Pulling fs layer\n61134ee48ac2: Pulling fs layer\n09c148b4fd42: Pulling fs layer\n279eb68eda2d: Pulling fs layer\nf3d2b3fbdbfe: Pulling fs layer\n7d20a4886623: Waiting\n39b5c6dc1a5d: Pulling fs layer\n07301950332c: Pulling fs layer\n06e6fa6f85d8: Pulling fs layer\n82279fb3410e: Pulling fs layer\nf59f63a7f8e6: Pulling fs layer\n7f93cc83587f: Pulling fs layer\n5dc72b3ae2e9: Download complete\n9a1928374d15: Pulling fs layer\ne83c0a69739e: Pulling fs layer\n279eb68eda2d: Waiting\nd888d3ffa6d3: Pulling fs layer\nc90a283aacd8: Waiting\ncdfe70520f07: Pulling fs layer\n203f8d8e6283: Waiting\n61134ee48ac2: Waiting\ncdfe70520f07: Waiting\n09c148b4fd42: Waiting\n309e2e7df04d: Waiting\nf3d2b3fbdbfe: Waiting\n79df58bdb47d: Download complete\n64f4f5696cf2: Waiting\n39b5c6dc1a5d: Waiting\n8f18f242cbee: Waiting\n7f93cc83587f: Waiting\nf59f63a7f8e6: Waiting\ne83c0a69739e: Waiting\nd888d3ffa6d3: Waiting\n07301950332c: Waiting\n9a1928374d15: Waiting\n06e6fa6f85d8: Waiting\n82279fb3410e: Waiting\n8def355fea68: Download complete\nc90a283aacd8: Download complete\n64f4f5696cf2: Verifying Checksum\n64f4f5696cf2: Download complete\n8f18f242cbee: Download complete\n309e2e7df04d: Verifying Checksum\n309e2e7df04d: Download complete\n203f8d8e6283: Verifying Checksum\n203f8d8e6283: Download complete\n61134ee48ac2: Verifying Checksum\n61134ee48ac2: Download complete\n09c148b4fd42: Verifying Checksum\n09c148b4fd42: Download complete\n279eb68eda2d: Download complete\nf3d2b3fbdbfe: Verifying Checksum\nf3d2b3fbdbfe: Download complete\n985876fa77e6: Verifying Checksum\n985876fa77e6: Download complete\n07301950332c: Verifying Checksum\n07301950332c: Download complete\n06e6fa6f85d8: Verifying Checksum\n06e6fa6f85d8: Download complete\n82279fb3410e: Download complete\nf59f63a7f8e6: Verifying Checksum\nf59f63a7f8e6: Download complete\n985876fa77e6: Pull complete\n5dc72b3ae2e9: Pull complete\n79df58bdb47d: Pull complete\n8def355fea68: Pull complete\n7d20a4886623: Verifying Checksum\n7d20a4886623: Download complete\n9a1928374d15: Download complete\ne83c0a69739e: Download complete\nd888d3ffa6d3: Verifying Checksum\nd888d3ffa6d3: Download complete\ncdfe70520f07: Verifying Checksum\ncdfe70520f07: Download complete\n7f93cc83587f: Verifying Checksum\n7f93cc83587f: Download complete\n39b5c6dc1a5d: Verifying Checksum\n39b5c6dc1a5d: Download complete\n7d20a4886623: Pull complete\nc90a283aacd8: Pull complete\n64f4f5696cf2: Pull complete\n8f18f242cbee: Pull complete\n309e2e7df04d: Pull complete\n203f8d8e6283: Pull complete\n61134ee48ac2: Pull complete\n09c148b4fd42: Pull complete\n279eb68eda2d: Pull complete\nf3d2b3fbdbfe: Pull complete\n39b5c6dc1a5d: Pull complete\n07301950332c: Pull complete\n06e6fa6f85d8: Pull complete\n82279fb3410e: Pull complete\nf59f63a7f8e6: Pull complete\n7f93cc83587f: Pull complete\n9a1928374d15: Pull complete\ne83c0a69739e: Pull complete\nd888d3ffa6d3: Pull complete\ncdfe70520f07: Pull complete\nDigest: sha256:35360a9fa9887ad48d2508ead4c5b8854de63f2059b5461793e5f2cf15c55299\nStatus: Image is up to date for anonymous/vllm-baseline:baseline-76b494444fd8\n",
  "timestamp": "2026-01-15 04:45:06"
}