{
  "human_commit": "19d98e0c",
  "human_commit_full": "19d98e0c7db96713f0e2201649159431177a56e2",
  "parent_commit": "2b04c209ee98174f29f1fc98f0dc3222d652a7bd",
  "model": "deepseek-ai/DeepSeek-Coder-V2-Lite-Instruct",
  "status": "success",
  "error": null,
  "duration_s": 231.86598825454712,
  "metrics": {
    "ttft_mean_ms": 601.8,
    "ttft_median_ms": 585.19,
    "ttft_p99_ms": 790.94,
    "tpot_mean_ms": 23.31,
    "tpot_median_ms": 23.61,
    "tpot_p99_ms": 29.08,
    "itl_mean_ms": 23.31,
    "itl_median_ms": 20.27,
    "itl_p99_ms": 122.27,
    "request_throughput_req_s": 47.79,
    "output_token_throughput_tok_s": 3058.57,
    "total_token_throughput_tok_s": 14392.96
  },
  "raw_output": "    | 1/100 [00:02<03:27,  2.09s/it]\n100%|\u2588\u2588\u2588\u2588\u2588\u2588\u2588\u2588\u2588\u2588| 100/100 [00:02<00:00, 47.79it/s]\n============ Serving Benchmark Result ============\nSuccessful requests:                     100       \nBenchmark duration (s):                  2.09      \nTotal input tokens:                      23717     \nTotal generated tokens:                  6400      \nRequest throughput (req/s):              47.79     \nOutput token throughput (tok/s):         3058.57   \nTotal Token throughput (tok/s):          14392.96  \n---------------Time to First Token----------------\nMean TTFT (ms):                          601.80    \nMedian TTFT (ms):                        585.19    \nP99 TTFT (ms):                           790.94    \n-----Time per Output Token (excl. 1st token)------\nMean TPOT (ms):                          23.31     \nMedian TPOT (ms):                        23.61     \nP99 TPOT (ms):                           29.08     \n---------------Inter-token Latency----------------\nMean ITL (ms):                           23.31     \nMedian ITL (ms):                         20.27     \nP99 ITL (ms):                            122.27    \n==================================================\n============ Serving Benchmark Result ============\nRequest throughput (req/s):              47.79     \nOutput token throughput (tok/s):         3058.57   \nTotal Token throughput (tok/s):          14392.96  \nMean TTFT (ms):                          601.80    \nMedian TTFT (ms):                        585.19    \nP99 TTFT (ms):                           790.94    \nMean TPOT (ms):                          23.31     \nMedian TPOT (ms):                        23.61     \nP99 TPOT (ms):                           29.08     \nMean ITL (ms):                           23.31     \nMedian ITL (ms):                         20.27     \nP99 ITL (ms):                            122.27    \n==================================================\nBENCHMARK_DONE\nUnable to find image 'anonymous/vllm-baseline:baseline-2b04c209ee98' locally\nbaseline-2b04c209ee98: Pulling from anonymous/vllm-baseline\n3c645031de29: Already exists\n0d6448aff889: Already exists\n0a7674e3e8fe: Already exists\nb71b637b97c5: Already exists\n56dc85502937: Already exists\nec6d5f6c9ed9: Pulling fs layer\n47b8539d532f: Pulling fs layer\nfd9cc1ad8dee: Pulling fs layer\n83525caeeb35: Pulling fs layer\n8e79813a7b9d: Pulling fs layer\n312a542960e3: Pulling fs layer\n83525caeeb35: Waiting\n8e79813a7b9d: Waiting\n479ef8d53ea8: Pulling fs layer\n312a542960e3: Waiting\n1a983e62f512: Pulling fs layer\n5e6f59d997eb: Pulling fs layer\n479ef8d53ea8: Waiting\n1a983e62f512: Waiting\nc1477dac7811: Pulling fs layer\n5e6f59d997eb: Waiting\n4c25d453f99c: Pulling fs layer\nc1477dac7811: Waiting\n0ce3ad053c88: Pulling fs layer\n4c25d453f99c: Waiting\n1161fc3d8618: Pulling fs layer\n75545eb78b76: Pulling fs layer\n0ce3ad053c88: Waiting\n1161fc3d8618: Waiting\n6a3dba9e3869: Pulling fs layer\n2d3f079f1c1b: Pulling fs layer\n75545eb78b76: Waiting\nfbbc2178b077: Pulling fs layer\n6a3dba9e3869: Waiting\n2d3f079f1c1b: Waiting\nf9dfd421a3a2: Pulling fs layer\nfbbc2178b077: Waiting\n760505c1cb51: Pulling fs layer\nf9dfd421a3a2: Waiting\n760505c1cb51: Waiting\nfd9cc1ad8dee: Verifying Checksum\nfd9cc1ad8dee: Download complete\n47b8539d532f: Verifying Checksum\n47b8539d532f: Download complete\n83525caeeb35: Download complete\n312a542960e3: Verifying Checksum\n312a542960e3: Download complete\n479ef8d53ea8: Verifying Checksum\n479ef8d53ea8: Download complete\n1a983e62f512: Verifying Checksum\n1a983e62f512: Download complete\n5e6f59d997eb: Verifying Checksum\n5e6f59d997eb: Download complete\nc1477dac7811: Verifying Checksum\nc1477dac7811: Download complete\n4c25d453f99c: Verifying Checksum\n4c25d453f99c: Download complete\n0ce3ad053c88: Verifying Checksum\n0ce3ad053c88: Download complete\nec6d5f6c9ed9: Download complete\n8e79813a7b9d: Verifying Checksum\n8e79813a7b9d: Download complete\n6a3dba9e3869: Verifying Checksum\n6a3dba9e3869: Download complete\n2d3f079f1c1b: Download complete\n75545eb78b76: Verifying Checksum\n75545eb78b76: Download complete\nfbbc2178b077: Verifying Checksum\nfbbc2178b077: Download complete\nf9dfd421a3a2: Verifying Checksum\nf9dfd421a3a2: Download complete\nec6d5f6c9ed9: Pull complete\n47b8539d532f: Pull complete\nfd9cc1ad8dee: Pull complete\n83525caeeb35: Pull complete\n1161fc3d8618: Verifying Checksum\n1161fc3d8618: Download complete\n8e79813a7b9d: Pull complete\n312a542960e3: Pull complete\n479ef8d53ea8: Pull complete\n1a983e62f512: Pull complete\n5e6f59d997eb: Pull complete\nc1477dac7811: Pull complete\n4c25d453f99c: Pull complete\n0ce3ad053c88: Pull complete\n760505c1cb51: Verifying Checksum\n760505c1cb51: Download complete\n1161fc3d8618: Pull complete\n75545eb78b76: Pull complete\n6a3dba9e3869: Pull complete\n2d3f079f1c1b: Pull complete\nfbbc2178b077: Pull complete\nf9dfd421a3a2: Pull complete\n760505c1cb51: Pull complete\nDigest: sha256:c5c15f1a7d769aac1c58f2067cdbabd6436d8358eea046a03f7fc3af9cc5e499\nStatus: Downloaded newer image for anonymous/vllm-baseline:baseline-2b04c209ee98\n",
  "timestamp": "2026-01-15 01:46:18"
}