{
  "human_commit": "25ebed2f",
  "human_commit_full": "25ebed2f8ca6d747d63f2be9ede023c561851ac8",
  "parent_commit": "d263bd9df7b2f5586910e5d006a11ff11ba7c310",
  "model": "meta-llama/Llama-3.1-8B-Instruct",
  "status": "success",
  "error": null,
  "duration_s": 195.67458510398865,
  "metrics": {
    "ttft_mean_ms": 586.75,
    "ttft_median_ms": 531.59,
    "ttft_p99_ms": 943.08,
    "tpot_mean_ms": 22.41,
    "tpot_median_ms": 23.32,
    "tpot_p99_ms": 27.98,
    "itl_mean_ms": 22.36,
    "itl_median_ms": 16.39,
    "itl_p99_ms": 296.32,
    "request_throughput_req_s": 49.57,
    "output_token_throughput_tok_s": 3172.59,
    "total_token_throughput_tok_s": 15048.99
  },
  "raw_output": "INFO:     127.0.0.1:59376 - \"POST /v1/completions HTTP/1.1\" 200 OK\nINFO:     127.0.0.1:59382 - \"POST /v1/completions HTTP/1.1\" 200 OK\nINFO:     127.0.0.1:59390 - \"POST /v1/completions HTTP/1.1\" 200 OK\nINFO:     127.0.0.1:59406 - \"POST /v1/completions HTTP/1.1\" 200 OK\nINFO:     127.0.0.1:59410 - \"POST /v1/completions HTTP/1.1\" 200 OK\nINFO:     127.0.0.1:59416 - \"POST /v1/completions HTTP/1.1\" 200 OK\nINFO:     127.0.0.1:59432 - \"POST /v1/completions HTTP/1.1\" 200 OK\nINFO:     127.0.0.1:59436 - \"POST /v1/completions HTTP/1.1\" 200 OK\n\n  1%|          | 1/100 [00:02<03:19,  2.02s/it]\n100%|\u2588\u2588\u2588\u2588\u2588\u2588\u2588\u2588\u2588\u2588| 100/100 [00:02<00:00, 49.57it/s]\n============ Serving Benchmark Result ============\nSuccessful requests:                     100       \nBenchmark duration (s):                  2.02      \nTotal input tokens:                      23958     \nTotal generated tokens:                  6400      \nRequest throughput (req/s):              49.57     \nOutput token throughput (tok/s):         3172.59   \nTotal Token throughput (tok/s):          15048.99  \n---------------Time to First Token----------------\nMean TTFT (ms):                          586.75    \nMedian TTFT (ms):                        531.59    \nP99 TTFT (ms):                           943.08    \n-----Time per Output Token (excl. 1st token)------\nMean TPOT (ms):                          22.41     \nMedian TPOT (ms):                        23.32     \nP99 TPOT (ms):                           27.98     \n---------------Inter-token Latency----------------\nMean ITL (ms):                           22.36     \nMedian ITL (ms):                         16.39     \nP99 ITL (ms):                            296.32    \n==================================================\n============ Serving Benchmark Result ============\nRequest throughput (req/s):              49.57     \nOutput token throughput (tok/s):         3172.59   \nTotal Token throughput (tok/s):          15048.99  \nMean TTFT (ms):                          586.75    \nMedian TTFT (ms):                        531.59    \nP99 TTFT (ms):                           943.08    \nMean TPOT (ms):                          22.41     \nMedian TPOT (ms):                        23.32     \nP99 TPOT (ms):                           27.98     \nMean ITL (ms):                           22.36     \nMedian ITL (ms):                         16.39     \nP99 ITL (ms):                            296.32    \n==================================================\nBENCHMARK_DONE\nUnable to find image 'anonymous/vllm-baseline:baseline-d263bd9df7b2' locally\nbaseline-d263bd9df7b2: Pulling from anonymous/vllm-baseline\n3c645031de29: Already exists\n0d6448aff889: Already exists\n0a7674e3e8fe: Already exists\nb71b637b97c5: Already exists\n56dc85502937: Already exists\nb9839793d66a: Already exists\n2b5f54714bab: Already exists\n7fb1d733c143: Already exists\ndfe7effe1245: Already exists\n2c5d1eae04e0: Pulling fs layer\n54d061bf5ef2: Pulling fs layer\n88fa1d2eef78: Pulling fs layer\n35f0d8170071: Pulling fs layer\ndc8b6540faad: Pulling fs layer\nfe826663c88f: Pulling fs layer\n64fc46d31217: Pulling fs layer\nadc0ca68ff33: Pulling fs layer\n35f0d8170071: Waiting\n4f05f59dc675: Pulling fs layer\ndc8b6540faad: Waiting\nfe826663c88f: Waiting\n0a4778bb88af: Pulling fs layer\n64fc46d31217: Waiting\nadc0ca68ff33: Waiting\n4f05f59dc675: Waiting\n52f980307ae6: Pulling fs layer\n6e514a953a16: Pulling fs layer\ndc15adbd456c: Pulling fs layer\n0a4778bb88af: Waiting\n63dd6f95a2bc: Pulling fs layer\n52f980307ae6: Waiting\n6e514a953a16: Waiting\ndc15adbd456c: Waiting\n63dd6f95a2bc: Waiting\n88fa1d2eef78: Verifying Checksum\n88fa1d2eef78: Download complete\n35f0d8170071: Verifying Checksum\n35f0d8170071: Download complete\n54d061bf5ef2: Verifying Checksum\n54d061bf5ef2: Download complete\nfe826663c88f: Verifying Checksum\nfe826663c88f: Download complete\n64fc46d31217: Verifying Checksum\n64fc46d31217: Download complete\nadc0ca68ff33: Verifying Checksum\nadc0ca68ff33: Download complete\n4f05f59dc675: Download complete\n0a4778bb88af: Verifying Checksum\n0a4778bb88af: Download complete\n52f980307ae6: Verifying Checksum\n52f980307ae6: Download complete\n6e514a953a16: Verifying Checksum\n6e514a953a16: Download complete\ndc15adbd456c: Verifying Checksum\ndc15adbd456c: Download complete\n63dd6f95a2bc: Verifying Checksum\n63dd6f95a2bc: Download complete\n2c5d1eae04e0: Verifying Checksum\n2c5d1eae04e0: Download complete\ndc8b6540faad: Verifying Checksum\ndc8b6540faad: Download complete\n2c5d1eae04e0: Pull complete\n54d061bf5ef2: Pull complete\n88fa1d2eef78: Pull complete\n35f0d8170071: Pull complete\ndc8b6540faad: Pull complete\nfe826663c88f: Pull complete\n64fc46d31217: Pull complete\nadc0ca68ff33: Pull complete\n4f05f59dc675: Pull complete\n0a4778bb88af: Pull complete\n52f980307ae6: Pull complete\n6e514a953a16: Pull complete\ndc15adbd456c: Pull complete\n63dd6f95a2bc: Pull complete\nDigest: sha256:2fbc96cd904891908e87b9c9b7116ae8d435a2c291755054431ed9d409adaa3f\nStatus: Downloaded newer image for anonymous/vllm-baseline:baseline-d263bd9df7b2\n",
  "timestamp": "2026-01-15 03:06:06"
}