{
  "human_commit": "299ebb62",
  "human_commit_full": "299ebb62b269ce167eb1c71b5e39a1dc1f65ce1c",
  "parent_commit": "f728ab8e3578c22b42ed53e51b5e8ec35328d8b9",
  "model": "Qwen/Qwen2.5-1.5B-Instruct",
  "status": "success",
  "error": null,
  "duration_s": 203.89240050315857,
  "metrics": {
    "ttft_mean_ms": 213.21,
    "ttft_median_ms": 202.55,
    "ttft_p99_ms": 293.63,
    "tpot_mean_ms": 10.45,
    "tpot_median_ms": 10.63,
    "tpot_p99_ms": 12.37,
    "itl_mean_ms": 10.45,
    "itl_median_ms": 8.79,
    "itl_p99_ms": 87.5,
    "request_throughput_req_s": 112.69,
    "output_token_throughput_tok_s": 7180.82,
    "total_token_throughput_tok_s": 35762.13
  },
  "raw_output": "/100 [00:00<00:00, 112.70it/s]\n============ Serving Benchmark Result ============\nSuccessful requests:                     100       \nBenchmark duration (s):                  0.89      \nTotal input tokens:                      25362     \nTotal generated tokens:                  6372      \nRequest throughput (req/s):              112.69    \nOutput token throughput (tok/s):         7180.82   \nTotal Token throughput (tok/s):          35762.13  \n---------------Time to First Token----------------\nMean TTFT (ms):                          213.21    \nMedian TTFT (ms):                        202.55    \nP99 TTFT (ms):                           293.63    \n-----Time per Output Token (excl. 1st token)------\nMean TPOT (ms):                          10.45     \nMedian TPOT (ms):                        10.63     \nP99 TPOT (ms):                           12.37     \n---------------Inter-token Latency----------------\nMean ITL (ms):                           10.45     \nMedian ITL (ms):                         8.79      \nP99 ITL (ms):                            87.50     \n==================================================\n============ Serving Benchmark Result ============\nRequest throughput (req/s):              112.69    \nOutput token throughput (tok/s):         7180.82   \nTotal Token throughput (tok/s):          35762.13  \nMean TTFT (ms):                          213.21    \nMedian TTFT (ms):                        202.55    \nP99 TTFT (ms):                           293.63    \nMean TPOT (ms):                          10.45     \nMedian TPOT (ms):                        10.63     \nP99 TPOT (ms):                           12.37     \nMean ITL (ms):                           10.45     \nMedian ITL (ms):                         8.79      \nP99 ITL (ms):                            87.50     \n==================================================\nBENCHMARK_DONE\nUnable to find image 'anonymous/vllm-baseline:baseline-f728ab8e3578' locally\nbaseline-f728ab8e3578: Pulling from anonymous/vllm-baseline\n3c645031de29: Already exists\n0d6448aff889: Already exists\n0a7674e3e8fe: Already exists\nb71b637b97c5: Already exists\n56dc85502937: Already exists\nec6d5f6c9ed9: Already exists\n47b8539d532f: Already exists\nfd9cc1ad8dee: Already exists\n83525caeeb35: Already exists\n8e79813a7b9d: Already exists\n312a542960e3: Already exists\n949691b47390: Already exists\n7cbb09265719: Already exists\ncb7c80b8c4f1: Already exists\nf4d72f8f1249: Already exists\n5b7bacc7057e: Already exists\ne64afe835865: Already exists\n020f85866b10: Pulling fs layer\n658c5117f281: Pulling fs layer\n3287bca0eab6: Pulling fs layer\nb83952ebb96b: Pulling fs layer\n6c89343586f1: Pulling fs layer\n2bc5872da5d3: Pulling fs layer\na901afd29255: Pulling fs layer\ncf3aaf623c20: Pulling fs layer\nd18e6616f916: Pulling fs layer\n08d62439aa3b: Pulling fs layer\n901f37fb64ec: Pulling fs layer\n333a5c41a30e: Pulling fs layer\nc79b16197516: Pulling fs layer\neceb0c571425: Pulling fs layer\nc708beeb7c9f: Pulling fs layer\nd957604d4a45: Pulling fs layer\nccaed379c7ab: Pulling fs layer\nd18e6616f916: Waiting\n08d62439aa3b: Waiting\nc79b16197516: Waiting\neceb0c571425: Waiting\n901f37fb64ec: Waiting\n333a5c41a30e: Waiting\nb83952ebb96b: Waiting\n6c89343586f1: Waiting\n2bc5872da5d3: Waiting\nc708beeb7c9f: Waiting\na901afd29255: Waiting\nd957604d4a45: Waiting\nccaed379c7ab: Waiting\ncf3aaf623c20: Waiting\n3287bca0eab6: Verifying Checksum\n3287bca0eab6: Download complete\nb83952ebb96b: Verifying Checksum\nb83952ebb96b: Download complete\n6c89343586f1: Verifying Checksum\n6c89343586f1: Download complete\n2bc5872da5d3: Verifying Checksum\n2bc5872da5d3: Download complete\na901afd29255: Verifying Checksum\na901afd29255: Download complete\ncf3aaf623c20: Verifying Checksum\ncf3aaf623c20: Download complete\n658c5117f281: Verifying Checksum\n658c5117f281: Download complete\n08d62439aa3b: Verifying Checksum\n08d62439aa3b: Download complete\n901f37fb64ec: Verifying Checksum\n901f37fb64ec: Download complete\n333a5c41a30e: Verifying Checksum\n333a5c41a30e: Download complete\nc79b16197516: Verifying Checksum\nc79b16197516: Download complete\nd18e6616f916: Verifying Checksum\nd18e6616f916: Download complete\nc708beeb7c9f: Download complete\nd957604d4a45: Verifying Checksum\nd957604d4a45: Download complete\nccaed379c7ab: Verifying Checksum\nccaed379c7ab: Download complete\neceb0c571425: Download complete\n020f85866b10: Download complete\n020f85866b10: Pull complete\n658c5117f281: Pull complete\n3287bca0eab6: Pull complete\nb83952ebb96b: Pull complete\n6c89343586f1: Pull complete\n2bc5872da5d3: Pull complete\na901afd29255: Pull complete\ncf3aaf623c20: Pull complete\nd18e6616f916: Pull complete\n08d62439aa3b: Pull complete\n901f37fb64ec: Pull complete\n333a5c41a30e: Pull complete\nc79b16197516: Pull complete\neceb0c571425: Pull complete\nc708beeb7c9f: Pull complete\nd957604d4a45: Pull complete\nccaed379c7ab: Pull complete\nDigest: sha256:9ce11db82b2a1cba584af5798a4322b8aa3a4a783e12d0bcdd93a8e1a40d3b32\nStatus: Downloaded newer image for anonymous/vllm-baseline:baseline-f728ab8e3578\n",
  "timestamp": "2026-01-15 03:09:30"
}