{
  "human_commit": "67da5720",
  "human_commit_full": "67da5720d4ed2aa1f615ec812031f4f3753b3f62",
  "parent_commit": "5c04bb8b863bfdef8122b193631479315cc764f5",
  "model": "Qwen/Qwen2.5-7B-Instruct",
  "status": "success",
  "error": null,
  "duration_s": 336.8926556110382,
  "metrics": {
    "ttft_mean_ms": 581.89,
    "ttft_median_ms": 581.76,
    "ttft_p99_ms": 925.37,
    "tpot_mean_ms": 20.53,
    "tpot_median_ms": 20.52,
    "tpot_p99_ms": 26.07,
    "itl_mean_ms": 20.53,
    "itl_median_ms": 14.84,
    "itl_p99_ms": 301.24,
    "request_throughput_req_s": 52.83,
    "output_token_throughput_tok_s": 3380.82,
    "total_token_throughput_tok_s": 16778.36
  },
  "raw_output": "0 OK\nINFO:     127.0.0.1:53184 - \"POST /v1/completions HTTP/1.1\" 200 OK\nINFO:     127.0.0.1:53198 - \"POST /v1/completions HTTP/1.1\" 200 OK\n\n  1%|          | 1/100 [00:01<03:07,  1.89s/it]\n100%|\u2588\u2588\u2588\u2588\u2588\u2588\u2588\u2588\u2588\u2588| 100/100 [00:01<00:00, 52.83it/s]\n============ Serving Benchmark Result ============\nSuccessful requests:                     100       \nBenchmark duration (s):                  1.89      \nTotal input tokens:                      25362     \nTotal generated tokens:                  6400      \nRequest throughput (req/s):              52.83     \nOutput token throughput (tok/s):         3380.82   \nTotal Token throughput (tok/s):          16778.36  \n---------------Time to First Token----------------\nMean TTFT (ms):                          581.89    \nMedian TTFT (ms):                        581.76    \nP99 TTFT (ms):                           925.37    \n-----Time per Output Token (excl. 1st token)------\nMean TPOT (ms):                          20.53     \nMedian TPOT (ms):                        20.52     \nP99 TPOT (ms):                           26.07     \n---------------Inter-token Latency----------------\nMean ITL (ms):                           20.53     \nMedian ITL (ms):                         14.84     \nP99 ITL (ms):                            301.24    \n==================================================\n============ Serving Benchmark Result ============\nRequest throughput (req/s):              52.83     \nOutput token throughput (tok/s):         3380.82   \nTotal Token throughput (tok/s):          16778.36  \nMean TTFT (ms):                          581.89    \nMedian TTFT (ms):                        581.76    \nP99 TTFT (ms):                           925.37    \nMean TPOT (ms):                          20.53     \nMedian TPOT (ms):                        20.52     \nP99 TPOT (ms):                           26.07     \nMean ITL (ms):                           20.53     \nMedian ITL (ms):                         14.84     \nP99 ITL (ms):                            301.24    \n==================================================\nBENCHMARK_DONE\nUnable to find image 'anonymous/vllm-baseline:baseline-5c04bb8b863b' locally\nbaseline-5c04bb8b863b: Pulling from anonymous/vllm-baseline\n9cb31e2e37ea: Already exists\nb95112eaf283: Already exists\n030ef8250936: Already exists\n72ac9ccfda38: Already exists\n73389fbd088f: Already exists\n0264850675f7: Already exists\nde1d03310308: Already exists\nc1d2af7fad0f: Already exists\n5601308b3ac6: Already exists\n6b2035e8b73e: Already exists\ned71f8f81b33: Already exists\na04181a7ff83: Pulling fs layer\nb89dfbaf9e2c: Pulling fs layer\nf221ee730b1b: Pulling fs layer\nab7bef329942: Pulling fs layer\n46bce9cdf2db: Pulling fs layer\n27f7c531d01c: Pulling fs layer\nfc997b6a4b41: Pulling fs layer\nb5bf98a00fb3: Pulling fs layer\nab7bef329942: Waiting\n46bce9cdf2db: Waiting\n5197d63fa17b: Pulling fs layer\n27f7c531d01c: Waiting\n942d90aa320b: Pulling fs layer\nd8dc85f32ebb: Pulling fs layer\nb5bf98a00fb3: Waiting\n5197d63fa17b: Waiting\nda4fe45f4026: Pulling fs layer\nfc997b6a4b41: Waiting\n942d90aa320b: Waiting\n3f0c86f38ba9: Pulling fs layer\nd8dc85f32ebb: Waiting\nda4fe45f4026: Waiting\n4a5b7095821f: Pulling fs layer\n3f0c86f38ba9: Waiting\n7b0f0a949e96: Pulling fs layer\nfae515e14616: Pulling fs layer\n4a5b7095821f: Waiting\n7b0f0a949e96: Waiting\nbf1629860772: Pulling fs layer\nfae515e14616: Waiting\nbf1629860772: Waiting\nb89dfbaf9e2c: Download complete\na04181a7ff83: Verifying Checksum\na04181a7ff83: Download complete\na04181a7ff83: Pull complete\nb89dfbaf9e2c: Pull complete\n46bce9cdf2db: Verifying Checksum\n46bce9cdf2db: Download complete\n27f7c531d01c: Download complete\nab7bef329942: Verifying Checksum\nab7bef329942: Download complete\nf221ee730b1b: Verifying Checksum\nf221ee730b1b: Download complete\n5197d63fa17b: Verifying Checksum\n5197d63fa17b: Download complete\n942d90aa320b: Verifying Checksum\n942d90aa320b: Download complete\nd8dc85f32ebb: Verifying Checksum\nd8dc85f32ebb: Download complete\nda4fe45f4026: Download complete\n3f0c86f38ba9: Download complete\n4a5b7095821f: Verifying Checksum\n4a5b7095821f: Download complete\n7b0f0a949e96: Verifying Checksum\n7b0f0a949e96: Download complete\nfae515e14616: Verifying Checksum\nfae515e14616: Download complete\nb5bf98a00fb3: Verifying Checksum\nb5bf98a00fb3: Download complete\nf221ee730b1b: Pull complete\nab7bef329942: Pull complete\n46bce9cdf2db: Pull complete\n27f7c531d01c: Pull complete\nfc997b6a4b41: Verifying Checksum\nfc997b6a4b41: Download complete\nbf1629860772: Verifying Checksum\nbf1629860772: Download complete\nfc997b6a4b41: Pull complete\nb5bf98a00fb3: Pull complete\n5197d63fa17b: Pull complete\n942d90aa320b: Pull complete\nd8dc85f32ebb: Pull complete\nda4fe45f4026: Pull complete\n3f0c86f38ba9: Pull complete\n4a5b7095821f: Pull complete\n7b0f0a949e96: Pull complete\nfae515e14616: Pull complete\nbf1629860772: Pull complete\nDigest: sha256:a1b276c86d7e3afa63645acd4ee93e26dde2aaab175842e854d6f7db289c8c10\nStatus: Downloaded newer image for anonymous/vllm-baseline:baseline-5c04bb8b863b\n",
  "timestamp": "2026-01-15 01:08:13"
}