{
  "human_commit": "6d0734c5",
  "human_commit_full": "6d0734c562e759fdb7076d762222b3881e62ab1f",
  "parent_commit": "7d94577138e3d4c7bcfd781337ee1e5a2befa685",
  "model": "mistralai/Mistral-7B-Instruct-v0.3",
  "status": "success",
  "error": null,
  "duration_s": 255.08440613746643,
  "metrics": {
    "ttft_mean_ms": 593.53,
    "ttft_median_ms": 650.06,
    "ttft_p99_ms": 963.18,
    "tpot_mean_ms": 22.25,
    "tpot_median_ms": 21.34,
    "tpot_p99_ms": 28.11,
    "itl_mean_ms": 22.25,
    "itl_median_ms": 15.81,
    "itl_p99_ms": 333.23,
    "request_throughput_req_s": 49.69,
    "output_token_throughput_tok_s": 3179.89,
    "total_token_throughput_tok_s": 15352.88
  },
  "raw_output": "            49.69     \nOutput token throughput (tok/s):         3179.89   \nTotal Token throughput (tok/s):          15352.88  \n---------------Time to First Token----------------\nMean TTFT (ms):                          593.53    \nMedian TTFT (ms):                        650.06    \nP99 TTFT (ms):                           963.18    \n-----Time per Output Token (excl. 1st token)------\nMean TPOT (ms):                          22.25     \nMedian TPOT (ms):                        21.34     \nP99 TPOT (ms):                           28.11     \n---------------Inter-token Latency----------------\nMean ITL (ms):                           22.25     \nMedian ITL (ms):                         15.81     \nP99 ITL (ms):                            333.23    \n==================================================\n============ Serving Benchmark Result ============\nRequest throughput (req/s):              49.69     \nOutput token throughput (tok/s):         3179.89   \nTotal Token throughput (tok/s):          15352.88  \nMean TTFT (ms):                          593.53    \nMedian TTFT (ms):                        650.06    \nP99 TTFT (ms):                           963.18    \nMean TPOT (ms):                          22.25     \nMedian TPOT (ms):                        21.34     \nP99 TPOT (ms):                           28.11     \nMean ITL (ms):                           22.25     \nMedian ITL (ms):                         15.81     \nP99 ITL (ms):                            333.23    \n==================================================\nBENCHMARK_DONE\nUnable to find image 'anonymous/vllm-baseline:baseline-7d94577138e3' locally\nbaseline-7d94577138e3: Pulling from anonymous/vllm-baseline\n9cb31e2e37ea: Already exists\nb95112eaf283: Already exists\n030ef8250936: Already exists\n72ac9ccfda38: Already exists\n73389fbd088f: Already exists\n0264850675f7: Already exists\nde1d03310308: Already exists\nc1d2af7fad0f: Already exists\n5601308b3ac6: Already exists\n6b2035e8b73e: Already exists\ned71f8f81b33: Already exists\n6a2306edc128: Already exists\nbb5ee2f41954: Already exists\nae1cc335b65b: Already exists\n2fb01f5ad376: Already exists\nb7dfd152a1fd: Already exists\n2987a32afa11: Already exists\na35078026774: Pulling fs layer\n44ea55111f3c: Pulling fs layer\n5ad437fb83ec: Pulling fs layer\n853f299222ac: Pulling fs layer\nb9fb80a6a950: Pulling fs layer\ne8b7cb65dfe6: Pulling fs layer\n3bfc977bb0d1: Pulling fs layer\ne4c419671def: Pulling fs layer\n189d5836e662: Pulling fs layer\n7851f13830b4: Pulling fs layer\n2706c02cff4d: Pulling fs layer\n5cda37ee0889: Pulling fs layer\n837be3db9074: Pulling fs layer\nb5043d30f788: Pulling fs layer\n853f299222ac: Waiting\nb9fb80a6a950: Waiting\n950aa2752acf: Pulling fs layer\ne8b7cb65dfe6: Waiting\ne4c419671def: Waiting\n6a7d5231d563: Pulling fs layer\n189d5836e662: Waiting\n4f7d8eabe8da: Pulling fs layer\n3bfc977bb0d1: Waiting\n2706c02cff4d: Waiting\n5cda37ee0889: Waiting\n7b8ae3f51929: Pulling fs layer\n837be3db9074: Waiting\n4907dda3c144: Pulling fs layer\nb5043d30f788: Waiting\n6a7d5231d563: Waiting\nafb427daf925: Pulling fs layer\n950aa2752acf: Waiting\n4f7d8eabe8da: Waiting\n7b8ae3f51929: Waiting\nafb427daf925: Waiting\n4907dda3c144: Waiting\n5ad437fb83ec: Verifying Checksum\n5ad437fb83ec: Download complete\n853f299222ac: Verifying Checksum\n853f299222ac: Download complete\ne8b7cb65dfe6: Download complete\ne4c419671def: Verifying Checksum\ne4c419671def: Download complete\n189d5836e662: Download complete\n7851f13830b4: Verifying Checksum\n7851f13830b4: Download complete\n44ea55111f3c: Verifying Checksum\n44ea55111f3c: Download complete\n5cda37ee0889: Verifying Checksum\n5cda37ee0889: Download complete\n837be3db9074: Verifying Checksum\n837be3db9074: Download complete\nb5043d30f788: Verifying Checksum\nb5043d30f788: Download complete\n950aa2752acf: Verifying Checksum\n950aa2752acf: Download complete\n6a7d5231d563: Verifying Checksum\n6a7d5231d563: Download complete\n4f7d8eabe8da: Verifying Checksum\n4f7d8eabe8da: Download complete\n7b8ae3f51929: Verifying Checksum\n7b8ae3f51929: Download complete\n4907dda3c144: Verifying Checksum\n4907dda3c144: Download complete\nafb427daf925: Verifying Checksum\nafb427daf925: Download complete\n2706c02cff4d: Verifying Checksum\n2706c02cff4d: Download complete\na35078026774: Verifying Checksum\na35078026774: Download complete\na35078026774: Pull complete\n44ea55111f3c: Pull complete\n5ad437fb83ec: Pull complete\n853f299222ac: Pull complete\nb9fb80a6a950: Pull complete\ne8b7cb65dfe6: Pull complete\n3bfc977bb0d1: Pull complete\ne4c419671def: Pull complete\n189d5836e662: Pull complete\n7851f13830b4: Pull complete\n2706c02cff4d: Pull complete\n5cda37ee0889: Pull complete\n837be3db9074: Pull complete\nb5043d30f788: Pull complete\n950aa2752acf: Pull complete\n6a7d5231d563: Pull complete\n4f7d8eabe8da: Pull complete\n7b8ae3f51929: Pull complete\n4907dda3c144: Pull complete\nafb427daf925: Pull complete\nDigest: sha256:222d17f51bd670cf284db5db1c1991b2eeb44d97b1e87bcf2c26f4f3cc02b1c1\nStatus: Downloaded newer image for anonymous/vllm-baseline:baseline-7d94577138e3\n",
  "timestamp": "2026-01-15 02:20:09"
}