{
  "human_commit": "9a3b8832",
  "human_commit_full": "9a3b88328f7e434cac35b90ee463de6689f9a833",
  "parent_commit": "3014c920dae5a2360b9b4141395522cc52b59193",
  "model": "Qwen/Qwen2.5-VL-3B-Instruct",
  "status": "success",
  "error": null,
  "duration_s": 267.31807255744934,
  "metrics": {
    "ttft_mean_ms": 397.75,
    "ttft_median_ms": 406.88,
    "ttft_p99_ms": 548.31,
    "tpot_mean_ms": 13.47,
    "tpot_median_ms": 13.3,
    "tpot_p99_ms": 16.48,
    "itl_mean_ms": 13.47,
    "itl_median_ms": 10.89,
    "itl_p99_ms": 69.81,
    "request_throughput_req_s": 79.18,
    "output_token_throughput_tok_s": 5065.26,
    "total_token_throughput_tok_s": 25147.35
  },
  "raw_output": "                       13.47     \nMedian ITL (ms):                         10.89     \nP99 ITL (ms):                            69.81     \n==================================================\n============ Serving Benchmark Result ============\nRequest throughput (req/s):              79.18     \nOutput token throughput (tok/s):         5065.26   \nTotal Token throughput (tok/s):          25147.35  \nMean TTFT (ms):                          397.75    \nMedian TTFT (ms):                        406.88    \nP99 TTFT (ms):                           548.31    \nMean TPOT (ms):                          13.47     \nMedian TPOT (ms):                        13.30     \nP99 TPOT (ms):                           16.48     \nMean ITL (ms):                           13.47     \nMedian ITL (ms):                         10.89     \nP99 ITL (ms):                            69.81     \n==================================================\nBENCHMARK_DONE\nUnable to find image 'anonymous/vllm-baseline:baseline-3014c920dae5' locally\nbaseline-3014c920dae5: Pulling from anonymous/vllm-baseline\n9cb31e2e37ea: Already exists\nb95112eaf283: Already exists\n030ef8250936: Already exists\n72ac9ccfda38: Already exists\n73389fbd088f: Already exists\n0264850675f7: Already exists\nde1d03310308: Already exists\nc1d2af7fad0f: Already exists\n5601308b3ac6: Already exists\n6b2035e8b73e: Already exists\ned71f8f81b33: Already exists\na04181a7ff83: Pulling fs layer\nb89dfbaf9e2c: Pulling fs layer\ndc1d202b3ed0: Pulling fs layer\nad0178e8a361: Pulling fs layer\ne4a092a24edb: Pulling fs layer\ncd9db290845e: Pulling fs layer\n5548b1895cf7: Pulling fs layer\n8fb1b407da80: Pulling fs layer\n8bb1eef310f9: Pulling fs layer\ncbea0f755610: Pulling fs layer\n35e0130e2799: Pulling fs layer\n9d321133c526: Pulling fs layer\n7a9eff3b7c34: Pulling fs layer\n81bbe65dfdcc: Pulling fs layer\nf42bca5cb0a7: Pulling fs layer\n01c649c0b697: Pulling fs layer\n60475c3ad451: Pulling fs layer\nad0178e8a361: Waiting\n13957fc330f4: Pulling fs layer\ne4a092a24edb: Waiting\n5440d474cd3a: Pulling fs layer\ncd9db290845e: Waiting\n5548b1895cf7: Waiting\ne029999f716f: Pulling fs layer\n8fb1b407da80: Waiting\nc347f5163cf4: Pulling fs layer\n8bb1eef310f9: Waiting\n0429c0b4d713: Pulling fs layer\ncbea0f755610: Waiting\n35e0130e2799: Waiting\na77c0643a6d8: Pulling fs layer\n9d321133c526: Waiting\n7a9eff3b7c34: Waiting\n73430c2176af: Pulling fs layer\nf5702e9df4ab: Pulling fs layer\n81bbe65dfdcc: Waiting\n60475c3ad451: Waiting\nf42bca5cb0a7: Waiting\n13957fc330f4: Waiting\n01c649c0b697: Waiting\n5440d474cd3a: Waiting\nf5702e9df4ab: Waiting\ne029999f716f: Waiting\na77c0643a6d8: Waiting\nc347f5163cf4: Waiting\n0429c0b4d713: Waiting\n73430c2176af: Waiting\na04181a7ff83: Verifying Checksum\nb89dfbaf9e2c: Verifying Checksum\nb89dfbaf9e2c: Download complete\na04181a7ff83: Pull complete\nb89dfbaf9e2c: Pull complete\ne4a092a24edb: Verifying Checksum\ne4a092a24edb: Download complete\ncd9db290845e: Download complete\nad0178e8a361: Verifying Checksum\nad0178e8a361: Download complete\ndc1d202b3ed0: Verifying Checksum\ndc1d202b3ed0: Download complete\n8bb1eef310f9: Verifying Checksum\n8bb1eef310f9: Download complete\ncbea0f755610: Verifying Checksum\ncbea0f755610: Download complete\n35e0130e2799: Download complete\n9d321133c526: Verifying Checksum\n9d321133c526: Download complete\n8fb1b407da80: Verifying Checksum\n8fb1b407da80: Download complete\n7a9eff3b7c34: Download complete\n81bbe65dfdcc: Verifying Checksum\n81bbe65dfdcc: Download complete\nf42bca5cb0a7: Verifying Checksum\nf42bca5cb0a7: Download complete\n60475c3ad451: Verifying Checksum\n60475c3ad451: Download complete\n13957fc330f4: Verifying Checksum\n13957fc330f4: Download complete\n5440d474cd3a: Download complete\ne029999f716f: Verifying Checksum\ne029999f716f: Download complete\ndc1d202b3ed0: Pull complete\nad0178e8a361: Pull complete\ne4a092a24edb: Pull complete\ncd9db290845e: Pull complete\nc347f5163cf4: Verifying Checksum\nc347f5163cf4: Download complete\n0429c0b4d713: Verifying Checksum\n0429c0b4d713: Download complete\na77c0643a6d8: Verifying Checksum\na77c0643a6d8: Download complete\n73430c2176af: Verifying Checksum\n73430c2176af: Download complete\nf5702e9df4ab: Verifying Checksum\nf5702e9df4ab: Download complete\n01c649c0b697: Verifying Checksum\n01c649c0b697: Download complete\n5548b1895cf7: Verifying Checksum\n5548b1895cf7: Download complete\n5548b1895cf7: Pull complete\n8fb1b407da80: Pull complete\n8bb1eef310f9: Pull complete\ncbea0f755610: Pull complete\n35e0130e2799: Pull complete\n9d321133c526: Pull complete\n7a9eff3b7c34: Pull complete\n81bbe65dfdcc: Pull complete\nf42bca5cb0a7: Pull complete\n01c649c0b697: Pull complete\n60475c3ad451: Pull complete\n13957fc330f4: Pull complete\n5440d474cd3a: Pull complete\ne029999f716f: Pull complete\nc347f5163cf4: Pull complete\n0429c0b4d713: Pull complete\na77c0643a6d8: Pull complete\n73430c2176af: Pull complete\nf5702e9df4ab: Pull complete\nDigest: sha256:e826b4328c744ba9eab35bc16d2b8553b2422d18c88ad87026777433c8c51613\nStatus: Downloaded newer image for anonymous/vllm-baseline:baseline-3014c920dae5\n",
  "timestamp": "2026-01-15 02:10:03"
}