{
  "human_commit": "aea94362",
  "human_commit_full": "aea94362c9bdd08ed2b346701bdc09d278e85f66",
  "parent_commit": "7206ce4ce112ed117796a59045c968a6d353f691",
  "model": "meta-llama/Llama-3.2-1B-Instruct",
  "status": "success",
  "error": null,
  "duration_s": 203.45387768745422,
  "metrics": {
    "ttft_mean_ms": 165.87,
    "ttft_median_ms": 160.21,
    "ttft_p99_ms": 223.74,
    "tpot_mean_ms": 11.42,
    "tpot_median_ms": 11.54,
    "tpot_p99_ms": 12.77,
    "itl_mean_ms": 11.42,
    "itl_median_ms": 10.26,
    "itl_p99_ms": 59.06,
    "request_throughput_req_s": 110.37,
    "output_token_throughput_tok_s": 7063.44,
    "total_token_throughput_tok_s": 33504.98
  },
  "raw_output": ".1\" 200 OK\nINFO:     127.0.0.1:50152 - \"POST /v1/completions HTTP/1.1\" 200 OK\nINFO:     127.0.0.1:50158 - \"POST /v1/completions HTTP/1.1\" 200 OK\nINFO:     127.0.0.1:50172 - \"POST /v1/completions HTTP/1.1\" 200 OK\nINFO:     127.0.0.1:50182 - \"POST /v1/completions HTTP/1.1\" 200 OK\n\n  1%|          | 1/100 [00:00<01:29,  1.11it/s]\n100%|\u2588\u2588\u2588\u2588\u2588\u2588\u2588\u2588\u2588\u2588| 100/100 [00:00<00:00, 110.37it/s]\n============ Serving Benchmark Result ============\nSuccessful requests:                     100       \nBenchmark duration (s):                  0.91      \nTotal input tokens:                      23958     \nTotal generated tokens:                  6400      \nRequest throughput (req/s):              110.37    \nOutput token throughput (tok/s):         7063.44   \nTotal Token throughput (tok/s):          33504.98  \n---------------Time to First Token----------------\nMean TTFT (ms):                          165.87    \nMedian TTFT (ms):                        160.21    \nP99 TTFT (ms):                           223.74    \n-----Time per Output Token (excl. 1st token)------\nMean TPOT (ms):                          11.42     \nMedian TPOT (ms):                        11.54     \nP99 TPOT (ms):                           12.77     \n---------------Inter-token Latency----------------\nMean ITL (ms):                           11.42     \nMedian ITL (ms):                         10.26     \nP99 ITL (ms):                            59.06     \n==================================================\n============ Serving Benchmark Result ============\nRequest throughput (req/s):              110.37    \nOutput token throughput (tok/s):         7063.44   \nTotal Token throughput (tok/s):          33504.98  \nMean TTFT (ms):                          165.87    \nMedian TTFT (ms):                        160.21    \nP99 TTFT (ms):                           223.74    \nMean TPOT (ms):                          11.42     \nMedian TPOT (ms):                        11.54     \nP99 TPOT (ms):                           12.77     \nMean ITL (ms):                           11.42     \nMedian ITL (ms):                         10.26     \nP99 ITL (ms):                            59.06     \n==================================================\nBENCHMARK_DONE\nUnable to find image 'anonymous/vllm-baseline:baseline-7206ce4ce112' locally\nbaseline-7206ce4ce112: Pulling from anonymous/vllm-baseline\n3c645031de29: Already exists\n0d6448aff889: Already exists\n0a7674e3e8fe: Already exists\nb71b637b97c5: Already exists\n56dc85502937: Already exists\nb9839793d66a: Pulling fs layer\n383fba9dc77a: Pulling fs layer\n118edadc7038: Pulling fs layer\n4e0a4729cf8f: Pulling fs layer\n4f4fb700ef54: Pulling fs layer\n83f995f7f0a9: Pulling fs layer\n929c34f8ff3d: Pulling fs layer\n53e2146893b9: Pulling fs layer\n10c0420b9bc1: Pulling fs layer\n5275decd9505: Pulling fs layer\n75e9af819f97: Pulling fs layer\n3e537dbc6965: Pulling fs layer\n656257a0ca84: Pulling fs layer\n4e0a4729cf8f: Waiting\n363260131df6: Pulling fs layer\n4f4fb700ef54: Waiting\n83f995f7f0a9: Waiting\n8ea40aef8a82: Pulling fs layer\ne48bfd0e98e0: Pulling fs layer\n88182fe63a56: Pulling fs layer\n3e537dbc6965: Waiting\n929c34f8ff3d: Waiting\ne48bfd0e98e0: Waiting\n88182fe63a56: Waiting\n53e2146893b9: Waiting\n10c0420b9bc1: Waiting\n5275decd9505: Waiting\n656257a0ca84: Waiting\n75e9af819f97: Waiting\n8ea40aef8a82: Waiting\n363260131df6: Waiting\n383fba9dc77a: Download complete\nb9839793d66a: Verifying Checksum\nb9839793d66a: Download complete\nb9839793d66a: Pull complete\n383fba9dc77a: Pull complete\n4f4fb700ef54: Download complete\n4e0a4729cf8f: Download complete\n118edadc7038: Verifying Checksum\n118edadc7038: Download complete\n53e2146893b9: Verifying Checksum\n53e2146893b9: Download complete\n10c0420b9bc1: Verifying Checksum\n10c0420b9bc1: Download complete\n929c34f8ff3d: Verifying Checksum\n929c34f8ff3d: Download complete\n75e9af819f97: Verifying Checksum\n75e9af819f97: Download complete\n3e537dbc6965: Verifying Checksum\n3e537dbc6965: Download complete\n656257a0ca84: Verifying Checksum\n656257a0ca84: Download complete\n363260131df6: Verifying Checksum\n363260131df6: Download complete\n118edadc7038: Pull complete\n4e0a4729cf8f: Pull complete\n4f4fb700ef54: Pull complete\n8ea40aef8a82: Verifying Checksum\n8ea40aef8a82: Download complete\ne48bfd0e98e0: Verifying Checksum\ne48bfd0e98e0: Download complete\n88182fe63a56: Verifying Checksum\n88182fe63a56: Download complete\n83f995f7f0a9: Verifying Checksum\n83f995f7f0a9: Download complete\n5275decd9505: Verifying Checksum\n5275decd9505: Download complete\n83f995f7f0a9: Pull complete\n929c34f8ff3d: Pull complete\n53e2146893b9: Pull complete\n10c0420b9bc1: Pull complete\n5275decd9505: Pull complete\n75e9af819f97: Pull complete\n3e537dbc6965: Pull complete\n656257a0ca84: Pull complete\n363260131df6: Pull complete\n8ea40aef8a82: Pull complete\ne48bfd0e98e0: Pull complete\n88182fe63a56: Pull complete\nDigest: sha256:0699dd3dbc4c76ba130e40c726b5cb90aa904cf0c05d10b17d678e3eb883e801\nStatus: Downloaded newer image for anonymous/vllm-baseline:baseline-7206ce4ce112\n",
  "timestamp": "2026-01-15 00:49:25"
}