{
  "human_commit": "b2e0ad3b",
  "human_commit_full": "b2e0ad3b598ed0e022cdbd678a20821d411873c2",
  "parent_commit": "4a18fd14ba4a349291c798a16bf62fa8a9af0b6b",
  "model": "meta-llama/Llama-3.1-8B-Instruct",
  "status": "success",
  "error": null,
  "duration_s": 206.52021980285645,
  "metrics": {
    "ttft_mean_ms": 795.05,
    "ttft_median_ms": 732.4,
    "ttft_p99_ms": 1144.54,
    "tpot_mean_ms": 22.3,
    "tpot_median_ms": 23.32,
    "tpot_p99_ms": 27.98,
    "itl_mean_ms": 22.25,
    "itl_median_ms": 16.37,
    "itl_p99_ms": 298.28,
    "request_throughput_req_s": 45.06,
    "output_token_throughput_tok_s": 2883.97,
    "total_token_throughput_tok_s": 13679.92
  },
  "raw_output": "1.1\" 200 OK\nINFO:     127.0.0.1:60548 - \"POST /v1/completions HTTP/1.1\" 200 OK\nINFO:     127.0.0.1:60550 - \"POST /v1/completions HTTP/1.1\" 200 OK\nINFO:     127.0.0.1:60564 - \"POST /v1/completions HTTP/1.1\" 200 OK\nINFO:     127.0.0.1:60566 - \"POST /v1/completions HTTP/1.1\" 200 OK\n\n  1%|          | 1/100 [00:02<03:39,  2.22s/it]\n100%|\u2588\u2588\u2588\u2588\u2588\u2588\u2588\u2588\u2588\u2588| 100/100 [00:02<00:00, 45.06it/s]\n============ Serving Benchmark Result ============\nSuccessful requests:                     100       \nBenchmark duration (s):                  2.22      \nTotal input tokens:                      23958     \nTotal generated tokens:                  6400      \nRequest throughput (req/s):              45.06     \nOutput token throughput (tok/s):         2883.97   \nTotal Token throughput (tok/s):          13679.92  \n---------------Time to First Token----------------\nMean TTFT (ms):                          795.05    \nMedian TTFT (ms):                        732.40    \nP99 TTFT (ms):                           1144.54   \n-----Time per Output Token (excl. 1st token)------\nMean TPOT (ms):                          22.30     \nMedian TPOT (ms):                        23.32     \nP99 TPOT (ms):                           27.98     \n---------------Inter-token Latency----------------\nMean ITL (ms):                           22.25     \nMedian ITL (ms):                         16.37     \nP99 ITL (ms):                            298.28    \n==================================================\n============ Serving Benchmark Result ============\nRequest throughput (req/s):              45.06     \nOutput token throughput (tok/s):         2883.97   \nTotal Token throughput (tok/s):          13679.92  \nMean TTFT (ms):                          795.05    \nMedian TTFT (ms):                        732.40    \nP99 TTFT (ms):                           1144.54   \nMean TPOT (ms):                          22.30     \nMedian TPOT (ms):                        23.32     \nP99 TPOT (ms):                           27.98     \nMean ITL (ms):                           22.25     \nMedian ITL (ms):                         16.37     \nP99 ITL (ms):                            298.28    \n==================================================\nBENCHMARK_DONE\nUnable to find image 'anonymous/vllm-baseline:baseline-4a18fd14ba4a' locally\nbaseline-4a18fd14ba4a: Pulling from anonymous/vllm-baseline\n3c645031de29: Already exists\n0d6448aff889: Already exists\n0a7674e3e8fe: Already exists\nb71b637b97c5: Already exists\n56dc85502937: Already exists\nb9839793d66a: Pulling fs layer\n2b5f54714bab: Pulling fs layer\n7fb1d733c143: Pulling fs layer\ndfe7effe1245: Pulling fs layer\nefd05b5ba0da: Pulling fs layer\n0340888ebe25: Pulling fs layer\n149e8719778f: Pulling fs layer\nbe577ab33d74: Pulling fs layer\n9a231b44e25e: Pulling fs layer\n8a7de8167ed3: Pulling fs layer\n5c86290b31aa: Pulling fs layer\n90609f795ff8: Pulling fs layer\ndfe7effe1245: Waiting\nefd05b5ba0da: Waiting\n212eb81204a7: Pulling fs layer\n0340888ebe25: Waiting\n149e8719778f: Waiting\n9a231b44e25e: Waiting\nbe577ab33d74: Waiting\nb4b3e32fa591: Pulling fs layer\n5c86290b31aa: Waiting\n8a7de8167ed3: Waiting\n90609f795ff8: Waiting\n212eb81204a7: Waiting\n13bf9b379ff0: Pulling fs layer\n954d79b10060: Pulling fs layer\nb4b3e32fa591: Waiting\n13bf9b379ff0: Waiting\nbac954ee87d1: Pulling fs layer\n954d79b10060: Waiting\nbac954ee87d1: Waiting\nb9839793d66a: Download complete\nb9839793d66a: Pull complete\n2b5f54714bab: Verifying Checksum\n2b5f54714bab: Download complete\n2b5f54714bab: Pull complete\ndfe7effe1245: Verifying Checksum\ndfe7effe1245: Download complete\n7fb1d733c143: Verifying Checksum\n7fb1d733c143: Download complete\n149e8719778f: Verifying Checksum\n149e8719778f: Download complete\nbe577ab33d74: Verifying Checksum\nbe577ab33d74: Download complete\n0340888ebe25: Verifying Checksum\n0340888ebe25: Download complete\n8a7de8167ed3: Verifying Checksum\n8a7de8167ed3: Download complete\n5c86290b31aa: Verifying Checksum\n5c86290b31aa: Download complete\n90609f795ff8: Verifying Checksum\n90609f795ff8: Download complete\n212eb81204a7: Verifying Checksum\n212eb81204a7: Download complete\n7fb1d733c143: Pull complete\ndfe7effe1245: Pull complete\nb4b3e32fa591: Verifying Checksum\nb4b3e32fa591: Download complete\n13bf9b379ff0: Download complete\n954d79b10060: Verifying Checksum\n954d79b10060: Download complete\nbac954ee87d1: Verifying Checksum\nbac954ee87d1: Download complete\nefd05b5ba0da: Download complete\n9a231b44e25e: Verifying Checksum\n9a231b44e25e: Download complete\nefd05b5ba0da: Pull complete\n0340888ebe25: Pull complete\n149e8719778f: Pull complete\nbe577ab33d74: Pull complete\n9a231b44e25e: Pull complete\n8a7de8167ed3: Pull complete\n5c86290b31aa: Pull complete\n90609f795ff8: Pull complete\n212eb81204a7: Pull complete\nb4b3e32fa591: Pull complete\n13bf9b379ff0: Pull complete\n954d79b10060: Pull complete\nbac954ee87d1: Pull complete\nDigest: sha256:6e54e2527f54ec3b128df929d7a6a39284c56e19845bc898a748f1793e2347e7\nStatus: Downloaded newer image for anonymous/vllm-baseline:baseline-4a18fd14ba4a\n",
  "timestamp": "2026-01-15 01:16:19"
}