{
  "human_commit": "b55ed6ef",
  "human_commit_full": "b55ed6ef8ab0dce7fb0f79ff292dafdb4d22610c",
  "parent_commit": "2f385183f35497e030ef22c9820d83b83bc4f6db",
  "model": "meta-llama/Llama-3.1-8B-Instruct",
  "status": "success",
  "error": null,
  "duration_s": 200.98694968223572,
  "metrics": {
    "ttft_mean_ms": 580.73,
    "ttft_median_ms": 545.6,
    "ttft_p99_ms": 943.83,
    "tpot_mean_ms": 22.54,
    "tpot_median_ms": 23.12,
    "tpot_p99_ms": 30.11,
    "itl_mean_ms": 22.47,
    "itl_median_ms": 16.43,
    "itl_p99_ms": 277.3,
    "request_throughput_req_s": 49.63,
    "output_token_throughput_tok_s": 3176.11,
    "total_token_throughput_tok_s": 15065.67
  },
  "raw_output": ".1\" 200 OK\nINFO:     127.0.0.1:51184 - \"POST /v1/completions HTTP/1.1\" 200 OK\nINFO:     127.0.0.1:51200 - \"POST /v1/completions HTTP/1.1\" 200 OK\nINFO:     127.0.0.1:51204 - \"POST /v1/completions HTTP/1.1\" 200 OK\nINFO:     127.0.0.1:51216 - \"POST /v1/completions HTTP/1.1\" 200 OK\nINFO:     127.0.0.1:51220 - \"POST /v1/completions HTTP/1.1\" 200 OK\n\n  1%|          | 1/100 [00:02<03:19,  2.01s/it]\n100%|\u2588\u2588\u2588\u2588\u2588\u2588\u2588\u2588\u2588\u2588| 100/100 [00:02<00:00, 49.63it/s]\n============ Serving Benchmark Result ============\nSuccessful requests:                     100       \nBenchmark duration (s):                  2.02      \nTotal input tokens:                      23958     \nTotal generated tokens:                  6400      \nRequest throughput (req/s):              49.63     \nOutput token throughput (tok/s):         3176.11   \nTotal Token throughput (tok/s):          15065.67  \n---------------Time to First Token----------------\nMean TTFT (ms):                          580.73    \nMedian TTFT (ms):                        545.60    \nP99 TTFT (ms):                           943.83    \n-----Time per Output Token (excl. 1st token)------\nMean TPOT (ms):                          22.54     \nMedian TPOT (ms):                        23.12     \nP99 TPOT (ms):                           30.11     \n---------------Inter-token Latency----------------\nMean ITL (ms):                           22.47     \nMedian ITL (ms):                         16.43     \nP99 ITL (ms):                            277.30    \n==================================================\n============ Serving Benchmark Result ============\nRequest throughput (req/s):              49.63     \nOutput token throughput (tok/s):         3176.11   \nTotal Token throughput (tok/s):          15065.67  \nMean TTFT (ms):                          580.73    \nMedian TTFT (ms):                        545.60    \nP99 TTFT (ms):                           943.83    \nMean TPOT (ms):                          22.54     \nMedian TPOT (ms):                        23.12     \nP99 TPOT (ms):                           30.11     \nMean ITL (ms):                           22.47     \nMedian ITL (ms):                         16.43     \nP99 ITL (ms):                            277.30    \n==================================================\nBENCHMARK_DONE\nUnable to find image 'anonymous/vllm-baseline:baseline-2f385183f354' locally\nbaseline-2f385183f354: Pulling from anonymous/vllm-baseline\n3c645031de29: Already exists\n0d6448aff889: Already exists\n0a7674e3e8fe: Already exists\nb71b637b97c5: Already exists\n56dc85502937: Already exists\nb9839793d66a: Pulling fs layer\n383fba9dc77a: Pulling fs layer\n118edadc7038: Pulling fs layer\n4e0a4729cf8f: Pulling fs layer\n4f4fb700ef54: Pulling fs layer\ne5163ec7bd9e: Pulling fs layer\nf86f37175918: Pulling fs layer\nfbdd9b775289: Pulling fs layer\na408d17e6542: Pulling fs layer\n2c0d3b618a71: Pulling fs layer\na4ab873e4ee3: Pulling fs layer\n5ae93a3e7e44: Pulling fs layer\nd902db124107: Pulling fs layer\n6ffc40277f98: Pulling fs layer\nf95a4c76edfe: Pulling fs layer\n838dd1b97860: Pulling fs layer\n07b68f7a80b6: Pulling fs layer\n5ae93a3e7e44: Waiting\nd902db124107: Waiting\n6ffc40277f98: Waiting\nf95a4c76edfe: Waiting\n838dd1b97860: Waiting\n07b68f7a80b6: Waiting\n4f4fb700ef54: Waiting\ne5163ec7bd9e: Waiting\nf86f37175918: Waiting\nfbdd9b775289: Waiting\na408d17e6542: Waiting\n2c0d3b618a71: Waiting\n4e0a4729cf8f: Waiting\na4ab873e4ee3: Waiting\nb9839793d66a: Download complete\nb9839793d66a: Pull complete\n383fba9dc77a: Download complete\n383fba9dc77a: Pull complete\n4e0a4729cf8f: Verifying Checksum\n4e0a4729cf8f: Download complete\n4f4fb700ef54: Download complete\n118edadc7038: Verifying Checksum\n118edadc7038: Download complete\nfbdd9b775289: Verifying Checksum\nfbdd9b775289: Download complete\na408d17e6542: Verifying Checksum\na408d17e6542: Download complete\nf86f37175918: Verifying Checksum\nf86f37175918: Download complete\na4ab873e4ee3: Verifying Checksum\na4ab873e4ee3: Download complete\n5ae93a3e7e44: Verifying Checksum\n5ae93a3e7e44: Download complete\nd902db124107: Download complete\n118edadc7038: Pull complete\n4e0a4729cf8f: Pull complete\n4f4fb700ef54: Pull complete\n6ffc40277f98: Verifying Checksum\n6ffc40277f98: Download complete\nf95a4c76edfe: Download complete\n838dd1b97860: Verifying Checksum\n838dd1b97860: Download complete\n07b68f7a80b6: Verifying Checksum\n07b68f7a80b6: Download complete\ne5163ec7bd9e: Verifying Checksum\ne5163ec7bd9e: Download complete\n2c0d3b618a71: Verifying Checksum\n2c0d3b618a71: Download complete\ne5163ec7bd9e: Pull complete\nf86f37175918: Pull complete\nfbdd9b775289: Pull complete\na408d17e6542: Pull complete\n2c0d3b618a71: Pull complete\na4ab873e4ee3: Pull complete\n5ae93a3e7e44: Pull complete\nd902db124107: Pull complete\n6ffc40277f98: Pull complete\nf95a4c76edfe: Pull complete\n838dd1b97860: Pull complete\n07b68f7a80b6: Pull complete\nDigest: sha256:7fadf3f064b2b7b0107710b92750169f85f1b8c8b0c8f29ddc368d9b136d2990\nStatus: Downloaded newer image for anonymous/vllm-baseline:baseline-2f385183f354\n",
  "timestamp": "2026-01-15 01:40:03"
}