{
  "human_commit": "c0569dbc",
  "human_commit_full": "c0569dbc82b5e945a77878190114d1b68027828b",
  "parent_commit": "8bb43b9c9ee878e07038d3f36aaf279ffb2fabab",
  "model": "Qwen/Qwen3-30B-A3B-FP8",
  "status": "success",
  "error": null,
  "duration_s": 286.5346870422363,
  "metrics": {
    "ttft_mean_ms": 545.14,
    "ttft_median_ms": 586.79,
    "ttft_p99_ms": 819.37,
    "tpot_mean_ms": 23.87,
    "tpot_median_ms": 23.18,
    "tpot_p99_ms": 28.55,
    "itl_mean_ms": 23.87,
    "itl_median_ms": 19.34,
    "itl_p99_ms": 248.45,
    "request_throughput_req_s": 48.4,
    "output_token_throughput_tok_s": 3097.48,
    "total_token_throughput_tok_s": 15415.78
  },
  "raw_output": "(req/s):              48.40     \nOutput token throughput (tok/s):         3097.48   \nTotal Token throughput (tok/s):          15415.78  \nMean TTFT (ms):                          545.14    \nMedian TTFT (ms):                        586.79    \nP99 TTFT (ms):                           819.37    \nMean TPOT (ms):                          23.87     \nMedian TPOT (ms):                        23.18     \nP99 TPOT (ms):                           28.55     \nMean ITL (ms):                           23.87     \nMedian ITL (ms):                         19.34     \nP99 ITL (ms):                            248.45    \n==================================================\nBENCHMARK_DONE\nUnable to find image 'anonymous/vllm-baseline:baseline-8bb43b9c9ee8' locally\nbaseline-8bb43b9c9ee8: Pulling from anonymous/vllm-baseline\n9cb31e2e37ea: Already exists\nb95112eaf283: Already exists\n030ef8250936: Already exists\n72ac9ccfda38: Already exists\n73389fbd088f: Already exists\n0264850675f7: Already exists\nde1d03310308: Already exists\nc1d2af7fad0f: Already exists\n5601308b3ac6: Already exists\n6b2035e8b73e: Already exists\ned71f8f81b33: Already exists\n540cfbdd0553: Pulling fs layer\nbd6bc9ba88a4: Pulling fs layer\n66fd8f04aaef: Pulling fs layer\n7d37c382e738: Pulling fs layer\n214c7e439bc3: Pulling fs layer\nfb1fa7eafb5d: Pulling fs layer\n955e93cd4ba1: Pulling fs layer\n79eeec4ab315: Pulling fs layer\nded0b6c85ef1: Pulling fs layer\nfe1478b9ba77: Pulling fs layer\n3b6fd5c2b205: Pulling fs layer\ne4d14cf72599: Pulling fs layer\n7d37c382e738: Waiting\n214c7e439bc3: Waiting\nfb1fa7eafb5d: Waiting\n955e93cd4ba1: Waiting\n97f3a875c42c: Pulling fs layer\nded0b6c85ef1: Waiting\n79eeec4ab315: Waiting\nfe1478b9ba77: Waiting\n3b6fd5c2b205: Waiting\ne4d14cf72599: Waiting\n0ec51324ca89: Pulling fs layer\n97f3a875c42c: Waiting\ndf82fa830bd6: Pulling fs layer\n0ec51324ca89: Waiting\n6f6b681f4147: Pulling fs layer\n8d1945ffbf1f: Pulling fs layer\ndf82fa830bd6: Waiting\n6f6b681f4147: Waiting\n4022dd1f22a8: Pulling fs layer\n8d1945ffbf1f: Waiting\nc07328ef4a31: Pulling fs layer\n87548fb758ae: Pulling fs layer\n4022dd1f22a8: Waiting\nc07328ef4a31: Waiting\n57508c37502e: Pulling fs layer\n87548fb758ae: Waiting\n466221dcdff0: Pulling fs layer\n57508c37502e: Waiting\n70a4389b250f: Pulling fs layer\n466221dcdff0: Waiting\nae25c82955fb: Pulling fs layer\n70a4389b250f: Waiting\n5325dac11207: Pulling fs layer\nae25c82955fb: Waiting\ne3a31f20bc89: Pulling fs layer\n5325dac11207: Waiting\ne3a31f20bc89: Waiting\nbd6bc9ba88a4: Verifying Checksum\nbd6bc9ba88a4: Download complete\n540cfbdd0553: Verifying Checksum\n540cfbdd0553: Download complete\n540cfbdd0553: Pull complete\nbd6bc9ba88a4: Pull complete\n214c7e439bc3: Verifying Checksum\n214c7e439bc3: Download complete\nfb1fa7eafb5d: Download complete\n7d37c382e738: Verifying Checksum\n7d37c382e738: Download complete\n66fd8f04aaef: Verifying Checksum\n66fd8f04aaef: Download complete\nded0b6c85ef1: Verifying Checksum\nfe1478b9ba77: Verifying Checksum\nfe1478b9ba77: Download complete\n3b6fd5c2b205: Download complete\ne4d14cf72599: Verifying Checksum\ne4d14cf72599: Download complete\n97f3a875c42c: Download complete\n79eeec4ab315: Verifying Checksum\n79eeec4ab315: Download complete\ndf82fa830bd6: Verifying Checksum\ndf82fa830bd6: Download complete\n0ec51324ca89: Download complete\n6f6b681f4147: Verifying Checksum\n6f6b681f4147: Download complete\n4022dd1f22a8: Verifying Checksum\n4022dd1f22a8: Download complete\nc07328ef4a31: Verifying Checksum\nc07328ef4a31: Download complete\n87548fb758ae: Verifying Checksum\n87548fb758ae: Download complete\n57508c37502e: Verifying Checksum\n57508c37502e: Download complete\n66fd8f04aaef: Pull complete\n7d37c382e738: Pull complete\n214c7e439bc3: Pull complete\nfb1fa7eafb5d: Pull complete\n466221dcdff0: Verifying Checksum\n466221dcdff0: Download complete\n70a4389b250f: Verifying Checksum\n70a4389b250f: Download complete\nae25c82955fb: Download complete\n5325dac11207: Verifying Checksum\n5325dac11207: Download complete\ne3a31f20bc89: Verifying Checksum\ne3a31f20bc89: Download complete\n955e93cd4ba1: Retrying in 5 seconds\n955e93cd4ba1: Retrying in 4 seconds\n955e93cd4ba1: Retrying in 3 seconds\n955e93cd4ba1: Retrying in 2 seconds\n8d1945ffbf1f: Verifying Checksum\n8d1945ffbf1f: Download complete\n955e93cd4ba1: Retrying in 1 second\n955e93cd4ba1: Download complete\n955e93cd4ba1: Pull complete\n79eeec4ab315: Pull complete\nded0b6c85ef1: Pull complete\nfe1478b9ba77: Pull complete\n3b6fd5c2b205: Pull complete\ne4d14cf72599: Pull complete\n97f3a875c42c: Pull complete\n0ec51324ca89: Pull complete\ndf82fa830bd6: Pull complete\n6f6b681f4147: Pull complete\n8d1945ffbf1f: Pull complete\n4022dd1f22a8: Pull complete\nc07328ef4a31: Pull complete\n87548fb758ae: Pull complete\n57508c37502e: Pull complete\n466221dcdff0: Pull complete\n70a4389b250f: Pull complete\nae25c82955fb: Pull complete\n5325dac11207: Pull complete\ne3a31f20bc89: Pull complete\nDigest: sha256:bad250a21615cebf7ffe311ae089de59e83f78a6879cfe2f09497930fed0ef01\nStatus: Downloaded newer image for anonymous/vllm-baseline:baseline-8bb43b9c9ee8\n",
  "timestamp": "2026-01-15 01:36:42"
}