{
  "human_commit": "dcc6cfb9",
  "human_commit_full": "dcc6cfb991cd76369aad96e04424f29c8fecdbd8",
  "parent_commit": "dd572c0ab3effa539b74f9a1288bb61ce83ada76",
  "model": "Qwen/Qwen3-30B-A3B-FP8",
  "status": "success",
  "error": null,
  "duration_s": 271.56226873397827,
  "metrics": {
    "ttft_mean_ms": 574.42,
    "ttft_median_ms": 621.55,
    "ttft_p99_ms": 855.71,
    "tpot_mean_ms": 23.81,
    "tpot_median_ms": 23.03,
    "tpot_p99_ms": 28.37,
    "itl_mean_ms": 23.81,
    "itl_median_ms": 19.31,
    "itl_p99_ms": 250.37,
    "request_throughput_req_s": 47.83,
    "output_token_throughput_tok_s": 3060.96,
    "total_token_throughput_tok_s": 15234.03
  },
  "raw_output": "ed tokens:                  6400      \nRequest throughput (req/s):              47.83     \nOutput token throughput (tok/s):         3060.96   \nTotal Token throughput (tok/s):          15234.03  \n---------------Time to First Token----------------\nMean TTFT (ms):                          574.42    \nMedian TTFT (ms):                        621.55    \nP99 TTFT (ms):                           855.71    \n-----Time per Output Token (excl. 1st token)------\nMean TPOT (ms):                          23.81     \nMedian TPOT (ms):                        23.03     \nP99 TPOT (ms):                           28.37     \n---------------Inter-token Latency----------------\nMean ITL (ms):                           23.81     \nMedian ITL (ms):                         19.31     \nP99 ITL (ms):                            250.37    \n==================================================\n============ Serving Benchmark Result ============\nRequest throughput (req/s):              47.83     \nOutput token throughput (tok/s):         3060.96   \nTotal Token throughput (tok/s):          15234.03  \nMean TTFT (ms):                          574.42    \nMedian TTFT (ms):                        621.55    \nP99 TTFT (ms):                           855.71    \nMean TPOT (ms):                          23.81     \nMedian TPOT (ms):                        23.03     \nP99 TPOT (ms):                           28.37     \nMean ITL (ms):                           23.81     \nMedian ITL (ms):                         19.31     \nP99 ITL (ms):                            250.37    \n==================================================\nBENCHMARK_DONE\nUnable to find image 'anonymous/vllm-baseline:baseline-dd572c0ab3ef' locally\nbaseline-dd572c0ab3ef: Pulling from anonymous/vllm-baseline\n9cb31e2e37ea: Already exists\nb95112eaf283: Already exists\n030ef8250936: Already exists\n72ac9ccfda38: Already exists\n73389fbd088f: Already exists\n0264850675f7: Already exists\nde1d03310308: Already exists\nc1d2af7fad0f: Already exists\n5601308b3ac6: Already exists\n6b2035e8b73e: Already exists\ned71f8f81b33: Already exists\n6a2306edc128: Already exists\nbb5ee2f41954: Already exists\nae1cc335b65b: Already exists\n2fb01f5ad376: Already exists\nb7dfd152a1fd: Already exists\n2987a32afa11: Already exists\nac6e8965f5b8: Pulling fs layer\nde0ab49724bc: Pulling fs layer\nd97f30c8397a: Pulling fs layer\na24b30683680: Pulling fs layer\n7c35f4340a1b: Pulling fs layer\n344b06fc47ec: Pulling fs layer\n566bdf59c3d0: Pulling fs layer\n24b39caa0d68: Pulling fs layer\ncb0f2dea92e5: Pulling fs layer\nf7b8e541c49b: Pulling fs layer\nf4626c8854a5: Pulling fs layer\nc785db56aad5: Pulling fs layer\n66e41034a1ad: Pulling fs layer\na24b30683680: Waiting\n3094f2a3e4d1: Pulling fs layer\n7c35f4340a1b: Waiting\n344b06fc47ec: Waiting\n566bdf59c3d0: Waiting\nf7b8e541c49b: Waiting\ne2148783a4c9: Pulling fs layer\n24b39caa0d68: Waiting\ncb0f2dea92e5: Waiting\nc785db56aad5: Waiting\nd47eb252932c: Pulling fs layer\nf4626c8854a5: Waiting\n66e41034a1ad: Waiting\n3094f2a3e4d1: Waiting\n68ae350d95c8: Pulling fs layer\n1373ec611b1d: Pulling fs layer\nd47eb252932c: Waiting\n68ae350d95c8: Waiting\nbed4b4ca235b: Pulling fs layer\n1373ec611b1d: Waiting\n29ccd9a2bdd7: Pulling fs layer\nbed4b4ca235b: Waiting\n29ccd9a2bdd7: Waiting\nd97f30c8397a: Download complete\na24b30683680: Verifying Checksum\na24b30683680: Download complete\n7c35f4340a1b: Verifying Checksum\n7c35f4340a1b: Download complete\n344b06fc47ec: Download complete\n566bdf59c3d0: Download complete\n24b39caa0d68: Download complete\ncb0f2dea92e5: Download complete\nf7b8e541c49b: Verifying Checksum\nf7b8e541c49b: Download complete\nde0ab49724bc: Verifying Checksum\nde0ab49724bc: Download complete\nc785db56aad5: Verifying Checksum\nc785db56aad5: Download complete\n66e41034a1ad: Verifying Checksum\n66e41034a1ad: Download complete\n3094f2a3e4d1: Verifying Checksum\n3094f2a3e4d1: Download complete\ne2148783a4c9: Verifying Checksum\ne2148783a4c9: Download complete\nd47eb252932c: Verifying Checksum\nd47eb252932c: Download complete\n68ae350d95c8: Download complete\n1373ec611b1d: Download complete\nbed4b4ca235b: Verifying Checksum\nbed4b4ca235b: Download complete\n29ccd9a2bdd7: Verifying Checksum\n29ccd9a2bdd7: Download complete\nf4626c8854a5: Download complete\nac6e8965f5b8: Verifying Checksum\nac6e8965f5b8: Download complete\nac6e8965f5b8: Pull complete\nde0ab49724bc: Pull complete\nd97f30c8397a: Pull complete\na24b30683680: Pull complete\n7c35f4340a1b: Pull complete\n344b06fc47ec: Pull complete\n566bdf59c3d0: Pull complete\n24b39caa0d68: Pull complete\ncb0f2dea92e5: Pull complete\nf7b8e541c49b: Pull complete\nf4626c8854a5: Pull complete\nc785db56aad5: Pull complete\n66e41034a1ad: Pull complete\n3094f2a3e4d1: Pull complete\ne2148783a4c9: Pull complete\nd47eb252932c: Pull complete\n68ae350d95c8: Pull complete\n1373ec611b1d: Pull complete\nbed4b4ca235b: Pull complete\n29ccd9a2bdd7: Pull complete\nDigest: sha256:3e0e311996fbf461cb71d4fd7f2ba629d7b42265719306eca70b46e6443301e6\nStatus: Downloaded newer image for anonymous/vllm-baseline:baseline-dd572c0ab3ef\n",
  "timestamp": "2026-01-15 00:53:57"
}