{
  "human_commit": "e206b543",
  "human_commit_full": "e206b5433109d298e53451015465b2bf8f03ef0a",
  "parent_commit": "1d35662e6dc199431bfe4004cc84d66fd9b297b1",
  "model": "meta-llama/Llama-3.1-8B-Instruct",
  "status": "success",
  "error": null,
  "duration_s": 210.72424602508545,
  "metrics": {
    "ttft_mean_ms": 589.9,
    "ttft_median_ms": 563.03,
    "ttft_p99_ms": 953.25,
    "tpot_mean_ms": 23.03,
    "tpot_median_ms": 23.48,
    "tpot_p99_ms": 30.48,
    "itl_mean_ms": 23.03,
    "itl_median_ms": 17.06,
    "itl_p99_ms": 275.04,
    "request_throughput_req_s": 48.49,
    "output_token_throughput_tok_s": 3103.06,
    "total_token_throughput_tok_s": 14719.15
  },
  "raw_output": "    | 1/100 [00:02<03:24,  2.06s/it]\n100%|\u2588\u2588\u2588\u2588\u2588\u2588\u2588\u2588\u2588\u2588| 100/100 [00:02<00:00, 48.49it/s]\n============ Serving Benchmark Result ============\nSuccessful requests:                     100       \nBenchmark duration (s):                  2.06      \nTotal input tokens:                      23958     \nTotal generated tokens:                  6400      \nRequest throughput (req/s):              48.49     \nOutput token throughput (tok/s):         3103.06   \nTotal Token throughput (tok/s):          14719.15  \n---------------Time to First Token----------------\nMean TTFT (ms):                          589.90    \nMedian TTFT (ms):                        563.03    \nP99 TTFT (ms):                           953.25    \n-----Time per Output Token (excl. 1st token)------\nMean TPOT (ms):                          23.03     \nMedian TPOT (ms):                        23.48     \nP99 TPOT (ms):                           30.48     \n---------------Inter-token Latency----------------\nMean ITL (ms):                           23.03     \nMedian ITL (ms):                         17.06     \nP99 ITL (ms):                            275.04    \n==================================================\n============ Serving Benchmark Result ============\nRequest throughput (req/s):              48.49     \nOutput token throughput (tok/s):         3103.06   \nTotal Token throughput (tok/s):          14719.15  \nMean TTFT (ms):                          589.90    \nMedian TTFT (ms):                        563.03    \nP99 TTFT (ms):                           953.25    \nMean TPOT (ms):                          23.03     \nMedian TPOT (ms):                        23.48     \nP99 TPOT (ms):                           30.48     \nMean ITL (ms):                           23.03     \nMedian ITL (ms):                         17.06     \nP99 ITL (ms):                            275.04    \n==================================================\nBENCHMARK_DONE\nUnable to find image 'anonymous/vllm-baseline:baseline-1d35662e6dc1' locally\nbaseline-1d35662e6dc1: Pulling from anonymous/vllm-baseline\n3c645031de29: Already exists\n0d6448aff889: Already exists\n0a7674e3e8fe: Already exists\nb71b637b97c5: Already exists\n56dc85502937: Already exists\nec6d5f6c9ed9: Pulling fs layer\n47b8539d532f: Pulling fs layer\nfd9cc1ad8dee: Pulling fs layer\n83525caeeb35: Pulling fs layer\n8e79813a7b9d: Pulling fs layer\n312a542960e3: Pulling fs layer\n949691b47390: Pulling fs layer\n7cbb09265719: Pulling fs layer\ncb7c80b8c4f1: Pulling fs layer\nf4d72f8f1249: Pulling fs layer\n8674c1b1cd92: Pulling fs layer\n018ba7d11c56: Pulling fs layer\n83525caeeb35: Waiting\ncd323fb9b54f: Pulling fs layer\n9317342682d6: Pulling fs layer\n57dc9080e6a0: Pulling fs layer\n98346943c9bb: Pulling fs layer\n5512ecba70be: Pulling fs layer\n286cc532c9d2: Pulling fs layer\n8e79813a7b9d: Waiting\n312a542960e3: Waiting\n072c9169174b: Pulling fs layer\n018ba7d11c56: Waiting\n949691b47390: Waiting\ncd323fb9b54f: Waiting\n7cbb09265719: Waiting\n9317342682d6: Waiting\n57dc9080e6a0: Waiting\ncb7c80b8c4f1: Waiting\n286cc532c9d2: Waiting\n98346943c9bb: Waiting\n072c9169174b: Waiting\nf4d72f8f1249: Waiting\n5512ecba70be: Waiting\n8674c1b1cd92: Waiting\nfd9cc1ad8dee: Verifying Checksum\nfd9cc1ad8dee: Download complete\n47b8539d532f: Verifying Checksum\n47b8539d532f: Download complete\n83525caeeb35: Download complete\n312a542960e3: Verifying Checksum\n312a542960e3: Download complete\n949691b47390: Verifying Checksum\n949691b47390: Download complete\n7cbb09265719: Download complete\ncb7c80b8c4f1: Verifying Checksum\ncb7c80b8c4f1: Download complete\nf4d72f8f1249: Verifying Checksum\nf4d72f8f1249: Download complete\n8674c1b1cd92: Verifying Checksum\n8674c1b1cd92: Download complete\n018ba7d11c56: Download complete\nec6d5f6c9ed9: Verifying Checksum\nec6d5f6c9ed9: Download complete\n9317342682d6: Verifying Checksum\n9317342682d6: Download complete\n57dc9080e6a0: Verifying Checksum\n57dc9080e6a0: Download complete\n98346943c9bb: Verifying Checksum\n98346943c9bb: Download complete\n5512ecba70be: Verifying Checksum\n5512ecba70be: Download complete\n286cc532c9d2: Verifying Checksum\n286cc532c9d2: Download complete\nec6d5f6c9ed9: Pull complete\n47b8539d532f: Pull complete\nfd9cc1ad8dee: Pull complete\n83525caeeb35: Pull complete\n8e79813a7b9d: Verifying Checksum\n8e79813a7b9d: Download complete\n072c9169174b: Verifying Checksum\n072c9169174b: Download complete\ncd323fb9b54f: Verifying Checksum\ncd323fb9b54f: Download complete\n8e79813a7b9d: Pull complete\n312a542960e3: Pull complete\n949691b47390: Pull complete\n7cbb09265719: Pull complete\ncb7c80b8c4f1: Pull complete\nf4d72f8f1249: Pull complete\n8674c1b1cd92: Pull complete\n018ba7d11c56: Pull complete\ncd323fb9b54f: Pull complete\n9317342682d6: Pull complete\n57dc9080e6a0: Pull complete\n98346943c9bb: Pull complete\n5512ecba70be: Pull complete\n286cc532c9d2: Pull complete\n072c9169174b: Pull complete\nDigest: sha256:8b92b5bd6581e22b3731993e52c4aaa1e18627c07f1d58f41782ca5698e54b95\nStatus: Downloaded newer image for anonymous/vllm-baseline:baseline-1d35662e6dc1\n",
  "timestamp": "2026-01-15 00:57:27"
}