{
  "human_commit": "e7b20426",
  "human_commit_full": "e7b204268132cb775c139574c1ff4ad7e15c8f66",
  "parent_commit": "90f1e55421f1b61394ba25abe34bf5abd82a71af",
  "model": "01-ai/Yi-1.5-9B-Chat",
  "status": "success",
  "error": null,
  "duration_s": 259.783545255661,
  "metrics": {
    "ttft_mean_ms": 720.82,
    "ttft_median_ms": 781.67,
    "ttft_p99_ms": 1185.93,
    "tpot_mean_ms": 29.44,
    "tpot_median_ms": 28.47,
    "tpot_p99_ms": 36.64,
    "itl_mean_ms": 29.44,
    "itl_median_ms": 18.09,
    "itl_p99_ms": 418.93,
    "request_throughput_req_s": 38.57,
    "output_token_throughput_tok_s": 2468.34,
    "total_token_throughput_tok_s": 12266.49
  },
  "raw_output": "rst Token----------------\nMean TTFT (ms):                          720.82    \nMedian TTFT (ms):                        781.67    \nP99 TTFT (ms):                           1185.93   \n-----Time per Output Token (excl. 1st token)------\nMean TPOT (ms):                          29.44     \nMedian TPOT (ms):                        28.47     \nP99 TPOT (ms):                           36.64     \n---------------Inter-token Latency----------------\nMean ITL (ms):                           29.44     \nMedian ITL (ms):                         18.09     \nP99 ITL (ms):                            418.93    \n==================================================\n============ Serving Benchmark Result ============\nRequest throughput (req/s):              38.57     \nOutput token throughput (tok/s):         2468.34   \nTotal Token throughput (tok/s):          12266.49  \nMean TTFT (ms):                          720.82    \nMedian TTFT (ms):                        781.67    \nP99 TTFT (ms):                           1185.93   \nMean TPOT (ms):                          29.44     \nMedian TPOT (ms):                        28.47     \nP99 TPOT (ms):                           36.64     \nMean ITL (ms):                           29.44     \nMedian ITL (ms):                         18.09     \nP99 ITL (ms):                            418.93    \n==================================================\nBENCHMARK_DONE\nUnable to find image 'anonymous/vllm-baseline:baseline-90f1e55421f1' locally\nbaseline-90f1e55421f1: Pulling from anonymous/vllm-baseline\n9cb31e2e37ea: Already exists\nb95112eaf283: Already exists\n030ef8250936: Already exists\n72ac9ccfda38: Already exists\n73389fbd088f: Already exists\n0264850675f7: Already exists\nde1d03310308: Already exists\nc1d2af7fad0f: Already exists\n5601308b3ac6: Already exists\n6b2035e8b73e: Already exists\ned71f8f81b33: Already exists\n6a2306edc128: Already exists\nbb5ee2f41954: Already exists\nae1cc335b65b: Already exists\n2fb01f5ad376: Already exists\nb7dfd152a1fd: Already exists\n2987a32afa11: Already exists\n24c411419ac1: Pulling fs layer\nc8d29b7b3503: Pulling fs layer\n5b5d139b0f70: Pulling fs layer\nfe9fcdf3572f: Pulling fs layer\neda34e4d7717: Pulling fs layer\n39497b136017: Pulling fs layer\n192be8e96b1e: Pulling fs layer\n5680226cb892: Pulling fs layer\n86011db83de7: Pulling fs layer\n66252391c785: Pulling fs layer\na1485c6eea3b: Pulling fs layer\n320cc2307904: Pulling fs layer\n8e2b0e2a7028: Pulling fs layer\n69f6bb345d37: Pulling fs layer\n411fbe5be3d6: Pulling fs layer\n8b4946980039: Pulling fs layer\ndaa06c050335: Pulling fs layer\ne7f85f0fb8d2: Pulling fs layer\n049bb6aecd88: Pulling fs layer\n5680226cb892: Waiting\n2e12403621d4: Pulling fs layer\n86011db83de7: Waiting\n66252391c785: Waiting\nfe9fcdf3572f: Waiting\n320cc2307904: Waiting\na1485c6eea3b: Waiting\n8e2b0e2a7028: Waiting\n69f6bb345d37: Waiting\neda34e4d7717: Waiting\n411fbe5be3d6: Waiting\n192be8e96b1e: Waiting\n8b4946980039: Waiting\n39497b136017: Waiting\ndaa06c050335: Waiting\n2e12403621d4: Waiting\ne7f85f0fb8d2: Waiting\n049bb6aecd88: Waiting\n5b5d139b0f70: Verifying Checksum\n5b5d139b0f70: Download complete\nfe9fcdf3572f: Verifying Checksum\nfe9fcdf3572f: Download complete\neda34e4d7717: Verifying Checksum\neda34e4d7717: Download complete\n39497b136017: Verifying Checksum\n39497b136017: Download complete\n192be8e96b1e: Verifying Checksum\n192be8e96b1e: Download complete\n5680226cb892: Verifying Checksum\n5680226cb892: Download complete\n86011db83de7: Verifying Checksum\n86011db83de7: Download complete\n66252391c785: Verifying Checksum\n66252391c785: Download complete\nc8d29b7b3503: Verifying Checksum\nc8d29b7b3503: Download complete\n320cc2307904: Verifying Checksum\n320cc2307904: Download complete\n8e2b0e2a7028: Verifying Checksum\n8e2b0e2a7028: Download complete\n69f6bb345d37: Verifying Checksum\n69f6bb345d37: Download complete\n411fbe5be3d6: Verifying Checksum\n411fbe5be3d6: Download complete\n8b4946980039: Verifying Checksum\n8b4946980039: Download complete\ndaa06c050335: Download complete\ne7f85f0fb8d2: Download complete\n049bb6aecd88: Verifying Checksum\n049bb6aecd88: Download complete\n2e12403621d4: Verifying Checksum\n2e12403621d4: Download complete\na1485c6eea3b: Verifying Checksum\na1485c6eea3b: Download complete\n24c411419ac1: Verifying Checksum\n24c411419ac1: Download complete\n24c411419ac1: Pull complete\nc8d29b7b3503: Pull complete\n5b5d139b0f70: Pull complete\nfe9fcdf3572f: Pull complete\neda34e4d7717: Pull complete\n39497b136017: Pull complete\n192be8e96b1e: Pull complete\n5680226cb892: Pull complete\n86011db83de7: Pull complete\n66252391c785: Pull complete\na1485c6eea3b: Pull complete\n320cc2307904: Pull complete\n8e2b0e2a7028: Pull complete\n69f6bb345d37: Pull complete\n411fbe5be3d6: Pull complete\n8b4946980039: Pull complete\ndaa06c050335: Pull complete\ne7f85f0fb8d2: Pull complete\n049bb6aecd88: Pull complete\n2e12403621d4: Pull complete\nDigest: sha256:4140ad4fdc95ad43e704c06144ebb6b3153768156e9d80db4ad159a13fcf09c4\nStatus: Downloaded newer image for anonymous/vllm-baseline:baseline-90f1e55421f1\n",
  "timestamp": "2026-01-15 01:52:50"
}