{
  "human_commit": "fc542144",
  "human_commit_full": "fc542144c4477ffec1d3de6fa43e54f8fb5351e8",
  "parent_commit": "eb5741ad422f04d0bac60c9b6c07183e0431ce8c",
  "model": "meta-llama/Llama-3.1-8B-Instruct",
  "status": "success",
  "error": null,
  "duration_s": 184.51438117027283,
  "metrics": {
    "ttft_mean_ms": 597.52,
    "ttft_median_ms": 572.46,
    "ttft_p99_ms": 958.22,
    "tpot_mean_ms": 22.96,
    "tpot_median_ms": 23.39,
    "tpot_p99_ms": 30.37,
    "itl_mean_ms": 22.96,
    "itl_median_ms": 16.98,
    "itl_p99_ms": 267.23,
    "request_throughput_req_s": 48.43,
    "output_token_throughput_tok_s": 3099.6,
    "total_token_throughput_tok_s": 14702.78
  },
  "raw_output": "  \n---------------Time to First Token----------------\nMean TTFT (ms):                          597.52    \nMedian TTFT (ms):                        572.46    \nP99 TTFT (ms):                           958.22    \n-----Time per Output Token (excl. 1st token)------\nMean TPOT (ms):                          22.96     \nMedian TPOT (ms):                        23.39     \nP99 TPOT (ms):                           30.37     \n---------------Inter-token Latency----------------\nMean ITL (ms):                           22.96     \nMedian ITL (ms):                         16.98     \nP99 ITL (ms):                            267.23    \n==================================================\n============ Serving Benchmark Result ============\nRequest throughput (req/s):              48.43     \nOutput token throughput (tok/s):         3099.60   \nTotal Token throughput (tok/s):          14702.78  \nMean TTFT (ms):                          597.52    \nMedian TTFT (ms):                        572.46    \nP99 TTFT (ms):                           958.22    \nMean TPOT (ms):                          22.96     \nMedian TPOT (ms):                        23.39     \nP99 TPOT (ms):                           30.37     \nMean ITL (ms):                           22.96     \nMedian ITL (ms):                         16.98     \nP99 ITL (ms):                            267.23    \n==================================================\nBENCHMARK_DONE\nUnable to find image 'anonymous/vllm-baseline:baseline-eb5741ad422f' locally\nbaseline-eb5741ad422f: Pulling from anonymous/vllm-baseline\n3c645031de29: Already exists\n0d6448aff889: Already exists\n0a7674e3e8fe: Already exists\nb71b637b97c5: Already exists\n56dc85502937: Already exists\nec6d5f6c9ed9: Already exists\n47b8539d532f: Already exists\nfd9cc1ad8dee: Already exists\n83525caeeb35: Already exists\n8e79813a7b9d: Already exists\n312a542960e3: Already exists\n13f82733044a: Pulling fs layer\n554440c0671d: Pulling fs layer\n89cd65458884: Pulling fs layer\n440b526b44ba: Pulling fs layer\n4f4fb700ef54: Pulling fs layer\n17f39a490c37: Pulling fs layer\n9889e41535e8: Pulling fs layer\nefbef095a354: Pulling fs layer\nf9995c96d79e: Pulling fs layer\nddb18e3863d8: Pulling fs layer\n24c078170905: Pulling fs layer\na18a37d83d19: Pulling fs layer\nd839ad5f02d4: Pulling fs layer\n550e4cb150fa: Pulling fs layer\nfd5f457f7a5b: Pulling fs layer\n8695bb5b0739: Pulling fs layer\n440b526b44ba: Waiting\ne391139eb97f: Pulling fs layer\nefbef095a354: Waiting\nddb18e3863d8: Waiting\nf9995c96d79e: Waiting\n24c078170905: Waiting\n5a8779266702: Pulling fs layer\nd839ad5f02d4: Waiting\na18a37d83d19: Waiting\n9b07c5c48f38: Pulling fs layer\n550e4cb150fa: Waiting\n8695bb5b0739: Waiting\nfd5f457f7a5b: Waiting\ne391139eb97f: Waiting\n1975c0e7e81b: Pulling fs layer\n5a8779266702: Waiting\n4f4fb700ef54: Waiting\n17f39a490c37: Waiting\n9b07c5c48f38: Waiting\n9889e41535e8: Waiting\n9c69f70a42ee: Pulling fs layer\n1975c0e7e81b: Waiting\n9c69f70a42ee: Waiting\n13f82733044a: Verifying Checksum\n13f82733044a: Download complete\n13f82733044a: Pull complete\n440b526b44ba: Verifying Checksum\n440b526b44ba: Download complete\n554440c0671d: Download complete\n554440c0671d: Pull complete\n4f4fb700ef54: Verifying Checksum\n4f4fb700ef54: Download complete\n89cd65458884: Verifying Checksum\n89cd65458884: Download complete\nefbef095a354: Verifying Checksum\nefbef095a354: Download complete\nf9995c96d79e: Verifying Checksum\nf9995c96d79e: Download complete\nddb18e3863d8: Verifying Checksum\nddb18e3863d8: Download complete\n9889e41535e8: Verifying Checksum\n9889e41535e8: Download complete\n24c078170905: Verifying Checksum\n24c078170905: Download complete\nd839ad5f02d4: Verifying Checksum\nd839ad5f02d4: Download complete\n550e4cb150fa: Verifying Checksum\n550e4cb150fa: Download complete\nfd5f457f7a5b: Verifying Checksum\nfd5f457f7a5b: Download complete\n8695bb5b0739: Verifying Checksum\n8695bb5b0739: Download complete\n89cd65458884: Pull complete\n440b526b44ba: Pull complete\n4f4fb700ef54: Pull complete\na18a37d83d19: Verifying Checksum\na18a37d83d19: Download complete\n5a8779266702: Verifying Checksum\n5a8779266702: Download complete\n9b07c5c48f38: Verifying Checksum\n9b07c5c48f38: Download complete\n1975c0e7e81b: Download complete\n9c69f70a42ee: Verifying Checksum\n9c69f70a42ee: Download complete\n17f39a490c37: Verifying Checksum\n17f39a490c37: Download complete\ne391139eb97f: Verifying Checksum\ne391139eb97f: Download complete\n17f39a490c37: Pull complete\n9889e41535e8: Pull complete\nefbef095a354: Pull complete\nf9995c96d79e: Pull complete\nddb18e3863d8: Pull complete\n24c078170905: Pull complete\na18a37d83d19: Pull complete\nd839ad5f02d4: Pull complete\n550e4cb150fa: Pull complete\nfd5f457f7a5b: Pull complete\n8695bb5b0739: Pull complete\ne391139eb97f: Pull complete\n5a8779266702: Pull complete\n9b07c5c48f38: Pull complete\n1975c0e7e81b: Pull complete\n9c69f70a42ee: Pull complete\nDigest: sha256:93e1e92e6ae066976661d25e48c012bd8457427223c7e2488a4f613c98ad59a4\nStatus: Downloaded newer image for anonymous/vllm-baseline:baseline-eb5741ad422f\n",
  "timestamp": "2026-01-14 18:02:07"
}